,Teks,stemming
342,Gais adakah yg pake ss spray nya the originote? Knp ya aku pake itu langsung sesek nafas kayak bau bgt gitu,gais ada yg pake ss spray nya the originote knp ya aku pake itu langsung sek nafas kayak bau bgt gitu
343,Aku juga pke retinol + moisturizer dri the originote sangat praktis udh pke retinol gausa pke moist lagi karna udh ada kandungan moistnya yg melembabkan https://t.co/1G6GELShJF https://t.co/e5fSaRcSF0,aku juga pke retinol moisturizer dri the originote sangat praktis udh pke retinol gausa pke moist lagi karna udh ada kandung moistnya yg melembabkan https t co 1g6gelshjf https t co e5fsarcsf0
344,sunscreen spray the originote b1g1 cuma 20k doang co dari sini https://t.co/h1t8KgCd7r https://t.co/pEk4RxCeBl,sunscreen spray the originote b1g1 cuma 20k doang co dari sini https t co h1t8kgcd7r https t co pek4rxcebl
345,restock the originote sebanyak ini cuman 178rb garagara lagi anniversary https://t.co/9cwsSmFt3l,restock the originote banyak ini cuman 178rb garagara lagi anniversary https t co 9cwssmft3l
346,Jb the originote micellar water 300ml jadi 30rb aja yuk setelah diskon voc video bj @sukadiskon20 https://t.co/oXU2n0v1ch,jb the originote micellar water 300ml jadi 30rb aja yuk telah diskon voc video bj sukadiskon20 https t co oxu2n0v1ch
347,siapa yang make the originote terus kemaren dapet buy 1 get 1 cunggg,siapa yang make the originote terus kemaren dapet buy 1 get 1 cunggg
348,The Originote micellar water isi 300 ml dgn harga 48k ingredients : hyaluronic acid allantoin dan rosa damascena flower water dia deep cleansing jadi after pemakaian wajah lebih lembab menyegarkan menenangkan wajah dan ga bikin wajah ketarik https://t.co/5b0mMQ3ZkP https://t.co/WPf1wuNr8w,the originote micellar water isi 300 ml dgn harga 48k ingredients hyaluronic acid allantoin dan rosa damascena flower water dia deep cleansing jadi after pakai wajah lebih lembab segar tenang wajah dan ga bikin wajah tarik https t co 5b0mmq3zkp https t co wpf1wunr8w
349,Jajal the originote yg glowing kit agar pas lebaran glowing aowkowk semoga cocok ya seng mana beli pas diskon free moisturizer yang gw incer hehe thx tiktokshop https://t.co/xbs7eu3Qk3,jajal the originote yg glowing kit agar pas lebaran glowing aowkowk moga cocok ya seng mana beli pas diskon free moisturizer yang gw incer hehe thx tiktokshop https t co xbs7eu3qk3
350, The Originote Micellar Foam Cleanser - Sabun Cuci Muka Busa Face Wash Facial Cleanser Membersihkan Wajah with Ceramide Ini linknya ya https://t.co/ntsfRHvLoQ https://t.co/Ib5874DGDD,the originote micellar foam cleanser - sabun cuci muka busa face wash facial cleanser bersih wajah with ceramide ini linknya ya https t co ntsfrhvloq https t co ib5874dgdd
351,*[ SHOPEE ]* Siap kirim The Originote Retinol B3 Serum https://t.co/n6KRatm0if https://t.co/njwhWIsmIK,shopee siap kirim the originote retinol b3 serum https t co n6kratm0if https t co njwhwismik
352,Anyway I like The Originote Cushion. Ringan sekali tap di busanya bisa buat cover semuka dan kmrn coba dipake kegiatan indoor ±4 jam minim oksidasi,anyway i like the originote cushion ringan sekali tap di busa bisa buat cover muka dan kmrn coba dipake giat indoor 4 jam minim oksidasi
353,eh gila itu retinol the originote sangat amat ampuh menghilangkan jerawat ‍️ bukan sulap bukan sihir,eh gila itu retinol the originote sangat amat ampuh hilang jerawat bukan sulap bukan sihir
354,Cek The Originote 24k Symwhite Jelly Booster - Serum Moisturizer Mencerahkan Meratakan Warna Kulit with Symwhite 377 dan Glutathione https://t.co/Y1gX0iE2M0 https://t.co/XjCzPOjIKR,cek the originote 24k symwhite jelly booster - serum moisturizer cerah rata warna kulit with symwhite 377 dan glutathione https t co y1gx0ie2m0 https t co xjczpojikr
355, ( READY STOK ) The Originote BHA Charcoal Clay Mask - Masker Wajah Mud Mask Originote BPOM Jangan sampai kehabisan https://t.co/1s6gmcK5qE https://t.co/rswVTZtQaz,ready stok the originote bha charcoal clay mask - masker wajah mud mask originote bpom jangan sampai habis https t co 1s6gmck5qe https t co rswvtztqaz
356,Iniii The Originote Lip Oil Serum yang siap melembabkan bibirmu sehariann https://t.co/bSCfxKXQZ3 https://t.co/kCpMLdKHHG,iniii the originote lip oil serum yang siap melembabkan bibir sehariann https t co bscfxkxqz3 https t co kcpmldkhhg
357,@ohmybeautybank aku pake the originote rekomended bgt buat cepet kempesin,ohmybeautybank aku pake the originote rekomended bgt buat cepet kempesin
358,The Originote High Cover Serum Cushion cek di sini https://t.co/v0jqTmEzCI https://t.co/PvGPRHsgjd,the originote high cover serum cushion cek di sini https t co v0jqtmezci https t co pvgprhsgjd
359,Temukan THE ORIGINOTE CICAMIDE FACIAL CLEANSER 70GR seharga Rp18.000. Dapatkan sekarang juga di Shopee! https://t.co/6bFNncnHV8 https://t.co/E3RVT2Gv0t,temu the originote cicamide facial cleanser 70gr harga rp18 000 dapat sekarang juga di shopee https t co 6bfnncnhv8 https t co e3rvt2gv0t
360, ( READY STOK ) The Originote BHA Charcoal Clay Mask - Masker Wajah Mud Mask Originote BPOM Jangan sampai kehabisan https://t.co/28608guuTw https://t.co/GHwZnOwiHW,ready stok the originote bha charcoal clay mask - masker wajah mud mask originote bpom jangan sampai habis https t co 28608guutw https t co ghwznowihw
361,Rekomendasi facial wash sabun cuci muka The originote micellar foam cleanser ️ https://t.co/a8Nh9W6txd Dengan kandungan 10× amino acid 3× ceramide membantu membersihkan menjaga dan merawat kelembapan kulit #racunskincare #racunshopee #shopeeaffiliate #zonauang️ https://t.co/omck0Ospv3,rekomendasi facial wash sabun cuci muka the originote micellar foam cleanser https t co a8nh9w6txd dengan kandung 10 amino acid 3 ceramide bantu bersih jaga dan rawat lembap kulit racunskincare racunshopee shopeeaffiliate zonauang https t co omck0ospv3
362,WTS MOIST THE ORIGINOTE Moistrurizer the originote 30k Baru 2x pemakaian dijual karna ga cocok DOM PRABUMULIH -SUMATERA SELATAN BISA CHECK OUT SHOPEE https://t.co/3XqWoMvKd2,wts moist the originote moistrurizer the originote 30k baru 2x pakai jual karna ga cocok dom prabumulih -sumatera selatan bisa check out shopee https t co 3xqwomvkd2
363, The Originote Micellar Foam Cleanser - Sabun Cuci Muka Busa Face Wash Facial Cleanser Membersihkan Wajah with Ceramide Dapatkan sekarang juga di Shopee! https://t.co/fUWPvbPRMW https://t.co/lNvFgSZTCo,the originote micellar foam cleanser - sabun cuci muka busa face wash facial cleanser bersih wajah with ceramide dapat sekarang juga di shopee https t co fuwpvbprmw https t co lnvfgsztco
364, The Originote Micellar Foam Cleanser - Sabun Cuci Muka Busa Face Wash Facial Cleanser Membersihkan Wajah with Ceramide Checkout Sekarang https://t.co/MRraAQD8uh https://t.co/lelm1ayRjG,the originote micellar foam cleanser - sabun cuci muka busa face wash facial cleanser bersih wajah with ceramide checkout sekarang https t co mrraaqd8uh https t co lelm1ayrjg
365,WTS Preloved The Originote Gluta Bright B3 Serum 20ml - dijual karena udah ganti merk lain - masih bagus - isinya kira2 masih 70% - price 17.999 - link : https://t.co/cds2a6l5NM - link shopee video https://t.co/aRtkTHd0xg https://t.co/78kG340H5i,wts preloved the originote gluta bright b3 serum 20ml - jual karena udah ganti merk lain - masih bagus - isi kira2 masih 70 - price 17 999 - link https t co cds2a6l5nm - link shopee video https t co artkthd0xg https t co 78kg340h5i
366,@unearthad Aku engga pake keduanya tapi my go-to cushion is Guele atau The Originote Love.,unearthad aku engga pake dua tapi my go-to cushion is guele atau the originote love
367,Temukan dan dapatkan The Originote Bundle Extra Brightening - Gluta B3 Serum + 24K Jelly Booster + Brightening Moisturizer hanya Rp108.280 di Shopee sekarang juga! https://t.co/kIQLBJVi1F #ShopeeID https://t.co/H1HAWEXLkb,temu dan dapat the originote bundle extra brightening - gluta b3 serum 24k jelly booster brightening moisturizer hanya rp108 280 di shopee sekarang juga https t co kiqlbjvi1f shopeeid https t co h1hawexlkb
368,THE ORIGINOTE Ada diskon 50% nih jadi Rp188.000. Cek di Tokopedia deh https://t.co/OF49imWls6 https://t.co/Iux7oBVy7r,the originote ada diskon 50 nih jadi rp188 000 cek di tokopedia deh https t co of49imwls6 https t co iux7obvy7r
369,The Originote Ceratinol Moisturizer - Retinol Cream Gel Serum Pelembab Wajah Menyamarkan Garis Halus Mengencangkan Wajah with Retinol Ceramide Link: https://t.co/FreZ3WcA5a https://t.co/fkPlFiOQV4,the originote ceratinol moisturizer - retinol cream gel serum pelembab wajah samar garis halus encang wajah with retinol ceramide link https t co frez3wca5a https t co fkplfioqv4
370,THE ORIGINOTE Ada diskon 49% nih jadi Rp164.000. Cek di Tokopedia deh https://t.co/tSveRnIm4v https://t.co/G5YBMrkkYv,the originote ada diskon 49 nih jadi rp164 000 cek di tokopedia deh https t co tsvernim4v https t co g5ybmrkkyv
371,The Originote High Cover Serum Cushion dengan harga Rp92.000. Dapatkan di Shopee sekarang! https://t.co/9UOtJ9w7a7 https://t.co/4nNKNcXETt,the originote high cover serum cushion dengan harga rp92 000 dapat di shopee sekarang https t co 9uotj9w7a7 https t co 4nnkncxett
372,The Originote High Cover Serum Cushion hanya Rp89.000 di Shopee sekarang juga! https://t.co/kbYn56HqpE #ShopeeID https://t.co/oQZaMa5KuK,the originote high cover serum cushion hanya rp89 000 di shopee sekarang juga https t co kbyn56hqpe shopeeid https t co oqzama5kuk
373,Rekomendasi serum anti aging untuk menyamarkan garis halus dan meratakan warna kulit The Originote Retinol B3 Serum ️ https://t.co/snguEBTmGs Dilengkapi dengan 3 jenis vitamin A dan Niacinamide #racunskincare #racunshopee #shopeeaffiliate #zonauang️ #ShopeeID https://t.co/OPDY694R5H,rekomendasi serum anti aging untuk samar garis halus dan rata warna kulit the originote retinol b3 serum https t co snguebtmgs lengkap dengan 3 jenis vitamin a dan niacinamide racunskincare racunshopee shopeeaffiliate zonauang shopeeid https t co opdy694r5h
374,wts the originote peeling solution serum (serum eksfoliasi) 25k via shopee ️ dom karawang https://t.co/6z6ygtgWUO,wts the originote peeling solution serum serum eksfoliasi 25k via shopee dom karawang https t co 6z6ygtgwuo
375,the originote lagi buy 1 get 1 khusus hari ini aja dan cuma produk ini aja sih yg buy 1 get 1 *cmiiw sunscreen: https://t.co/8geY0dgcmg clay mask: https://t.co/iP6fGUnmum ceratinol: https://t.co/QKac1RNDPC https://t.co/6ILXQfEcQr,the originote lagi buy 1 get 1 khusus hari ini aja dan cuma produk ini aja sih yg buy 1 get 1 cmiiw sunscreen https t co 8gey0dgcmg clay mask https t co ip6fgunmum ceratinol https t co qkac1rndpc https t co 6ilxqfecqr
376, The Originote BHA Charcoal Clay Mask - Masker Wajah Mud Mask Eksfoliasi Mengangkat Sel Kulit Mati Menghilangkan Minyak B... Gercep mumpung Flashsale https://t.co/2rsmsY4uNi https://t.co/ov4mq85CZq,the originote bha charcoal clay mask - masker wajah mud mask eksfoliasi angkat sel kulit mati hilang minyak b gercep mumpung flashsale https t co 2rsmsy4uni https t co ov4mq85czq
377, The Originote Ceratinol Moisturizer - Retinol Cream Gel Serum Pelembab Wajah Menyamarkan Garis Halus Mengencangkan Wajah... Ini linknya ya https://t.co/wJBmADda2C https://t.co/vVRvRc7LWw,the originote ceratinol moisturizer - retinol cream gel serum pelembab wajah samar garis halus encang wajah ini linknya ya https t co wjbmadda2c https t co vvrvrc7lww
378,*[ LAZADA ]* [BUY 1 GET 1] The Originote Ceratinol Moisturizer 50gr Moisturizer Cream Pelembab Wajah Menyamarkan Garis Halus Meratakan Warna Kulit Mengencangkan Wajah | https://t.co/l1wsifSYTG https://t.co/TMomC5U4Qx,lazada buy 1 get 1 the originote ceratinol moisturizer 50gr moisturizer cream pelembab wajah samar garis halus rata warna kulit encang wajah https t co l1wsifsytg https t co tmomc5u4qx
379, The Originote Acne B5 Serum - Serum Anti Acne Anti Inflamasi untuk Merawat dan Mencegah Pertumbuhan Jerawat with Salicyl... Checkout Sekarang https://t.co/OPpeBbggeo https://t.co/sijzVYJqME,the originote acne b5 serum - serum anti acne anti inflamasi untuk rawat dan cegah tumbuh jerawat with salicyl checkout sekarang https t co oppebbggeo https t co sijzvyjqme
380,Rekomendasi masker wajah untuk menenangkan dan merawat kulit berjerawat serta mengeksfoliasi wajah The Originote Mugwort B3 Clay Stick Mask ️ https://t.co/YYBYPW1TTh #racunskincare #racunshopee #shopeeaffiliate #zonauang️ #ShopeeID https://t.co/pdH6Vd0MJ9,rekomendasi masker wajah untuk tenang dan rawat kulit jerawat serta eksfoliasi wajah the originote mugwort b3 clay stick mask https t co yybypw1tth racunskincare racunshopee shopeeaffiliate zonauang shopeeid https t co pdh6vd0mj9
381,beneran habis rest zazan pc invest-nya ke skinker wkwk ily the originote the most https://t.co/mWYqrhvFhX,beneran habis rest zazan pc invest-nya ke skinker wkwk ily the originote the most https t co mwyqrhvfhx
382,Mau nanya dong somethinc kan masuk rate 9 5/10 tapi di thread kamu nyebutin kalo dia belum ada minus nya kenapa kok malah rate the originote lebih tinggi drpd somethinc ya?,mau nanya dong somethinc kan masuk rate 9 5 10 tapi di thread kamu nyebutin kalo dia belum ada minus nya kenapa kok malah rate the originote lebih tinggi drpd somethinc ya
383,￼The Originote Hyalurose Micellar Water - 300ml Pembersih Wajah Make Up Remover Cleansing Water dan Melembabkan Wajah with Hyaluronic Acid #ShopeeID https://t.co/GDkARzs8QA https://t.co/9nekL59yts,the originote hyalurose micellar water - 300ml bersih wajah make up remover cleansing water dan melembabkan wajah with hyaluronic acid shopeeid https t co gdkarzs8qa https t co 9nekl59yts
384, ( READY STOK ) The Originote BHA Charcoal Clay Mask - Masker Wajah Mud Mask Originote BPOM Ini linknya ya https://t.co/6C2qcoeo0w https://t.co/5qi8IpZbA7,ready stok the originote bha charcoal clay mask - masker wajah mud mask originote bpom ini linknya ya https t co 6c2qcoeo0w https t co 5qi8ipzba7
385,WTS Preloved The Originote Gluta Bright B3 Serum 20ml - dijual karena udah ganti merk lain - masih bagus - isinya kira2 masih 70% - price 17.999 - link : https://t.co/cds2a6l5NM - link shopee video https://t.co/aRtkTHd0xg https://t.co/vicd310f5j,wts preloved the originote gluta bright b3 serum 20ml - jual karena udah ganti merk lain - masih bagus - isi kira2 masih 70 - price 17 999 - link https t co cds2a6l5nm - link shopee video https t co artkthd0xg https t co vicd310f5j
386,jb wts preloved retinol the originote. jarang dipake 15k aja (after vc video) exp 2026 dom jateng bisa (toko udh gratong xtra) dm @/araasure https://t.co/BueSkNZqxc,jb wts preloved retinol the originote jarang dipake 15k aja after vc video exp 2026 dom jateng bisa toko udh gratong xtra dm araasure https t co buesknzqxc
387,Rekomendasi cushion high coverage The Originote spf 35 pa+++ ️ https://t.co/TkkUkWYzLZ ️ Cushion dengan tekstur ringan dan full coverage ️ Finishnya matte ️ Cocok untuk semua jenis kulit #racunmakeup #racunskincare #ShopeeID #shopeeaffiliate #zonauang https://t.co/2iNn82ARo0,rekomendasi cushion high coverage the originote spf 35 pa https t co tkkukwyzlz cushion dengan tekstur ringan dan full coverage finishnya matte cocok untuk semua jenis kulit racunmakeup racunskincare shopeeid shopeeaffiliate zonauang https t co 2inn82aro0
388,@sehunielof_ aku beli the originate enak sih menurutku pas dipake adem terus juga emang bersihinnya ngaruh dan ga perih,sehunielof aku beli the originate enak sih turut pas dipake adem terus juga emang bersihinnya ngaruh dan ga perih
389, The Originote Ceratinol Moisturizer - Retinol Cream Gel Serum Pelembab Wajah Menyamarkan Garis Halus Mengencangkan Wajah... Ini linknya ya https://t.co/C7aBmqWNDv https://t.co/wf3LqgYcPx,the originote ceratinol moisturizer - retinol cream gel serum pelembab wajah samar garis halus encang wajah ini linknya ya https t co c7abmqwndv https t co wf3lqgycpx
390, The Originote Ceratinol Moisturizer - Retinol Cream Gel Serum Pelembab Wajah Menyamarkan Garis Halus Mengencangkan Wajah... Ini linknya ya https://t.co/C7aBmqWNDv https://t.co/yGMMlh58Tf,the originote ceratinol moisturizer - retinol cream gel serum pelembab wajah samar garis halus encang wajah ini linknya ya https t co c7abmqwndv https t co ygmmlh58tf
391,Cek The Originote 2in1 Lash and Brow Serum Eye Lash Serum Eyelash Serum Penebal Menebalkan Bulu Mata Alis Biotin dengan harga Rp36.000. Dapatkan di Shopee sekarang! https://t.co/5iPqAQT4Aq https://t.co/1mE9LOZRiD,cek the originote 2in1 lash and brow serum eye lash serum eyelash serum tebal tebal bulu mata alis biotin dengan harga rp36 000 dapat di shopee sekarang https t co 5ipqaqt4aq https t co 1me9lozrid
392, The Originote Cica-B5 Soothing Essence Toner - Toner Wajah Menenangkan Kulit Kemerahan dan Menyegarkan Wajah with Centel... Jangan sampai kehabisan https://t.co/ye1Qvl6ZM8 https://t.co/TlVguGWSrB,the originote cica-b5 soothing essence toner - toner wajah tenang kulit merah dan segar wajah with centel jangan sampai habis https t co ye1qvl6zm8 https t co tlvgugwsrb
393,Cek The Originote Mugwort B3 Clay Stick Mask - Masker Wajah Mugwort Acne Menenangkan dan Membuat Wajah Kencang dan Halus with Niacinamide dengan harga Rp38.000. Dapatkan di Shopee sekarang! https://t.co/c5WJniir7o https://t.co/qgBKOZUh0D,cek the originote mugwort b3 clay stick mask - masker wajah mugwort acne tenang dan buat wajah kencang dan halus with niacinamide dengan harga rp38 000 dapat di shopee sekarang https t co c5wjniir7o https t co qgbkozuh0d
394,Kemarin aku sempet tunjukkin swatches all shades dari cushion The Originote tapi pasti masih bingung juga kan mana shade yang pas. Nah bisa banget buat coba filternya di sini ya ⤵️ https://t.co/Tt46ShzGDc,kemarin aku sempet tunjukkin swatches all shades dari cushion the originote tapi pasti masih bingung juga kan mana shade yang pas nah bisa banget buat coba filter di sini ya https t co tt46shzgdc
395,Rekomendasi cushion yang oke banget hasilnya Cek The Originote High Cover Serum Cushion dengan harga Rp92.000. Dapatkan di Shopee sekarang! https://t.co/yOV5k63tsr https://t.co/VIKQebLzLF,rekomendasi cushion yang oke banget hasil cek the originote high cover serum cushion dengan harga rp92 000 dapat di shopee sekarang https t co yov5k63tsr https t co vikqeblzlf
396,Cek The Originote Hyalurose Micellar Water - 300ml Pembersih Wajah Make Up Remover Cleansing Water dan Melembabkan Wajah with Hyaluronic Acid dengan harga Rp48.000. Dapatkan di Shopee sekarang! https://t.co/0yxYzFp7OO #ShopeeID https://t.co/VeyWVcqPCr,cek the originote hyalurose micellar water - 300ml bersih wajah make up remover cleansing water dan melembabkan wajah with hyaluronic acid dengan harga rp48 000 dapat di shopee sekarang https t co 0yxyzfp7oo shopeeid https t co veywvcqpcr
397,Buat kalian yang mau belii bisa klik di sini yaa https://t.co/orY8nnvnOE,buat kalian yang mau beli bisa klik di sini yaa https t co ory8nnvnoe
398, ( READY STOK ) The Originote BHA Charcoal Clay Mask - Masker Wajah Mud Mask Originote BPOM Belinya disini https://t.co/UgS0ElAdfO https://t.co/EQmzY42Gf4,ready stok the originote bha charcoal clay mask - masker wajah mud mask originote bpom beli sini https t co ugs0eladfo https t co eqmzy42gf4
399, ( READY STOK ) The Originote BHA Charcoal Clay Mask - Masker Wajah Mud Mask Originote BPOM Jangan sampai kehabisan https://t.co/mPImdmdX8l https://t.co/eZhOAxQweH,ready stok the originote bha charcoal clay mask - masker wajah mud mask originote bpom jangan sampai habis https t co mpimdmdx8l https t co ezhoaxqweh
400,Temukan dan dapatkan The Originote High Cover Serum Cushion hanya Rp89.000 di Shopee sekarang juga! https://t.co/GbJJjKQtEy #ShopeeID https://t.co/v5FUrUynL7,temu dan dapat the originote high cover serum cushion hanya rp89 000 di shopee sekarang juga https t co gbjjjkqtey shopeeid https t co v5furuynl7
401,@ohmybeautybank gapernah bosen nyaranin the originote yg gentong ini https://t.co/0bBD2SkhOs,ohmybeautybank gapernah bosen nyaranin the originote yg gentong ini https t co 0bbd2skhos
402,Flash Sale Seru 16.00WIB 10rb https://t.co/xIPXiv90EY The originote ss Implora eyeliner etc 20rb https://t.co/Ld0FlHRJkX Santan bubuk 500gr Orange essential oil etc 30rb https://t.co/SuDj8i5rEg His erha acne fw 70rb Ayana Beras Premium 5kg https://t.co/r9UN1dif9N https://t.co/DEIpRGMCyJ,flash sale seru 16 00wib 10rb https t co xipxiv90ey the originote ss implora eyeliner etc 20rb https t co ld0flhrjkx santan bubuk 500gr orange essential oil etc 30rb https t co sudj8i5reg his erha acne fw 70rb ayana beras premium 5kg https t co r9un1dif9n https t co deiprgmcyj
403,Flash sale the originote - klaim voucher toko biar lebih murah - urutkan harga terendah https://t.co/EgEvTR0oUs,flash sale the originote - klaim voucher toko biar lebih murah - urut harga rendah https t co egevtr0ous
404, ( READY STOK ) The Originote BHA Charcoal Clay Mask - Masker Wajah Mud Mask Originote BPOM Belinya disini https://t.co/z0YdNH0Trd https://t.co/cWfrdjbiPB,ready stok the originote bha charcoal clay mask - masker wajah mud mask originote bpom beli sini https t co z0ydnh0trd https t co cwfrdjbipb
405,@starbyulamaze Mjb iya harga diskon plus pake voc toko bisa combo live jg https://t.co/MI6qjD0JJl,starbyulamaze mjb iya harga diskon plus pake voc toko bisa combo live jg https t co mi6qjd0jjl
406, ( READY STOK ) The Originote BHA Charcoal Clay Mask - Masker Wajah Mud Mask Originote BPOM Belinya disini https://t.co/7h0gvMxfl8 https://t.co/VBwyaeZjht,ready stok the originote bha charcoal clay mask - masker wajah mud mask originote bpom beli sini https t co 7h0gvmxfl8 https t co vbwyaezjht
407,Cek The Originote High Cover Serum Cushion dengan harga Rp92.000. Dapatkan di Shopee sekarang! https://t.co/JzBOf7cmna https://t.co/Gt2F5SQnoc,cek the originote high cover serum cushion dengan harga rp92 000 dapat di shopee sekarang https t co jzbof7cmna https t co gt2f5sqnoc
408, mau tanya. the originote cushion itu water based atau silicone based ya guys?,mau tanya the originote cushion itu water based atau silicone based ya guys
409, The Originote Ceratinol Moisturizer - Retinol Cream Gel Serum Pelembab Wajah Menyamarkan Garis Halus Mengencangkan Wajah... Belinya disini https://t.co/9lY8uWgPRX https://t.co/VMm4okSFwP,the originote ceratinol moisturizer - retinol cream gel serum pelembab wajah samar garis halus encang wajah beli sini https t co 9ly8uwgprx https t co vmm4oksfwp
410,Cek The Originote High Cover Serum Cushion dengan harga Rp92.000. Dapatkan di Shopee sekarang! https://t.co/iqFMnUWpOu https://t.co/aywWt2hRoH,cek the originote high cover serum cushion dengan harga rp92 000 dapat di shopee sekarang https t co iqfmnuwpou https t co aywwt2hroh
411, The Originote Acne B5 Serum - Serum Anti Acne Anti Inflamasi untuk Merawat dan Mencegah Pertumbuhan Jerawat with Salicyl... Checkout Sekarang https://t.co/ndCvX9a8Jh https://t.co/DPSAzvd5UJ,the originote acne b5 serum - serum anti acne anti inflamasi untuk rawat dan cegah tumbuh jerawat with salicyl checkout sekarang https t co ndcvx9a8jh https t co dpsazvd5uj
412,Temukan dan dapatkan The Originote High Cover Serum Cushion hanya Rp89.000 di Shopee sekarang juga! https://t.co/IUGMgQmCBR #ShopeeID https://t.co/bByfBJkHAO,temu dan dapat the originote high cover serum cushion hanya rp89 000 di shopee sekarang juga https t co iugmgqmcbr shopeeid https t co bbyfbjkhao
413, The Originote Ceratinol Moisturizer - Retinol Cream Gel Serum Pelembab Wajah Menyamarkan Garis Halus Mengencangkan Wajah... Belinya disini https://t.co/GMWdmA1ElX https://t.co/IV7907uJYM,the originote ceratinol moisturizer - retinol cream gel serum pelembab wajah samar garis halus encang wajah beli sini https t co gmwdma1elx https t co iv7907ujym
414,Temen-temen yang masih bingung sama shades The Originote bisa cek filter ini yaaah https://t.co/oE5MTz3pFV,temen-temen yang masih bingung sama shades the originote bisa cek filter ini yaaah https t co oe5mtz3pfv
415,The Originote Hyalurose Micellar Water - 300ml Pembersih Wajah Make Up Remover Cleansing Water dan Melembabkan Wajah with Hyaluronic Acid Rp48.000. https://t.co/EQM683qYMz https://t.co/M2qRGVGHly,the originote hyalurose micellar water - 300ml bersih wajah make up remover cleansing water dan melembabkan wajah with hyaluronic acid rp48 000 https t co eqm683qymz https t co m2qrgvghly
416,Temukan dan dapatkan The Originote High Cover Serum Cushion hanya Rp89.000 di Shopee sekarang juga! https://t.co/IUGMgQnarp #ShopeeID https://t.co/7SRGLqAW5r,temu dan dapat the originote high cover serum cushion hanya rp89 000 di shopee sekarang juga https t co iugmgqnarp shopeeid https t co 7srglqaw5r
417,Ini tes oksidasinyaaa Review lengkap cushion the originote aku taruh disini ya! -- https://t.co/UoGlMlju1U https://t.co/6USYBJtmF2,ini tes oksidasinyaaa review lengkap cushion the originote aku taruh sini ya -- https t co uoglmlju1u https t co 6usybjtmf2
418,trus makin lama tuh makin bagus gitu lhoo makin nyatu sama kulit tahan lama fix aku mau repurchase!! untung harganya under 100K murah banget buat cushion sebagus ini https://t.co/Mx67K64KoC,trus makin lama tuh makin bagus gitu lhoo makin nyatu sama kulit tahan lama fix aku mau repurchase untung harga under 100k murah banget buat cushion bagus ini https t co mx67k64koc
419,Cek The Originote High Cover Serum Cushion dengan harga Rp92.000. Dapatkan di Shopee sekarang! https://t.co/5kJ6HjCcnq https://t.co/e8TJUkmNkC,cek the originote high cover serum cushion dengan harga rp92 000 dapat di shopee sekarang https t co 5kj6hjccnq https t co e8tjukmnkc
420,harganya brp kakk? LAGI DISC JADI 60RB AN guyss https://t.co/KMT4NT8Pjc,harga brp kakk lagi disc jadi 60rb an guyss https t co kmt4nt8pjc
