,stop_word,stemming
293,nemu promo menarik lazada yuk coba lihat nama produk special bundle in originote moisturizer serum payday sale harga produk rp harga diskon rp,nemu promo tarik lazada yuk coba lihat nama produk special bundle in originote moisturizer serum payday sale harga produk rp harga diskon rp
294,originote official shop hemat belanja skincare originote official promo bebas ongkos kirim buruan cek promo tokopedia shopee skincare beauty makeup kosmetik glowing viral originote,originote official shop hemat belanja skincare originote official promo bebas ongkos kirim buru cek promo tokopedia shopee skincare beauty makeup kosmetik glowing viral originote
295,christmas skincare originote jerawat mengatasijerawat moisturizer hyalucera moisturizer pelembab wajah sesuai jenis kulit bagus menghidrasi kulit wajah membantu menyembuhkan breakout yuuk dicheck out say,christmas skincare originote jerawat mengatasijerawat moisturizer hyalucera moisturizer pelembab wajah sesuai jenis kulit bagus hidrasi kulit wajah bantu sembuh breakout yuuk dicheck out say
296,coba cek originote cicab soothing moisturizer rp toko originote official shop tokopedia bebas ongkos kirim lho originote theoriginote breakout skincare,coba cek originote cicab soothing moisturizer rp toko originote official shop tokopedia bebas ongkos kirim lho originote theoriginote breakout skincare
297,informasi berbagi produk skincare ramai banget nihh harga terjangkau originote,informasi bagi produk skincare ramai banget nihh harga jangkau originote
298,hai teman-teman suka produk originote memakai high cover serum cushion buruan checkout teman-teman theoriginote cushion beautycare makeup highcoverserumcushion originote shopee promo,hai teman suka produk originote pakai high cover serum cushion buru checkout teman theoriginote cushion beautycare makeup highcoverserumcushion originote shopee promo
299,wow hadir filter pilih shade cushion originote bantu banget mencoba cushion originote bingung pilih shadenya langsung cuss ig,wow hadir filter pilih shade cushion originote bantu banget coba cushion originote bingung pilih shadenya langsung cuss ig
300,cushion orijinot bagus shadenya miripmirip bingung nihh filter shade finder cari shade cushion originote match skintone,cushion orijinot bagus shadenya miripmirip bingung nihh filter shade finder cari shade cushion originote match skintone
301,begadang terlambat bangun lupa apus makeup pdhl micellar water originote super honestly bagus banget bersihin makeupku blush on dempul susah banget bersihin,begadang lambat bangun lupa apus makeup pdhl micellar water originote super honestly bagus banget bersihin makeupku blush on dempul susah banget bersihin
302,teman-teman all shades originote cushion penasaran tunjukin,teman all shades originote cushion penasaran tunjukin
303,originote mempermudah bingung pilih shade cushion khawatir salah shade filter this shades finder by originote,originote mudah bingung pilih shade cushion khawatir salah shade filter this shades finder by originote
304,disuruh milih tim originote tim sea makeup,suruh milih tim originote tim sea makeup
305,bingung membeli cushion kasih battle cushion lokal bagus normal to oily skin originote x true to skin x instaperfect review jujur sesuai pemakaian kulit lupa bookmark yaa referensi,bingung beli cushion kasih battle cushion lokal bagus normal to oily skin originote x true to skin x instaperfect review jujur sesuai pakai kulit lupa bookmark yaa referensi
306,hasil sebulan pakai retinooll terima kasih originote bekas bekas jrawat gwe pudar,hasil bulan pakai retinooll terima kasih originote bekas bekas jrawat gwe pudar
307,membeli cushion originote udah lihat swatch ditangan bingung chill filternya iya filter bingung pilih shades langsung coba pake filter shades originote instagram teman-teman,beli cushion originote udah lihat swatch tang bingung chill filter iya filter bingung pilih shades langsung coba pake filter shades originote instagram teman
308,originote high cover serum cushion shock banget cushion shock hasilnyaa cakeepp banget akuu cushion under reviewbynurqalbi makeupbynurqalbi racuninmakeup,originote high cover serum cushion shock banget cushion shock hasilnyaa cakeepp banget akuu cushion under reviewbynurqalbi makeupbynurqalbi racuninmakeup
309,iseng mencoba filter cushion originote shade pakai sesuai diliat filter ehh udah udah filternya solusi bingung pilih shade akuratt filternya,iseng coba filter cushion originote shade pakai sesuai liat filter ehh udah udah filter solusi bingung pilih shade akuratt filter
310,pakai theoriginote enak ga perih wangi,pakai theoriginote enak ga perih wangi
311,ehh cushion originote filternya ig masaa keterangan undertonenya jugaak gampang nentuin shade sesuai,ehh cushion originote filter ig masaa terang undertonenya jugaak gampang nentuin shade sesuai
312,teman-teman peeling serum originote penggunaannya dibilas kaya pakai serum iya,teman peeling serum originote guna bilas kaya pakai serum iya
313,originote micellar water bagus banget hapus makeup wanginya harum isinya pol awet harga terjangkau sesuai jenis kulit,originote micellar water bagus banget hapus makeup wangi harum isi pol awet harga jangkau sesuai jenis kulit
314,thing kelebihan cushion originote coveragenya mantap ttp kerasa ringan sesuai banget daily puasa gini muka keringnya hasil wajah flawless ga dempul,thing lebih cushion originote coveragenya mantap ttp rasa ringan sesuai banget daily puasa gin muka kering hasil wajah flawless ga dempul
315,originote brand,originote brand
316,memakai originote sea makeup bingung memakai bareng beda dimana,pakai originote sea makeup bingung pakai bareng beda mana
317,bagusan moist theoriginote gldglw bingung,bagus moist theoriginote gldglw bingung
318,mu gaes preloved originote full kepakai x dom pontianak iya,mu gaes preloved originote full pakai x dom pontianak iya
319,last tahap moisturizer acne prone skin banyqk redness wajah pakai moist originote cica calming ringan banget kena kulit langsung adem loo ga lengket pastinya murcee iya shay,last tahap moisturizer acne prone skin banyqk redness wajah pakai moist originote cica calming ringan banget kena kulit langsung adem loo ga lengket pasti murcee iya shay
320,originote cushion under bagus banget iya dikulitku oily cepat longsor minyakan teksturnya lightweight sesuai daily,originote cushion under bagus banget iya kulit oily cepat longsor minyak tekstur lightweight sesuai daily
321,langsung complexion suka bgtbgt pakai cushion originote sehari pakee punyaku shade tan warm deep warm kali pakai tan warm cinta gampang diblend high coverage menyatu kulit,langsung complexion suka bgtbgt pakai cushion originote hari pakee punya shade tan warm deep warm kali pakai tan warm cinta gampang diblend high coverage satu kulit
322,freeclaim moisturizer originote sesuai wkwkwkw bayar pack admin,freeclaim moisturizer originote sesuai wkwkwkw bayar pack admin
323,originote aktivitasnya outdoor sesuai banget,originote aktivitas outdoor sesuai banget
324,originote ceratinol moisturizer retinol cream gel serum pelembab wajah menyamarkan garis halus mengencangkan wajah with retinol ceramide flash sale teman-teman,originote ceratinol moisturizer retinol cream gel serum pelembab wajah samar garis halus encang wajah with retinol ceramide flash sale teman
325,originote micellar water anjing kupake x gacocok alias perih bund area mata membeli hanasuiemina sayang banget pekerjaan,originote micellar water anjing kupake x gacocok alias perih bund area mata beli hanasuiemina sayang banget kerja
326,review produk originote micellar water nyangka segede micellar water harganya honest review iya wanginya enak wangi rose gitu tekstunya cair warnya bening,review produk originote micellar water nyangka gede micellar water harga honest review iya wangi enak wangi rose gitu tekstunya cair warnya bening
327,pakainya kakk okayy tunjukin buka dl instagram search theoriginote section filter pilih cushion filter udah tinggal dipaspasin warna kulit memakai shade terang neutral iya,pakai kakk okayy tunjukin buka dl instagram search theoriginote section filter pilih cushion filter udah tinggal dipaspasin warna kulit pakai shade terang neutral iya
328,bucin micellar water originote botol botol ketiga micellar water feels like toner ga kering ga perih dimata dermatology tested made in best beauty factory dikenal cosmax,bucin micellar water originote botol botol tiga micellar water feels like toner ga kering ga perih mata dermatology tested made in best beauty factory kenal cosmax
329,semenjak nambahin retinol tahap skincare berasa banget kulitku seger cerah sehat pake originote beginners friendly kali memakai kerasa cekitcekit pemakaian,semenjak nambahin retinol tahap skincare asa banget kulit seger cerah sehat pake originote beginners friendly kali pakai rasa cekitcekit pakai
330,cek buy get originote niaceramide sunscreen mist spf pa sunscreen spray melindungi wajah sinar matahari mencerahkan with niacinamide ceramide harga rp,cek buy get originote niaceramide sunscreen mist spf pa sunscreen spray lindung wajah sinar matahari cerah with niacinamide ceramide harga rp
331,worth micellar water sea memakai up originote pliss pendapatt,worth micellar water sea pakai up originote pliss pendapatt
332,originote lip oil serum x ga terpakai rp wtb,originote lip oil serum x ga pakai rp wtb
333,penilaianku urutan favorit originote somethinc hooman wardah colorfit true to skin based on pemakaian berkalikali harga kecocokan kulit muka kondisi overall suka plus minus,nilai urut favorit originote somethinc hooman wardah colorfit true to skin based on pakai berkalikali harga cocok kulit muka kondisi overall suka plus minus
334,jualaness bersegel originote moisturizer cica ori yaa exp minat rep iya,jualaness segel originote moisturizer cica ori yaa exp minat rep iya
335,pakai moist originote cica sesuai cekat cekit numbuh bruntus jerawat pakai kirakira aman iya centella cica bahannya beda,pakai moist originote cica sesuai cekat cekit numbuh bruntus jerawat pakai kirakira aman iya centella cica bahan beda
336,my savior pagisiang pakai buttered malemsebelum tidur pakai lip serum originote alhamdulillah bibir cerahan,my savior pagisiang pakai buttered malemsebelum tidur pakai lip serum originote alhamdulillah bibir cerah
337,amaterasun pergi originote azarine pakai rumah gantian,amaterasun pergi originote azarine pakai rumah ganti
338,teman-teman membeli originote buyget dateng barang emang vid unbox saking excitednya complain ttp btt abiss,teman beli originote buyget dateng barang emang vid unbox saking excitednya complain ttp btt abiss
339,pakai lippies hanasui pilihan pertamaku lippies murah bagus nyaman hanasui finishnya ga kering shade topper pakai lip oil originote cantul,pakai lippies hanasui pilih pertama lippies murah bagus nyaman hanasui finishnya ga kering shade topper pakai lip oil originote cantul
340,moisturizer originote segel exp ajaa dom cimahi oren,moisturizer originote segel exp ajaa dom cimahi oren
341,shopee originote mugwort b clay stick mask masker wajah mugwort acne menenangkan wajah kencang halus,shopee originote mugwort b clay stick mask masker wajah mugwort acne tenang wajah kencang halus
342,gais adakah pakai spray originote iya pakai langsung sesek nafas kayak bau banget gitu,gais ada pakai spray originote iya pakai langsung sek nafas kayak bau banget gitu
343,pake retinol moisturizer originote praktis udah pake retinol gausa pake moist udah kandungan moistnya melembabkan,pake retinol moisturizer originote praktis udah pake retinol gausa pake moist udah kandung moistnya melembabkan
344,sunscreen spray originote abang checkout,sunscreen spray originote abang checkout
345,restock originote cuman anniversary,restock originote cuman anniversary
346,jb originote micellar water yuk diskon voc video bj,jb originote micellar water yuk diskon voc video bj
347,memakai originote kemarin buy get cungg,pakai originote kemarin buy get cungg
348,originote micellar water isi harga ingredients hyaluronic acid allantoin rosa damascena flower water deep cleansing after pemakaian wajah lembab menyegarkan menenangkan wajah ga wajah ketarik,originote micellar water isi harga ingredients hyaluronic acid allantoin rosa damascena flower water deep cleansing after pakai wajah lembab segar tenang wajah ga wajah tarik
349,jajal originote glowing kit lebaran glowing aowkowk semoga sesuai iya seng membeli diskon free moisturizer incer terima kasih tiktokshop,jajal originote glowing kit lebaran glowing aowkowk moga sesuai iya seng beli diskon free moisturizer incer terima kasih tiktokshop
350,originote micellar foam cleanser sabun cuci muka busa face wash facial cleanser membersihkan wajah with ceramide linknya iya,originote micellar foam cleanser sabun cuci muka busa face wash facial cleanser bersih wajah with ceramide linknya iya
351,shopee kirim originote retinol b serum,shopee kirim originote retinol b serum
352,anyway like originote cushion ringan tap busanya cover semuka kemarin coba kegiatan indoor jam oksidasi,anyway like originote cushion ringan tap busa cover muka kemarin coba giat indoor jam oksidasi
353,eh gila retinol originote ampuh menghilangkan jerawat sulap sihir,eh gila retinol originote ampuh hilang jerawat sulap sihir
354,cek originote symwhite jelly booster serum moisturizer mencerahkan meratakan warna kulit with symwhite glutathione,cek originote symwhite jelly booster serum moisturizer cerah rata warna kulit with symwhite glutathione
355,ready stok originote bha charcoal clay mask masker wajah mud mask originote bpom kehabisan,ready stok originote bha charcoal clay mask masker wajah mud mask originote bpom habis
356,inii originote lip oil serum melembabkan bibirmu sehariann,ini originote lip oil serum melembabkan bibir sehariann
357,pakai originote rekomended banget cepat kempesin,pakai originote rekomended banget cepat kempesin
358,originote high cover serum cushion cek,originote high cover serum cushion cek
359,temukan originote cicamide facial cleanser gede seharga rp dapatkan shopee,temu originote cicamide facial cleanser gede harga rp dapat shopee
360,ready stok originote bha charcoal clay mask masker wajah mud mask originote bpom kehabisan,ready stok originote bha charcoal clay mask masker wajah mud mask originote bpom habis
361,rekomendasi facial wash sabun cuci muka originote micellar foam cleanser kandungan amino acid ceramide membantu membersihkan menjaga merawat kelembapan kulit racunskincare racunshopee shopeeaffiliate,rekomendasi facial wash sabun cuci muka originote micellar foam cleanser kandung amino acid ceramide bantu bersih jaga rawat lembap kulit racunskincare racunshopee shopeeaffiliate
362,moist originote moistrurizer originote x pemakaian dijual ga sesuai dom prabumulih sumatera selatan check out shopee,moist originote moistrurizer originote x pakai jual ga sesuai dom prabumulih sumatera selatan check out shopee
363,originote micellar foam cleanser sabun cuci muka busa face wash facial cleanser membersihkan wajah with ceramide dapatkan shopee,originote micellar foam cleanser sabun cuci muka busa face wash facial cleanser bersih wajah with ceramide dapat shopee
364,originote micellar foam cleanser sabun cuci muka busa face wash facial cleanser membersihkan wajah with ceramide checkout,originote micellar foam cleanser sabun cuci muka busa face wash facial cleanser bersih wajah with ceramide checkout
365,preloved originote gluta bright b serum dijual ganti merk bagus isinya price link link shopee video,preloved originote gluta bright b serum jual ganti merk bagus isi price link link shopee video
366,engga pakai my goto cushion is guele originote suka,engga pakai my goto cushion is guele originote suka
367,temukan dapatkan originote bundle extra brightening gluta b serum jelly booster brightening moisturizer rp shopee shopeeid,temu dapat originote bundle extra brightening gluta b serum jelly booster brightening moisturizer rp shopee shopeeid
368,originote diskon rp cek tokopedia,originote diskon rp cek tokopedia
369,originote ceratinol moisturizer retinol cream gel serum pelembab wajah menyamarkan garis halus mengencangkan wajah with retinol ceramide link,originote ceratinol moisturizer retinol cream gel serum pelembab wajah samar garis halus encang wajah with retinol ceramide link
370,originote diskon rp cek tokopedia,originote diskon rp cek tokopedia
371,originote high cover serum cushion harga rp dapatkan shopee,originote high cover serum cushion harga rp dapat shopee
372,originote high cover serum cushion rp shopee shopeeid,originote high cover serum cushion rp shopee shopeeid
373,rekomendasi serum anti aging menyamarkan garis halus meratakan warna kulit originote retinol b serum dilengkapi jenis vitamin a niacinamide racunskincare racunshopee shopeeaffiliate shopeeid,rekomendasi serum anti aging samar garis halus rata warna kulit originote retinol b serum lengkap jenis vitamin a niacinamide racunskincare racunshopee shopeeaffiliate shopeeid
374,originote peeling solution serum serum eksfoliasi via shopee dom karawang,originote peeling solution serum serum eksfoliasi via shopee dom karawang
375,originote buy get khusus produk buy get correct me if i'm wrong sunscreen clay mask ceratinol,originote buy get khusus produk buy get correct me if i m wrong sunscreen clay mask ceratinol
376,originote bha charcoal clay mask masker wajah mud mask eksfoliasi mengangkat sel kulit mati menghilangkan minyak b gerak cepat selagi flashsale,originote bha charcoal clay mask masker wajah mud mask eksfoliasi angkat sel kulit mati hilang minyak b gerak cepat selagi flashsale
377,originote ceratinol moisturizer retinol cream gel serum pelembab wajah menyamarkan garis halus mengencangkan wajah linknya iya,originote ceratinol moisturizer retinol cream gel serum pelembab wajah samar garis halus encang wajah linknya iya
378,lazada buy get originote ceratinol moisturizer gede moisturizer cream pelembab wajah menyamarkan garis halus meratakan warna kulit mengencangkan wajah,lazada buy get originote ceratinol moisturizer gede moisturizer cream pelembab wajah samar garis halus rata warna kulit encang wajah
379,originote acne b serum serum anti acne anti inflamasi merawat mencegah pertumbuhan jerawat with salicyl checkout,originote acne b serum serum anti acne anti inflamasi rawat cegah tumbuh jerawat with salicyl checkout
380,rekomendasi masker wajah menenangkan merawat kulit berjerawat mengeksfoliasi wajah originote mugwort b clay stick mask racunskincare racunshopee shopeeaffiliate shopeeid,rekomendasi masker wajah tenang rawat kulit jerawat eksfoliasi wajah originote mugwort b clay stick mask racunskincare racunshopee shopeeaffiliate shopeeid
381,beneran habis rest zazan pc investnya skinker ily originote,beneran habis rest zazan pc investnya skinker ily originote
382,somethinc masuk rate thread nyebutin minus rate originote somethinc iya,somethinc masuk rate thread nyebutin minus rate originote somethinc iya
383,originote hyalurose micellar water pembersih wajah memakai up remover cleansing water melembabkan wajah with hyaluronic acid shopeeid,originote hyalurose micellar water bersih wajah pakai up remover cleansing water melembabkan wajah with hyaluronic acid shopeeid
384,ready stok originote bha charcoal clay mask masker wajah mud mask originote bpom linknya iya,ready stok originote bha charcoal clay mask masker wajah mud mask originote bpom linknya iya
385,preloved originote gluta bright b serum dijual ganti merk bagus isinya price link link shopee video,preloved originote gluta bright b serum jual ganti merk bagus isi price link link shopee video
386,jb preloved retinol originote jarang after video exp dom jateng toko udah gratong xtra,jb preloved retinol originote jarang after video exp dom jateng toko udah gratong xtra
387,rekomendasi cushion high coverage originote spf pa cushion tekstur ringan full coverage finishnya matte sesuai jenis kulit racunmakeup racunskincare shopeeid shopeeaffiliate,rekomendasi cushion high coverage originote spf pa cushion tekstur ringan full coverage finishnya matte sesuai jenis kulit racunmakeup racunskincare shopeeid shopeeaffiliate
388,membeli originate enak menurutku adem emang bersihinnya berpengaruh ga perih,beli originate enak turut adem emang bersihinnya pengaruh ga perih
389,originote ceratinol moisturizer retinol cream gel serum pelembab wajah menyamarkan garis halus mengencangkan wajah linknya iya,originote ceratinol moisturizer retinol cream gel serum pelembab wajah samar garis halus encang wajah linknya iya
390,originote ceratinol moisturizer retinol cream gel serum pelembab wajah menyamarkan garis halus mengencangkan wajah linknya iya,originote ceratinol moisturizer retinol cream gel serum pelembab wajah samar garis halus encang wajah linknya iya
391,cek originote in lash brow serum eye lash serum eyelash serum penebal menebalkan bulu mata alis biotin harga rp dapatkan shopee,cek originote in lash brow serum eye lash serum eyelash serum tebal tebal bulu mata alis biotin harga rp dapat shopee
392,originote cicab soothing essence toner toner wajah menenangkan kulit kemerahan menyegarkan wajah with centel kehabisan,originote cicab soothing essence toner toner wajah tenang kulit merah segar wajah with centel habis
393,cek originote mugwort b clay stick mask masker wajah mugwort acne menenangkan wajah kencang halus with niacinamide harga rp dapatkan shopee,cek originote mugwort b clay stick mask masker wajah mugwort acne tenang wajah kencang halus with niacinamide harga rp dapat shopee
394,kemarin tunjukkin swatches all shades cushion originote bingung shade banget coba filternya iya,kemarin tunjukkin swatches all shades cushion originote bingung shade banget coba filter iya
395,rekomendasi cushion oke banget hasilnya cek originote high cover serum cushion harga rp dapatkan shopee,rekomendasi cushion oke banget hasil cek originote high cover serum cushion harga rp dapat shopee
396,cek originote hyalurose micellar water pembersih wajah memakai up remover cleansing water melembabkan wajah with hyaluronic acid harga rp dapatkan shopee shopeeid,cek originote hyalurose micellar water bersih wajah pakai up remover cleansing water melembabkan wajah with hyaluronic acid harga rp dapat shopee shopeeid
397,belii klik yaa,beli klik yaa
398,ready stok originote bha charcoal clay mask masker wajah mud mask originote bpom belinya,ready stok originote bha charcoal clay mask masker wajah mud mask originote bpom beli
399,ready stok originote bha charcoal clay mask masker wajah mud mask originote bpom kehabisan,ready stok originote bha charcoal clay mask masker wajah mud mask originote bpom habis
400,temukan dapatkan originote high cover serum cushion rp shopee shopeeid,temu dapat originote high cover serum cushion rp shopee shopeeid
401,bosen merekomendasikan originote gentong,bosen rekomendasi originote gentong
402,flash sale seru wib originote implora eyeliner etc santan bubuk gede orange essential oil etc his erha acne ayana beras premium kg,flash sale seru wib originote implora eyeliner etc santan bubuk gede orange essential oil etc his erha acne ayana beras premium kg
403,flash sale originote klaim voucher toko murah urutkan harga terendah,flash sale originote klaim voucher toko murah urut harga rendah
404,ready stok originote bha charcoal clay mask masker wajah mud mask originote bpom belinya,ready stok originote bha charcoal clay mask masker wajah mud mask originote bpom beli
405,mjb iya harga diskon plus pakai voc toko combo live,mjb iya harga diskon plus pakai voc toko combo live
406,ready stok originote bha charcoal clay mask masker wajah mud mask originote bpom belinya,ready stok originote bha charcoal clay mask masker wajah mud mask originote bpom beli
407,cek originote high cover serum cushion harga rp dapatkan shopee,cek originote high cover serum cushion harga rp dapat shopee
408,originote cushion water based silicone based iya teman-teman,originote cushion water based silicone based iya teman
409,originote ceratinol moisturizer retinol cream gel serum pelembab wajah menyamarkan garis halus mengencangkan wajah belinya,originote ceratinol moisturizer retinol cream gel serum pelembab wajah samar garis halus encang wajah beli
410,cek originote high cover serum cushion harga rp dapatkan shopee,cek originote high cover serum cushion harga rp dapat shopee
411,originote acne b serum serum anti acne anti inflamasi merawat mencegah pertumbuhan jerawat with salicyl checkout,originote acne b serum serum anti acne anti inflamasi rawat cegah tumbuh jerawat with salicyl checkout
412,temukan dapatkan originote high cover serum cushion rp shopee shopeeid,temu dapat originote high cover serum cushion rp shopee shopeeid
413,originote ceratinol moisturizer retinol cream gel serum pelembab wajah menyamarkan garis halus mengencangkan wajah belinya,originote ceratinol moisturizer retinol cream gel serum pelembab wajah samar garis halus encang wajah beli
414,tementemen bingung shades originote cek filter yaah,tementemen bingung shades originote cek filter yaah
415,originote hyalurose micellar water pembersih wajah memakai up remover cleansing water melembabkan wajah with hyaluronic acid rp,originote hyalurose micellar water bersih wajah pakai up remover cleansing water melembabkan wajah with hyaluronic acid rp
416,temukan dapatkan originote high cover serum cushion rp shopee shopeeid,temu dapat originote high cover serum cushion rp shopee shopeeid
417,tes oksidasinyaa review lengkap cushion originote taruh iya,tes oksidasinyaa review lengkap cushion originote taruh iya
418,lambat bagus gitu lhoo menyatu kulit tahan lambat fix pembelian untung harganya under murah banget cushion sebagus,lambat bagus gitu lhoo satu kulit tahan lambat fix beli untung harga under murah banget cushion bagus
419,cek originote high cover serum cushion harga rp dapatkan shopee,cek originote high cover serum cushion harga rp dapat shopee
