,Teks,stemming
0,bye scarlet kmu terlalu mahal. aku mau timses nya originote saja. pye pye https://t.co/uibEm8TH3q,bye scarlet kmu terlalu mahal aku mau timses nya originote saja pye pye https t co uibem8th3q
1,@ohmybeautybank gaaaa! ini perih bgt asli udh coba pakenya dikit2 dan ujung aplikatornya doang tetep perih gakuat parah gue kasih ke temen akhirnya nyobain the originote baru mempan dia lebih enak karena water base udh repurchase 4 kali https://t.co/JFtZQbvtQB,ohmybeautybank gaaaa ini perih bgt asli udh coba pakenya dikit2 dan ujung aplikatornya doang tetep perih gakuat parah gue kasih ke temen akhir nyobain the originote baru mempan dia lebih enak karena water base udh repurchase 4 kali https t co jftzqbvtqb
2,wts micellar water the originote 30k aja baru dipake 5-10% #wts #zonauang https://t.co/zOfep2dNaE,wts micellar water the originote 30k aja baru dipake 5-10 wts zonauang https t co zofep2dnae
3,guys mending micella water facetology atau the originote ya? tolong minta reviewnya dong mau co bingung banget antara dua ini huhu https://t.co/4npytWreVT,guys mending micella water facetology atau the originote ya tolong minta reviewnya dong mau co bingung banget antara dua ini huhu https t co 4npytwrevt
4,beli serum the originote lama bgt nyampenya,beli serum the originote lama bgt nyampenya
5,@ohmybeautybank mau honest review gue blm prnah pake ini tp pernah pake yg originote. beneran ga boong gue pake sebulanan bulmat gue lgsg pnjang lg setelah sebelumnya patah habis gegara penjepit bulmat miniso smp mua notice bulmat gue bagus katanya panjang doi jg minta spill serumnya wkwkwk,ohmybeautybank mau honest review gue blm prnah pake ini tp pernah pake yg originote beneran ga boong gue pake bulan bulmat gue lgsg pnjang lg telah belum patah habis gegara jepit bulmat miniso smp mua notice bulmat gue bagus kata panjang doi jg minta spill serum wkwkwk
6,user the originote ada yang bisa ditanya-tanya ga yaaa ,user the originote ada yang bisa tanya ga yaaa
7,cosrx bagus bgt ya bjir lah takut gabisa balik ke originote,cosrx bagus bgt ya bjir lah takut gabisa balik ke originote
8,The originote micellar water ukuran gede loh 300 ml cuma 35rb an combo kode GLOW24DM https://t.co/7CHIgAmsYn https://t.co/dqYv8jqEg0,the originote micellar water ukur gede loh 300 ml cuma 35rb an combo kode glow24dm https t co 7chigamsyn https t co dqyv8jqeg0
9,MW ORIGINOTE ENAK BGT DI MUKAAA,mw originote enak bgt di mukaaa
10,gue abis exfo td pake clay masknya the originote TBTB JERAWAT LANGSUNG MUNCUL FAK WKWKKWWK,gue abis exfo td pake clay masknya the originote tbtb jerawat langsung muncul fak wkwkkwwk
11,micellar water originote enak parah woy mana gede ,micellar water originote enak parah woy mana gede
12,Lanzuut aku pake cream blush buat blush dalem. Pilih yang warnanya peach pink gini biar muka lebih seger. Pakenya tipis aja dulu kalo kurang baru build lagi~ Btw cushion The Originote ditimpa cream product di atasnya pun dia gak geser samsek gak yang jadi keangkat gituu! https://t.co/e0WKu3aRcx,lanzuut aku pake cream blush buat blush dalem pilih yang warna peach pink gin biar muka lebih seger pakenya tipis aja dulu kalo kurang baru build lagi btw cushion the originote timpa cream product di atas pun dia gak geser samsek gak yang jadi angkat gituu https t co e0wku3arcx
13,Photoism ni originate dari Korea. Harga negara asal diorang pun baru 7k won. Klu convert dlm RM24.80. ni harga negara lain klu converted into Malaysian Ringgit. Bapak la jauh gila beza nak cekik darah user ke apa ? Bawak masuk Malaysia igt nk supplykan demand tapi cehhhh https://t.co/onz1G9orSn,photoism ni originate dari korea harga negara asal orang pun baru 7k won klu convert dlm rm24 80 ni harga negara lain klu converted into malaysian ringgit bapak la jauh gila beza nak cekik darah user ke apa bawak masuk malaysia igt nk supplykan demand tapi cehhhh https t co onz1g9orsn
14,test wear cushion originote valid emang bagus makin sore bukannya kusam malah nambah cakep? trs the only cream blush lokal yg bnr2 tahan sehariaaaaaaan pollllllll itu sejauh ini cuma mop punya https://t.co/o98CypwrLA,test wear cushion originote valid emang bagus makin sore bukan kusam malah nambah cakep trs the only cream blush lokal yg bnr2 tahan sehariaaaaaaan pollllllll itu jauh ini cuma mop punya https t co o98cypwrla
15,step 1 pake compexion! ak pake cushion the originote‍️ ini coveragenya mantep banget kebetulan aku lagi ada beberapa PIH makanya cocok banget pake inii soalnya one tap udah cover seluruh wajah.. blendnya pelan2 aja dia gampang ko ga ngeblok.. sabar aja ngeblendnya jgn buru2 https://t.co/NUDo9H82y0,step 1 pake compexion ak pake cushion the originote ini coveragenya mantep banget betul aku lagi ada beberapa pih makanya cocok banget pake ini soal one tap udah cover seluruh wajah blendnya pelan2 aja dia gampang ko ga ngeblok sabar aja ngeblendnya jgn buru2 https t co nudo9h82y0
16, untuk kedua mw ini dari segi remover kalo eyeliner bisa keangkat tapi kalo untuk maskara waterproof masih ada sisa sisa sedikit dan menurutku itu normal ya better kalo mau bersihin maskara pake oil base aja. the originote sea makeup https://t.co/WiwWkpSQ9L,untuk dua mw ini dari segi remover kalo eyeliner bisa angkat tapi kalo untuk maskara waterproof masih ada sisa sisa sedikit dan turut itu normal ya better kalo mau bersihin maskara pake oil base aja the originote sea makeup https t co wiwwkpsq9l
17,Wts Preloved The Originote Cushion Harga 55k Shade : Light Warm Alasan jual karena salah shade baru dipake dua tap-tap buat semuka. Link oren https://t.co/EVCuzoTsGw Ada shopee video cari aja di profilku. #zonajajan #zonaBA #zonaBU #zonauang https://t.co/oavKqDy8WY,wts preloved the originote cushion harga 55k shade light warm alas jual karena salah shade baru dipake dua tap buat muka link oren https t co evcuzotsgw ada shopee video cari aja di profil zonajajan zonaba zonabu zonauang https t co oavkqdy8wy
18,[PRELOVED] the Originote: Toner Serum Moisturizer Lip Oil Serum NEGOTIABLE Tembalang Semarang Jawa Tengah https://t.co/INwQY4JI8d https://t.co/GEuuqm3Ooq,preloved the originote toner serum moisturizer lip oil serum negotiable tembalang semarang jawa tengah https t co inwqy4ji8d https t co geuuqm3ooq
19,ORIGINOTE SEMOGA ELU KAGA DRAMA ,originote moga elu kaga drama
20,sunscreen originote bagus bgt ngurangin bruntusan,sunscreen originote bagus bgt ngurangin bruntusan
21,Sunscreen spraynya originote perih bgt di mata anj seharian mata w berair krn perih apalagi pas td lg kelas bener2 nyiksa bgtttt,sunscreen spraynya originote perih bgt di mata anj hari mata w air krn perih apalagi pas td lg kelas bener2 nyiksa bgtttt
22,Mayan sekale pas bgt stock abis hehe tadi fs jam 12 keknya masih fs the originote df https://t.co/WWmOozG41K,mayan sekale pas bgt stock abis hehe tadi fs jam 12 kek masih fs the originote df https t co wwmoozg41k
23,Ngiler cushion originote wkwk,ngiler cushion originote wkwk
24,selasa 19 maret 2024 1 paket shopee + 1 reseller alhamdulillah https://t.co/tLA1w4Sjqn,selasa 19 maret 2024 1 paket shopee 1 reseller alhamdulillah https t co tla1w4sjqn
25,shocked bgt cushion the originote bagus bgt untuk first impression,shocked bgt cushion the originote bagus bgt untuk first impression
26,gais kalian kalau yg mau beli originote di jangan di toko BeautyBestieYou itu KW gaiss di produknya emg review ⭐5 semua tapi tenyata yang ⭐1 tuh di hide https://t.co/o1EPmQKq5q,gais kalian kalau yg mau beli originote di jangan di toko beautybestieyou itu kw gaiss di produk emg review 5 semua tapi tenyata yang 1 tuh di hide https t co o1epmqkq5q
27,pengen pindah mois ke originote brightening gi bokek abiss:((,ken pindah mois ke originote brightening gi bokek abiss
28,Jual cushion the originote shade medium neutral. Baru banget beli. Baru nyoba tapi kegelapan ga ketolong banget. 80rb aja #theoriginote #cushion #jualcushion https://t.co/6OLreE0cRs,jual cushion the originote shade medium neutral baru banget beli baru nyoba tapi gelap ga tolong banget 80rb aja theoriginote cushion jualcushion https t co 6olree0crs
29,The originote atau skintific CUUUYYYYY ,the originote atau skintific cuuuyyyyy
30,@unnesmenfess Serum Avoskin baru di pake 3 kali ya sesuai pict kondisinya ED di 11/24 (35k) Serum Npure ED 01/26 (20k) Serum Originote retinol ED 14/02/26 (30k) https://t.co/xrJYjP38AM,unnesmenfess serum avoskin baru di pake 3 kali ya sesuai pict kondisi ed di 11 24 35k serum npure ed 01 26 20k serum originote retinol ed 14 02 26 30k https t co xrjyjp38am
31,@berrypeachsweet Kak mw originote masii ada ga??,berrypeachsweet kak mw originote masii ada ga
32,@undipmenfess bisa sopi !!! The Originote 32k ajaaaa https://t.co/hjcoTAKOx7,undipmenfess bisa sopi the originote 32k ajaaaa https t co hjcotakox7
33,babi juga ni originote gw mau hemat tp dia bikin promo b1g1 tapi sbnrnya gw lagi ga butuh gt tapi kyk lumayan bgt?!,babi juga ni originote gw mau hemat tp dia bikin promo b1g1 tapi sbnrnya gw lagi ga butuh gt tapi kyk lumayan bgt
34,TONER ORIGINOTE CICA masih segel yak https://t.co/0kM579yIlo,toner originote cica masih segel yak https t co 0km579yilo
35,Lip oilnya originote bagus banget,lip oilnya originote bagus banget
36,AHA BHA originote enak bgt woy pen w makan lmlm ky manis bgt,aha bha originote enak bgt woy pen w makan lmlm ky manis bgt
37, Buat ngebersihin make up mantul yang mana bil? Dua-duanya oke yaa buat ngehapus make up effortless juga sea make up lebih cepet ngebersihinnya sedangkan the originote daya bersihnya lebih oke. Tapi untuk maskara yang bener-bener waterproof dua mw gentong ini harus dipake https://t.co/YSK6QSAAPD,buat ngebersihin make up mantul yang mana bil dua oke yaa buat ngehapus make up effortless juga sea make up lebih cepet ngebersihinnya sedang the originote daya bersih lebih oke tapi untuk maskara yang bener-bener waterproof dua mw gentong ini harus dipake https t co ysk6qsaapd
38,sunscreennya the originote baunya gaenak anjir,sunscreennya the originote bau gaenak anjir
39,baru tau owner the originote dosen kecantikkan anjir,baru tau owner the originote dosen cantik anjir
40,Sedih bgt ga cocok sama fw the originote :(,sedih bgt ga cocok sama fw the originote
41,Aku suudaon sama originote gang bikin muka w tambah kek pulu pulu,aku suudaon sama originote gang bikin muka w tambah kek pulu pulu
42,The originote moisturizernya gak cocok. Hueng. Baru juga sekali oles dikit dah merah.,the originote moisturizernya gak cocok hueng baru juga sekali oles dikit dah merah
43,@chogeumgyu kak belum??,chogeumgyu kak belum
44,Cepett originote 70rb dapet 4 https://t.co/zd9RbahrHT https://t.co/JWxi33eofm,cepett originote 70rb dapet 4 https t co zd9rbahrht https t co jwxi33eofm
45,WTS preloved skincare the originote Hyalucera moisturizer (25k) Serum vitamin c isi sekitar 60% (20k) H-llow clarifying toner isi sekitar 50% (10k) TAKE ALL 50K dijual karna udh ga kepake beli di official storenya co . #preloved the originote https://t.co/q0aQm3HQ0A,wts preloved skincare the originote hyalucera moisturizer 25k serum vitamin c isi sekitar 60 20k h-llow clarifying toner isi sekitar 50 10k take all 50k jual karna udh ga kepake beli di official storenya co preloved the originote https t co q0aqm3hq0a
46,pertama kali nyobain micellar water ini langsung suka banget maskara yang waterproof langsung ke angkat sema. biasanya harus pake cleansing balm dulu baru keangkat ini cukup pake micellar water nya the originote aja https://t.co/RnBK9WN6MB,pertama kali nyobain micellar water ini langsung suka banget maskara yang waterproof langsung ke angkat sema biasa harus pake cleansing balm dulu baru angkat ini cukup pake micellar water nya the originote aja https t co rnbk9wn6mb
47,cushion originote mmf ak sempet suudzon ternyata km bagus bgt bjirr,cushion originote mmf ak sempet suudzon nyata km bagus bgt bjirr
48,yuuu the moment of truth yups pas banget kan shade light neutral di kulit aku gak kegelapan gak abu abu AAAAAA NYATU DAN KAWIN BANGET SAMA KULITKU BEST BANGET CUSHION ORIGINOTE https://t.co/W5wqZ1W0gX,yuuu the moment of truth yups pas banget kan shade light neutral di kulit aku gak gelap gak abu abu aaaaaa nyatu dan kawin banget sama kulit best banget cushion originote https t co w5wqz1w0gx
49,mau ganti pelembab dari rumah apa coba originote ya dahlah balik emina aja tapi kayaknya madame gie juga bagus ujung²nya sampe tempat ya originote ,mau ganti pelembab dari rumah apa coba originote ya dah balik emina aja tapi kayak madame gie juga bagus ujung nya sampe tempat ya originote
50,Yang belum nyobain the originote cobain deh sekarang mumpung lagi promo,yang belum nyobain the originote cobain deh sekarang mumpung lagi promo
51,Apa gua harus coba sepaket originote? :&lt; facial wash blm nemu yg oke. Skrg ini pake cleveru dbilang cocok sih cocok tapi ga bikin ada perubahan :&lt;,apa gua harus coba paket originote lt facial wash blm nemu yg oke skrg ini pake cleveru dbilang cocok sih cocok tapi ga bikin ada ubah lt
52,moist the originote best bgt buat muka beruntusan awal make purging siii tapi akhirnyaa manteppp beruntusan jadii mendemm walauu belum seberapaa karna pakai nyaa belum dalam jangka waktu yang lama. tetep lov bgt dehh bakal pake ini teruss!!,moist the originote best bgt buat muka beruntus awal make purging siii tapi akhirnyaa manteppp beruntus jadi mendemm walauu belum seberapaa karna pakai nyaa belum dalam jangka waktu yang lama tetep lov bgt dehh bakal pake ini teruss
53,Akhirnye aku beli moistnya originote lagi stlh ± satu thn lamanya,akhirnye aku beli moistnya originote lagi stlh satu thn lama
54,kehabisan mulu clay mask stik g2glow yaudah jadinya beli yg the originote moga ampun dah ngebasmi komedo,habis mulu clay mask stik g2glow yaudah jadi beli yg the originote moga ampun dah ngebasmi komedo
55,Alhamdulillah dapet koin recehan dari syopi udah kekumpul belasan ribu modal main game dan tanem2 berhadiah. Bismillah beli skincare yang udh ga kebeli dari bulan Oktober tahun lalu the originote emang paling murce dan bisa pake koin syopi kalo sabar ngumpulinnya ,alhamdulillah dapet koin receh dari syopi udah kumpul bas ribu modal main game dan tanem2 hadiah bismillah beli skincare yang udh ga kebel dari bulan oktober tahun lalu the originote emang paling murce dan bisa pake koin syopi kalo sabar ngumpulinnya
56,The originote -Flash sale jadi harga under 20k -Klaim juga voucher toko -Bisa digabung diskon live Urutkan dari harga terendah atau cek promonya di halaman fs toko : https://t.co/PxoMNVds9a,the originote -flash sale jadi harga under 20k -klaim juga voucher toko -bisa gabung diskon live urut dari harga rendah atau cek promonya di halaman fs toko https t co pxomnvds9a
57,@nanazk Mw originote masih kak?,nanazk mw originote masih kak
58,Belum dapat BA untuk produk sea makeup sama originote susahnya Balikpapan ni heh,belum dapat ba untuk produk sea makeup sama originote susah balikpapan ni heh
59,@JUALAN_AUTOBASE bisa sopi !!! The Originote 32k ajaaaa https://t.co/YmlUYc09bi,jual autobase bisa sopi the originote 32k ajaaaa https t co ymluyc09bi
60,@jisooh_1 km pke originote yg apa,jisooh 1 km pke originote yg apa
61,@discountfess Cek originote lg ultah dia https://t.co/HqMPgB8Il1,discountfess cek originote lg ultah dia https t co hqmpgb8il1
62,@yawisbaehan @i_m_mortal_ gede banget lazrewardnya 23.200 aku cuma 4.600 ada yg punya tips biar bisa naik rewardnya? wkwkwk https://t.co/cIEJYr2YzK,yawisbaehan i m mortal gede banget lazrewardnya 23 200 aku cuma 4 600 ada yg punya tips biar bisa naik rewardnya wkwkwk https t co ciejyr2yzk
63,@unnesmenfess bisa sopi!!! The Originote 32k ajaaa https://t.co/6PkFEA2GNq,unnesmenfess bisa sopi the originote 32k ajaaa https t co 6pkfea2gnq
64,@desevrts aku pakai lip oil dari Originote!,desevrts aku pakai lip oil dari originote
65,@undipmenfess bisa sopi!!! The Originote 32k ajaaa https://t.co/YDp7cwoob4,undipmenfess bisa sopi the originote 32k ajaaa https t co ydp7cwoob4
66,@undipmenfess bisa sopi!!! The Originote 32k ajaaa https://t.co/CwoXomIeOz,undipmenfess bisa sopi the originote 32k ajaaa https t co cwoxomieoz
67,maaf originote tapi sunscreenmu bikin perih di mata yang sampe berair banget,maaf originote tapi sunscreenmu bikin perih di mata yang sampe air banget
68,@undipmenfess bisa sopi!!! The Originote 32k ajaaa https://t.co/81cMvvSFnX,undipmenfess bisa sopi the originote 32k ajaaa https t co 81cmvvsfnx
69,cushion the originote ada di offline store gasihhh mau beli online takut salah shade ,cushion the originote ada di offline store gasihhh mau beli online takut salah shade
70,The Originote Hyalu-C Serum lagi diskon dri harga Rp. 64.000 jadi Rp.38.000 https://t.co/oaiOQcbGnD,the originote hyalu-c serum lagi diskon dri harga rp 64 000 jadi rp 38 000 https t co oaioqcbgnd
71,list belanjaan skincare - mw originote - senka facewash white clay - moist ungu lupa apa namanya - facetology akan kupancarkan wajah bercahaya dan mempesona di hari lebaran itu,list belanja skincare - mw originote - senka facewash white clay - moist ungu lupa apa nama - facetology akan pancar wajah cahaya dan pesona di hari lebaran itu
72,knp originote suka infused niacinamide siii ke makeup2 nya kan ak jg pgn nyobain cushionny,knp originote suka infused niacinamide siii ke makeup2 nya kan ak jg pgn nyobain cushionny
73,retinolnya the originote ini udah all in 1 udah ada kandungan niacinamidenya juga retinol dicombo niacinamide: works dan cocok banget di aku mana harganya affordable beut https://t.co/OhoaLnlxD7,retinolnya the originote ini udah all in 1 udah ada kandung niacinamidenya juga retinol dicombo niacinamide works dan cocok banget di aku mana harga affordable beut https t co ohoalnlxd7
74,@dairypinkid kak originote kmu shade apa kalo bole tau,dairypinkid kak originote kmu shade apa kalo bole tau
75,@undipmenfess bisa sopi !!! The Originote 32k ajaaa https://t.co/sh2YoPfTkT,undipmenfess bisa sopi the originote 32k ajaaa https t co sh2yopftkt
76,Sbnrnya kepo abis sma cushion originote tapi masih mikir ntaran aja kali ya terus beli instaperfect,sbnrnya kepo abis sma cushion originote tapi masih mikir ntaran aja kali ya terus beli instaperfect
77,@yourwishlist_ ka originote charcoal masih gaa,yourwishlist ka originote charcoal masih gaa
78,@undipmenfess bisa sopi!!!! The Originote 32k ajaaa https://t.co/7eL5gMNcsa,undipmenfess bisa sopi the originote 32k ajaaa https t co 7el5gmncsa
79,originote ni pon selalu gak lalu fyp mesra pocket https://t.co/lUqjEocNCY,originote ni pon selalu gak lalu fyp mesra pocket https t co luqjeocncy
80,boleh rekomendasiin ke aku cushion yang menurut kamu oke banget itu? the originote baguss minim oksidasi tapi nyari shade yang cocok buat kulit aku agak susah tapi gapapa isinya banyak! https://t.co/P4Pkm27piu,boleh rekomendasiin ke aku cushion yang turut kamu oke banget itu the originote baguss minim oksidasi tapi nyari shade yang cocok buat kulit aku agak susah tapi gapapa isi banyak https t co p4pkm27piu
81,@asmloy kak most originote masih avail?,asmloy kak most originote masih avail
82,@lmkiey azarineeee kl mau lebih murah originote juga baguss,lmkiey azarineeee kl mau lebih murah originote juga baguss
83,@ailuroviil @ohmybeautybank coba pake vit C serumnya the originote kak https://t.co/eqVjenK7Oc,ailuroviil ohmybeautybank coba pake vit c serum the originote kak https t co eqvjenk7oc
84,kaget ada voucher diskon 100k https://t.co/WU1vwKZOhg,kaget ada voucher diskon 100k https t co wu1vwkzohg
85,Abis co cushion the originote yang light warm SEMOGA SESUAI YA ALLAH TOLONG BANGET ,abis co cushion the originote yang light warm moga sesuai ya allah tolong banget
86,@ohmybeautybank Aku kusam dan oily juga udah pernah pake skingame (lama nyerepnya lengket) the originote brightening (malh buat kusam) sama cosrx (buat kusam jg dan malah buat komedoan ) sekarang pake bentonn aloe teksturnya gel jadi ringan gampang nyerepnya dan isinya banyaaak bgt suka ,ohmybeautybank aku kusam dan oily juga udah pernah pake skingame lama nyerepnya lengket the originote brightening malh buat kusam sama cosrx buat kusam jg dan malah buat komedoan sekarang pake bentonn aloe tekstur gel jadi ringan gampang nyerepnya dan isi banyaaak bgt suka
87,congrats pemenang saldo 50k untuk 2 orang: @buttrflybelly &amp; @rainiranti_ pemenang di-co-in micellar water the originote: @wandasepta kindly dm me yaa buat claim hadiahnya thankyou and see you in another giveaway~ https://t.co/0VAzBFnWop,congrats menang saldo 50k untuk 2 orang buttrflybelly amp rainiranti menang di-co-in micellar water the originote wandasepta kindly dm me yaa buat claim hadiah thankyou and see you in another giveaway https t co 0vazbfnwop
88,WTS // PRELOVED micellar water the originote 35k nego tipis dom jogja bisa co oren https://t.co/IhWl9jXwr5,wts preloved micellar water the originote 35k nego tipis dom jogja bisa co oren https t co ihwl9jxwr5
89,Seneng banget beneran mendingan beruntusan gw sejak pake originote kenapa ga dari dulu aja gw pake ini si UDAH GITU JAUH LEBIH MURAH DARI CENTELLA ,neng banget beneran mending beruntus gw sejak pake originote kenapa ga dari dulu aja gw pake ini si udah gitu jauh lebih murah dari centella
90,Nyobain beli cushion nya the originote semoga gak salah shade ,nyobain beli cushion nya the originote moga gak salah shade
91,@ellyyiee_ bisa sopi!!!! The Originote 32k ajaaa https://t.co/JacE7xGg7H,ellyyiee bisa sopi the originote 32k ajaaa https t co jace7xgg7h
92,senin 18 maret 2024 1 paket reseller alhamdulillah https://t.co/dH46CFcePx,senin 18 maret 2024 1 paket reseller alhamdulillah https t co dh46cfcepx
93,originote best sih kenapa baru nyoba moistnya,originote best sih kenapa baru nyoba moistnya
94,@sekayuniverse gw make originote yg brightening beruntusan MANA MASIH FULL ISINYA ,sekayuniverse gw make originote yg brightening beruntus mana masih full isi
95,@icvehyunk Ditutup nya ada tulisan originote nya gak kak,icvehyunk tutup nya ada tulis originote nya gak kak
96,originote hyalurose micellar water micellar water yg ampuh bgt buat bersihin skincare residu &amp; makeup. gentle &amp; feelsnya bikin kulit kerasa lembab! harganya super affordable &amp; segede gini bisa buat 2 bulan 48k for 300ml - https://t.co/i0YXGjeCiQ https://t.co/MCALRbi0uO,originote hyalurose micellar water micellar water yg ampuh bgt buat bersihin skincare residu amp makeup gentle amp feelsnya bikin kulit rasa lembab harga super affordable amp gede gin bisa buat 2 bulan 48k for 300ml - https t co i0yxgjeciq https t co mcalrbi0uo
97,WTS CUSHION THE ORIGINOTE NEW Shade medium nuetral belum dikirim tapi nanti aku kirim kalau udah sampai di aku Nego aja gapapa daripda gak kepake bisa co gratong #zonauang️ #zonajajan https://t.co/Jx5xYzK0iX,wts cushion the originote new shade medium nuetral belum kirim tapi nanti aku kirim kalau udah sampai di aku nego aja gapapa daripda gak kepake bisa co gratong zonauang zonajajan https t co jx5xyzk0ix
98,@versusvani @ohmybeautybank The originote emang cakep banget sih cuman gue bingung kenapa warna serumnya cepet banget berubah ya ,versusvani ohmybeautybank the originote emang cakep banget sih cuman gue bingung kenapa warna serum cepet banget ubah ya
99,Eyelash serum mending originote atau lashboss ya...,eyelash serum mending originote atau lashboss ya
100,loakjends! sunscreen originote baru sekali pemakaian 35k nego tipis bolehh https://t.co/CcnagOsenY,loakjends sunscreen originote baru sekali pakai 35k nego tipis bolehh https t co ccnagoseny
101,The originote moisturizer cuma 32rb combo kode BEKENMUT10 https://t.co/7e0TGSe6X3 Berlaku jg u seluruh produk THE ORIGINOTE Minbel 40 diskon 10 https://t.co/yqouUOi0DY https://t.co/ce7Q9bw6HK,the originote moisturizer cuma 32rb combo kode bekenmut10 https t co 7e0tgse6x3 laku jg u seluruh produk the originote minbel 40 diskon 10 https t co yqouuoi0dy https t co ce7q9bw6hk
102,@oOdis___ @ohmybeautybank Kak mau tanya setelah exfo pke avoskin boleh ga kalo moisnya pake originote yg hijau? https://t.co/FEXXMX4UBZ,oodis ohmybeautybank kak mau tanya telah exfo pke avoskin boleh ga kalo moisnya pake originote yg hijau https t co fexxmx4ubz
103,-selldips! abisin stok yu guyss. micellar water originote sama facetology masing2 sisa 1pcs. only 45k/pcs ajaaaaa yu yg mau reppp https://t.co/ELnwtCmIy2,-selldips abisin stok yu guyss micellar water originote sama facetology masing2 sisa 1pcs only 45k pcs ajaaaaa yu yg mau reppp https t co elnwtcmiy2
104,ngapus maskara bnb pake apaa yaa?? pake micellar water originote gabisaa masaa ,ngapus maskara bnb pake apaa yaa pake micellar water originote gabisaa masaa
105,@ohmybeautybank originote sih https://t.co/feEbsjU6nP,ohmybeautybank originote sih https t co feebsju6np
106,Wts semuanya msii pda penuh penuh krna bru dipakai beberapa kalii dan msi pda bersih yaa kecuali yg ss the originote packaging nya aj yg uda agak buluk #prelovedskincare #prelovedskintific #wtstheoriginote #wtshadalabo https://t.co/TcLgTf9x6I,wts semua msii pda penuh penuh krna bru pakai beberapa kali dan msi pda bersih yaa kecuali yg ss the originote packaging nya aj yg uda agak buluk prelovedskincare prelovedskintific wtstheoriginote wtshadalabo https t co tclgtf9x6i
107,@lullwabies Ak sekarang pake ini tapi tetiba mau nyoba yg originote,lullwabies ak sekarang pake ini tapi tetiba mau nyoba yg originote
108,Cek The Originote Day-C Night-A Bundle 2pcs - Hyalu-C Serum dan Retinol Serum dengan harga Rp75.000. Dapatkan di Shopee sekarang! https://t.co/sNatFXp8h7 #ShopeeID https://t.co/0ffGo4F0dY,cek the originote day-c night-a bundle 2pcs - hyalu-c serum dan retinol serum dengan harga rp75 000 dapat di shopee sekarang https t co snatfxp8h7 shopeeid https t co 0ffgo4f0dy
109,THE ORIGINOTE TERLIHAT MENJANJIKAN AJHH BESOK ABIS KEBARAN BELI DEH,the originote lihat janji ajhh besok abis bar beli deh
110,@jahedikupas dari ekspedisi apa pengemasan? aku juga mau co the originote,jahedikupas dari ekspedisi apa emas aku juga mau co the originote
