,stop_word,stemming
0,scarlet mahal tim sukses originote,scarlet mahal tim sukses originote
1,ga perih banget asli udah coba memakai ujung alat perih kuat banget kasih teman mencoba originote mempan enak water base udah pembelian kali,ga perih banget asli udah coba pakai ujung alat perih kuat banget kasih teman coba originote mempan enak water base udah beli kali
2,micellar water originote,micellar water originote
3,teman-teman micella water facetology originote iya tolong riview checkout bingung banget,teman micella water facetology originote iya tolong riview checkout bingung banget
4,membeli serum originote lambat banget dateng,beli serum originote lambat banget dateng
5,honest review pakai pakai originote beneran ga bohong pakai sebulanan bulu mata langsung patah habis gara-gara penjepit bulu mata miniso mua notice bulu mata bagus tunjukan serumnya wkwkwk,honest review pakai pakai originote beneran ga bohong pakai bulan bulu mata langsung patah habis gara-gara jepit bulu mata miniso mua notice bulu mata bagus tunjuk serum wkwkwk
6,user originote ditanyatanya ga yaa,user originote ditanyatanya ga yaa
7,cosrx bagus banget iya bjir takut originote,cosrx bagus banget iya bjir takut originote
8,originote micellar water ukuran combo kode glowdm,originote micellar water ukur combo kode glowdm
9,now watching originote enak banget mukaa,now watching originote enak banget mukaa
10,habis exfo pakai clay masker originote jerawat langsung muncul fak,habis exfo pakai clay masker originote jerawat langsung muncul fak
11,micellar water originote enak banget woy,micellar water originote enak banget woy
12,lanzuut pakai cream blush blush dalem pilih warnanya peach pink gini muka seger memakai tipis membangun ngomong-ngomong cushion originote ditimpa cream product atasnya geser keangkat gitu,lanzuut pakai cream blush blush dalem pilih warna peach pink gin muka seger pakai tipis bangun ngomong-ngomong cushion originote timpa cream product atas geser angkat gitu
13,photoism originate korea harga negara diorang won klu convert dalem harga negara klu converted into malaysian ringgit gila beza cekik darah user bawa masuk malaysia igt supplykan demand cehh,photoism originate korea harga negara orang won klu convert dalem harga negara klu converted into malaysian ringgit gila beza cekik darah user bawa masuk malaysia igt supplykan demand cehh
14,mencoba wear cushion originote valid emang bagus sore kusam nambah cakep cream blush lokal tahan sehariaan poll mop,coba wear cushion originote valid emang bagus sore kusam nambah cakep cream blush lokal tahan sehariaan poll mop
15,tahap pakai compexion pakai cushion originote coveragenya mantap banget pih sesuai banget pakai inii tap cover wajah blendnya pelan gampang ko ga ngeblok sabar ngeblendnya cepat,tahap pakai compexion pakai cushion originote coveragenya mantap banget pih sesuai banget pakai ini tap cover wajah blendnya pelan gampang ko ga ngeblok sabar ngeblendnya cepat
16,now watching segi remover eyeliner keangkat maskara waterproof sisa sisa menurutku normal iya better bersihin maskara pakai oil base originote sea makeup,now watching segi remover eyeliner angkat maskara waterproof sisa sisa turut normal iya better bersihin maskara pakai oil base originote sea makeup
17,preloved originote cushion harga shade terang warm alasan jual salah shade taptap semuka link oren shopee video cari profilku,preloved originote cushion harga shade terang warm alas jual salah shade taptap muka link oren shopee video cari profil
18,preloved originote toner serum moisturizer lip oil serum negotiable tembalang semarang jawa,preloved originote toner serum moisturizer lip oil serum negotiable tembalang semarang jawa
19,originote semoga drama,originote moga drama
20,sunscreen originote bagus banget ngurangin bruntusan,sunscreen originote bagus banget ngurangin bruntusan
21,sunscreen spraynya originote perih banget mata anj seharian mata w berair perih kelas menyiksa banget,sunscreen spraynya originote perih banget mata anj hari mata w air perih kelas siksa banget
22,lumayan sekale banget stock habis jam kayaknya originote df,lumayan sekale banget stock habis jam kayak originote df
23,cushion originote,cushion originote
24,selasa maret paket shopee reseller alhamdulillah,selasa maret paket shopee reseller alhamdulillah
25,shocked banget cushion originote bagus banget impression,shocked banget cushion originote bagus banget impression
26,gais membeli originote toko beautybestieyou imitasi gaiss produknya review tenyata hide,gais beli originote toko beautybestieyou imitasi gaiss produk review tenyata hide
27,pengen pindah mois originote brightening gi bokek abiss,ken pindah mois originote brightening gi bokek abiss
28,jual cushion originote shade medium neutral banget membeli mencoba kegelapan ga ketolong banget theoriginote cushion jualcushion,jual cushion originote shade medium neutral banget beli coba gelap ga tolong banget theoriginote cushion jualcushion
29,originote skintific cuuyy,originote skintific cuuyy
30,serum avoskin pakai kali iya sesuai pict kondisinya edisi serum npure edisi serum originote retinol edisi,serum avoskin pakai kali iya sesuai pict kondisi edisi serum npure edisi serum originote retinol edisi
31,kak now watching originote masii ga,kak now watching originote masii ga
32,sopi originote ajaa,sopi originote ajaa
33,babi originote hemat promo abang ga membutuhkan lumayan banget,babi originote hemat promo abang ga butuh lumayan banget
34,toner originote cica segel yak,toner originote cica segel yak
35,lip oilnya originote bagus banget,lip oilnya originote bagus banget
36,tertawa bha originote enak banget woy w makan lmlm manis banget,tertawa bha originote enak banget woy w makan lmlm manis banget
37,ngebersihin memakai up mantap bil duaduanya oke yaa ngehapus memakai up effortless sea memakai up cepat ngebersihinnya originote daya bersihnya oke maskara bener-bener waterproof now watching gentong,ngebersihin pakai up mantap bil duaduanya oke yaa ngehapus pakai up effortless sea pakai up cepat ngebersihinnya originote daya bersih oke maskara bener-bener waterproof now watching gentong
38,sunscreennya originote baunya ga enak anjing,sunscreennya originote bau ga enak anjing
39,owner originote dosen kecantikkan anjing,owner originote dosen cantik anjing
40,sedih banget ga sesuai originote,sedih banget ga sesuai originote
41,suudaon originote gang muka w pulu pulu,suudaon originote gang muka w pulu pulu
42,originote moisturizernya sesuai hueng oles merah,originote moisturizernya sesuai hueng oles merah
43,kak,kak
44,cepat originote,cepat originote
45,preloved skincare originote hyalucera moisturizer serum vitamin c isi hllow clarifying toner isi take all dijual udah ga terpakai membeli official storenya checkout preloved originote,preloved skincare originote hyalucera moisturizer serum vitamin c isi hllow clarifying toner isi take all jual udah ga pakai beli official storenya checkout preloved originote
46,kali mencoba micellar water langsung suka banget maskara waterproof langsung angkat sema pakai cleansing balm keangkat pakai micellar water originote,kali coba micellar water langsung suka banget maskara waterproof langsung angkat sema pakai cleansing balm angkat pakai micellar water originote
47,cushion originote mmf suudzon bagus banget bjirr,cushion originote mmf suudzon bagus banget bjirr
48,yuu moment of truth yups banget shade terang neutral kulit kegelapan abu abu aa menyatu kawin banget kulitku best banget cushion originote,yuu moment of truth yups banget shade terang neutral kulit gelap abu abu aa satu kawin banget kulit best banget cushion originote
49,ganti pelembab rumah coba originote iya dahlah emina kayaknya madame gie bagus ujung²nya iya originote,ganti pelembab rumah coba originote iya dah emina kayak madame gie bagus ujung nya iya originote
50,mencoba originote mencoba selagi promo,coba originote coba selagi promo
51,coba sepaket originote lt facial wash nemu oke pakai cleveru dbilang sesuai sesuai ga perubahan lt,coba paket originote lt facial wash nemu oke pakai cleveru dbilang sesuai sesuai ga ubah lt
52,moist originote best banget muka beruntusan memakai purging sii akhirnyaa mantepp beruntusan jadii mendemm walauu seberapaa memakai nyaa jangka lambat lov banget dehh pakai teruss,moist originote best banget muka beruntus pakai purging sii akhirnyaa mantepp beruntus jadi mendemm walauu seberapaa pakai nyaa jangka lambat lov banget dehh pakai teruss
53,akhirnye membeli moistnya originote,akhirnye beli moistnya originote
54,kehabisan melulu clay mask stik gglow membeli originote moga ampun ngebasmi komedo,habis melulu clay mask stik gglow beli originote moga ampun ngebasmi komedo
55,alhamdulillah koin recehan syopi kekumpul belasan ribu modal main game tanem berhadiah bismillah membeli skincare udah ga kebeli oktober originote emang murce pakai koin syopi sabar ngumpulinnya,alhamdulillah koin receh syopi kumpul bas ribu modal main game tanem hadiah bismillah beli skincare udah ga kebel oktober originote emang murce pakai koin syopi sabar ngumpulinnya
56,originote flash sale harga under klaim voucher toko digabung diskon live urutkan harga terendah cek promonya halaman toko,originote flash sale harga under klaim voucher toko gabung diskon live urut harga rendah cek promonya halaman toko
57,now watching originote kak,now watching originote kak
58,produk sea makeup originote susahnya balikpapan heh,produk sea makeup originote susah balikpapan heh
59,sopi originote ajaa,sopi originote ajaa
60,pake originote,pake originote
61,cek originote ultah,cek originote ultah
62,banget lazrewardnya tips rewardnya wkwkwk,banget lazrewardnya tips rewardnya wkwkwk
63,sopi originote ajaa,sopi originote ajaa
64,memakai lip oil originote,pakai lip oil originote
65,sopi originote ajaa,sopi originote ajaa
66,sopi originote ajaa,sopi originote ajaa
67,maaf originote sunscreenmu perih mata berair banget,maaf originote sunscreenmu perih mata air banget
68,sopi originote ajaa,sopi originote ajaa
69,cushion originote offline store gasihh membeli online takut salah shade,cushion originote offline store gasihh beli online takut salah shade
70,originote hyaluc serum diskon harga rp rp,originote hyaluc serum diskon harga rp rp
71,list belanjaan skincare now watching originote senka facewash white clay moist ungu lupa namanya facetology kupancarkan wajah bercahaya mempesona lebaran,list belanja skincare now watching originote senka facewash white clay moist ungu lupa nama facetology pancar wajah cahaya pesona lebaran
72,originote suka infused niacinamide sii makeup pgn mencoba cushionny,originote suka infused niacinamide sii makeup pgn coba cushionny
73,retinolnya originote all in kandungan niacinamidenya retinol dicombo niacinamide works sesuai banget harganya affordable banget,retinolnya originote all in kandung niacinamidenya retinol dicombo niacinamide works sesuai banget harga affordable banget
74,kak originote shade,kak originote shade
75,sopi originote ajaa,sopi originote ajaa
76,urusan orang habis cushion originote berfikir ntaran kali iya membeli instaperfect,urus orang habis cushion originote berfikir ntaran kali iya beli instaperfect
77,kakak originote charcoal ga,kakak originote charcoal ga
78,sopi originote ajaa,sopi originote ajaa
79,originote pon fyp mesra pocket,originote pon fyp mesra pocket
80,rekomendasiin cushion oke banget originote bagus oksidasi mencari shade sesuai kulit susah gapapa isinya,rekomendasiin cushion oke banget originote bagus oksidasi cari shade sesuai kulit susah gapapa isi
81,kak originote avail,kak originote avail
82,azarinee murah originote bagus,azarinee murah originote bagus
83,coba pakai vit c serumnya originote kak,coba pakai vit c serum originote kak
84,kaget voucher diskon,kaget voucher diskon
85,habis checkout cushion originote terang warm semoga sesuai iya tolong banget,habis checkout cushion originote terang warm moga sesuai iya tolong banget
86,kusam oily pakai skingame lambat menyerap lengket originote brightening malh kusam cosrx kusam komedoan pakai bentonn aloe teksturnya gel ringan gampang menyerap isinya banyaak banget suka,kusam oily pakai skingame lambat serap lengket originote brightening malh kusam cosrx kusam komedoan pakai bentonn aloe tekstur gel ringan gampang serap isi banyaak banget suka
87,congrats pemenang saldo orang pemenang dicoin micellar water originote kindly yaa claim hadiahnya terima kasih see in another hadiah,congrats menang saldo orang menang dicoin micellar water originote kindly yaa claim hadiah terima kasih see in another hadiah
88,preloved micellar water originote nego tipis dom jogja checkout oren,preloved micellar water originote nego tipis dom jogja checkout oren
89,seneng banget beneran mendingan beruntusan pakai originote ga pakai gitu murah centella,neng banget beneran mending beruntus pakai originote ga pakai gitu murah centella
90,mencoba membeli cushion originote semoga salah shade,coba beli cushion originote moga salah shade
91,sopi originote ajaa,sopi originote ajaa
92,senin maret paket reseller alhamdulillah,senin maret paket reseller alhamdulillah
93,originote best mencoba moistnya,originote best coba moistnya
94,memakai originote brightening beruntusan full isinya,pakai originote brightening beruntus full isi
95,ditutup tulisan originote kak,tutup tulis originote kak
96,originote hyalurose micellar water micellar water ampuh banget bersihin skincare residu makeup gentle feelsnya kulit kerasa lembab harganya super affordable segede gini,originote hyalurose micellar water micellar water ampuh banget bersihin skincare residu makeup gentle feelsnya kulit rasa lembab harga super affordable gede gin
97,cushion originote shade medium nuetral dikirim kirim nego gapapa daripda terpakai checkout gratong,cushion originote shade medium nuetral kirim kirim nego gapapa daripda pakai checkout gratong
98,originote emang cakep banget cuman bingung warna serumnya cepat banget berubah iya,originote emang cakep banget cuman bingung warna serum cepat banget ubah iya
99,eyelash serum originote lashboss iya,eyelash serum originote lashboss iya
100,loakjends sunscreen originote pemakaian nego tipis bolehh,loakjends sunscreen originote pakai nego tipis bolehh
101,originote moisturizer combo kode bekenmut berlaku produk originote minbel diskon,originote moisturizer combo kode bekenmut laku produk originote minbel diskon
102,kak exfo pake avoskin ga moisnya pakai originote hijau,kak exfo pake avoskin ga moisnya pakai originote hijau
103,selldips abisin stok yu guyss micellar water originote facetology sisa pcs kpcs ajaa yu balas,selldips abisin stok yu guyss micellar water originote facetology sisa pcs kpcs ajaa yu balas
104,ngapus maskara bnb pakai apaa yaa pakai micellar water originote gabisaa masaa,ngapus maskara bnb pakai apaa yaa pakai micellar water originote gabisaa masaa
105,originote,originote
106,msii pda penuh penuh krna dipakai kalii msi pda bersih yaa kecuali originote packaging uda jelek prelovedskincare prelovedskintific wtstheoriginote wtshadalabo,msii pda penuh penuh krna pakai kali msi pda bersih yaa kecuali originote packaging uda jelek prelovedskincare prelovedskintific wtstheoriginote wtshadalabo
107,pakai mencoba originote,pakai coba originote
108,cek originote dayc nighta bundle pcs hyaluc serum retinol serum harga rp dapatkan shopee shopeeid,cek originote dayc nighta bundle pcs hyaluc serum retinol serum harga rp dapat shopee shopeeid
109,originote menjanjikan ajhh besok habis kebaran membeli,originote janji ajhh besok habis bar beli
110,ekspedisi pengemasan checkout originote,ekspedisi emas checkout originote
111,originote moiz ga kak,originote moiz ga kak
112,originote ga nder,originote ga nder
113,pakai originote,pakai originote
114,titip kakak,titip kakak
115,kakak pakai cushion originote shade,kakak pakai cushion originote shade
116,originote flash sale harga under klaim voucher toko digabung diskon live urutkan harga terendah cek halaman flash sale toko,originote flash sale harga under klaim voucher toko gabung diskon live urut harga rendah cek halaman flash sale toko
117,ysb avoskinn ssnya originote,ysb avoskinn ssnya originote
118,sumpah membutuhkan banget lip serum originote sociolla iya allahh,sumpah butuh banget lip serum originote sociolla iya allahh
119,originote ga kak,originote ga kak
120,gapunya link livenya,gapunya link livenya
121,originote sea makeup masuk facetology acne calm damage pengiriman rembes keringampga bocor,originote sea makeup masuk facetology acne calm damage kirim rembes keringampga bocor
122,originote suka bangett,originote suka bangett
123,harga before cbdiskon facetology triplecare sunscreen tangerang memakai live disk shopee video wtb,harga before cbdiskon facetology triplecare sunscreen tangerang pakai live disk shopee video wtb
124,originote true to skin txa,originote true to skin txa
125,penasaran banget eye serum originote,penasaran banget eye serum originote
126,moisturizer lip serum originote harga hihi,moisturizer lip serum originote harga hihi
127,halo serum originote exfo gratong,halo serum originote exfo gratong
128,masker bang ngilangin komedo mencerahkan kulit wajah masker murah bang,masker bang ngilangin komedo cerah kulit wajah masker murah bang
129,kak brs uang kann,kak brs uang kann
130,izin cushion originote dijual salah shade iya,izin cushion originote jual salah shade iya
131,informasi kreator golden tick skincare memakai up brand implora originote gtu dongg plss,informasi kreator golden tick skincare pakai up brand implora originote gtu dongg plss
132,aff iya kusem banget skincare pakai mari tunjukan st oily acne prone somethinc ph micellar water niveagarnier biru toner skin hyalura cica skin hyalura cica moist originotecosrx exfo avoskin retinol originote,aff iya kusem banget skincare pakai mari tunjuk st oily acne prone somethinc ph micellar water niveagarnier biru toner skin hyalura cica skin hyalura cica moist originotecosrx exfo avoskin retinol originote
133,mencoba retinol plis coba tipis tipis kulit aman cyyn moisturizer serum originote alternatif gengss garis garis halus kusem ngerasa tua,coba retinol plis coba tipis tipis kulit aman cyyn moisturizer serum originote alternatif gengss garis garis halus kusem ngerasa tua
134,now watching ikutan,now watching ikut
135,pake originote bagus rontok,pake originote bagus rontok
136,kena m checkout ajaa wkwkwk,kena m checkout ajaa wkwkwk
137,mencoba topokki mujigae kureng suka menurutku toeknya keras bumbunya berat lidahku mencoba merk mamasuka enak bgtbgtbgtt snack wonhae oke intinya mah makan dine in mujigae kemasan sesuai,coba topokki mujigae reng suka turut toeknya keras bumbu berat lidah coba merk mamasuka enak bgtbgtbgtt snack wonhae oke inti mah makan dine in mujigae kemas sesuai
138,originote bha charcoal clay mask masker wajah mud mask eksfoliasi mengangkat sel kulit mati menghilangkan minyak berlebih with charcoal bha,originote bha charcoal clay mask masker wajah mud mask eksfoliasi angkat sel kulit mati hilang minyak lebih with charcoal bha
139,moisturizer originote hyalucera moisturizer best sejuk gilaa pagi pagi tu segar teruss korang letak mini fridge segar,moisturizer originote hyalucera moisturizer best sejuk gilaa pagi pagi tu segar teruss korang letak mini fridge segar
140,segentong gini harganya ribuan murah banget kayaknya awet bulanan cus membeli live murah,gentong gin harga ribu murah banget kayak awet bulan cus beli live murah
141,pake originote sepaket gagal ngikutin,pake originote paket gagal ngikutin
142,urusan orang banget ceratinol moist originote,urus orang banget ceratinol moist originote
143,originote instaperfect seharihari bagusan kak,originote instaperfect seharihari bagus kak
144,aneh banget anjing masuk langsung jt pakai minus admin masuk kwkwkw,aneh banget anjing masuk langsung jt pakai minus admin masuk kwkwkw
145,cushion originote full coverage kakk disarankan ringan ringan ajahh,cushion originote full coverage kakk saran ringan ringan ajahh
146,ohh iya iya pakai originote bii,ohh iya iya pakai originote bii
147,halo kakak udah berhasil tiket belumm,halo kakak udah hasil tiket belumm
148,ceratinol originote kak mulus gitu kulit nyaa,ceratinol originote kak mulus gitu kulit nyaa
149,mbb kak reply gamasuk kak,mbb kak reply gamasuk kak
150,originote clay stick mask,originote clay stick mask
151,anjink apaa udah jam,anjink apaa udah jam
152,full_text,full text
153,memakai micellar waternya originote banget pakai walopun ga kemana double cleansing wajib,pakai micellar waternya originote banget pakai walopun ga mana double cleansing wajib
154,kulitku berminyak berjerawat memakai moisturizer originote nder udah pembelian ampe jar teksturnya enak banget kulit berminyak lembab gk berat kulit adem banget efeknya ngurangin redness gk beruntusan harganya,kulit minyak jerawat pakai moisturizer originote nder udah beli ampe jar tekstur enak banget kulit minyak lembab gk berat kulit adem banget efek ngurangin redness gk beruntus harga
155,double cleansing cari ukuran gentong harganya murce makannya pilih micellar originote hyalurose micellar water,double cleansing cari ukur gentong harga murce makan pilih micellar originote hyalurose micellar water
156,produk andalan double cleansing originote hyalurose micellar water facial washnya andalan banget harganya affordable isinya banget racuninskincare,produk andal double cleansing originote hyalurose micellar water facial washnya andal banget harga affordable isi banget racuninskincare
157,qrt this with your kojie san micellar toner moist originote serum npure exfo lip care vaseline lip care rosy lips kangen skincarean banget,qrt this with your kojie san micellar toner moist originote serum npure exfo lip care vaseline lip care rosy lips kangen skincarean banget
158,suka tipe pakai cleansing micellar water ringan lembab dikulit daya angkatnya oke pakai micellar hyalurose originote puas banget pakeknya ukurannya super jumbo lembab bersih pori kulit,suka tipe pakai cleansing micellar water ringan lembab kulit daya angkat oke pakai micellar hyalurose originote puas banget pakeknya ukur super jumbo lembab bersih pori kulit
159,jog membeli micellar water merk originote offline iya gitu terima kasih,jog beli micellar water merk originote offline iya gitu terima kasih
160,haloo cah jual retinol b serum originote preloved berminat rep yaa makasi,haloo cah jual retinol b serum originote preloved minat rep yaa makas
161,kulit bersih debu kotoran ga kepala satuan mata pakai hyalurose micellar water originote as my cleanser emang andalanku banget launching before after,kulit bersih debu kotor ga kepala satu mata pakai hyalurose micellar water originote as my cleanser emang andal banget launching before after
162,membeli originote tokped pakai voc status tokped barang diterima nerima cek kedepan uang paketnya ditetangga uang gmn no kurir komplen responnya lambat banget help,beli originote tokped pakai voc status tokped barang terima nerima cek depan uang paket tetangga uang gmn no kurir komplen responnya lambat banget help
163,originote top skeptis but turns out ngerawat banget kulit breakout menghadapi just readan mas crush udah pusing mikirin muka gadibales udah sebulan pulak,originote top skeptis but turns out ngerawat banget kulit breakout hadap just readan mas crush udah pusing mikirin muka gadibales udah bulan pulak
164,suka micellar water originote alat pump praktis harganya affordable isinya deep cleansingnya oke aman kulit sensitif acne prone skin jugaa,suka micellar water originote alat pump praktis harga affordable isi deep cleansingnya oke aman kulit sensitif acne prone skin jugaa
165,originote ngeluarin micellar water gedenya harga terjangkau kantongku feel so excited pliis size kalah kualitasnya is a good alternatif membeli,originote ngeluarin micellar water gede harga jangkau kantong feel so excited pliis size kalah kualitas is a good alternatif beli
166,serum vit c originote sisa langsung checkout free yaa,serum vit c originote sisa langsung checkout free yaa
167,pakai ku pakai originote enakeun banget lembut kulit perih afternya kering,pakai ku pakai originote enakeun banget lembut kulit perih afternya kering
168,jualaness ready sepatu aero ukuran kotak dateng azaa moisturizer originote,jualaness ready sepatu aero ukur kotak dateng azaa moisturizer originote
169,pilih cleanser sesuai budget boros lately memakai micellar waternya originote isinya harganya affordable worried double cleansing abisnya berbulan,pilih cleanser sesuai budget boros lately pakai micellar waternya originote isi harga affordable worried double cleansing abis bulan
170,originote inii beneran endul bersihin memakai up bisaa,originote ini beneran endul bersihin pakai up bisaa
171,pakai now watching originote kerasa banget ringannya pagi nyaman ga kulit kering beneran sesuai daily skincare,pakai now watching originote rasa banget ringan pagi nyaman ga kulit kering beneran sesuai daily skincare
172,moisturizer inii glow better originote selang seling pagi cosrx almost malam,moisturizer ini glow better originote selang seling pagi cosrx almost malam
173,inimah originote angkat tangan,inimah originote angkat tangan
174,eiemggoriginote st combi bruntusan,eiemggoriginote st combi bruntusan
175,final review hyalurose micellar water originote suka banget harganya super affordable alias micellar water gentong segede muka minusnya yaa emang dibawa travelling berat,final review hyalurose micellar water originote suka banget harga super affordable alias micellar water gentong gede muka minus yaa emang bawa travelling berat
176,serum azarine niacinamide dibarengi vitamin c originote work iya rutin sabar bertahap,serum azarine niacinamide bareng vitamin c originote work iya rutin sabar tahap
177,vit c kak originote oke ga yaah,vit c kak originote oke ga yaah
