,Teks,stemming
642,-jualaness originote hyalu cica eiem azarine skinaqua putih biru nalpamara micellar water garnier nivea dahlia teh keraton tisu &amp; kapas. Semua new &amp; underprice dari store Pengantaran mulai Senin yaa Stok terbatas yg minat bisa reply https://t.co/GDYf6mC1Qo,-jualaness originote hyalu cica eiem azarine skinaqua putih biru nalpamara micellar water garnier nivea dahlia teh keraton tisu amp kapas semua new amp underprice dari store antar mulai senin yaa stok batas yg minat bisa reply https t co gdyf6mc1qo
643,Ciwi-ciwi syg wajib pke moist sdh pke serum?? Punyaku retinol b3 originote. Oily skali sy rasa bela klo pke moist lagi,ciwi-ciwi syg wajib pke moist sdh pke serum punya retinol b3 originote oily skali sy rasa bela klo pke moist lagi
644,@inihairan Done kak ️ Mau eye serum dan mosturizer the originate yg jadi wishlistku ini buat ngurangin mata panda sama moist the originate cocok banget buat kulitku yg berminyak ini Wish me luck https://t.co/GN74UhFHk9,inihairan done kak mau eye serum dan mosturizer the originate yg jadi wishlistku ini buat ngurangin mata panda sama moist the originate cocok banget buat kulit yg minyak ini wish me luck https t co gn74uhfhk9
645,aku dapetnya yang deep neutral! warnanya paling cocok sama kulit aku.. gak keterangan dan gak kegelapan juga. filter ini lumayan membantu sih terutama buat yang mau beli cushion originote cuma masih bingung pilih shades &amp; gak bisa ke storenya langsung. https://t.co/R0kDV3YR8Z,aku dapetnya yang deep neutral warna paling cocok sama kulit aku gak terang dan gak gelap juga filter ini lumayan bantu sih utama buat yang mau beli cushion originote cuma masih bingung pilih shades amp gak bisa ke storenya langsung https t co r0kdv3yr8z
646,Cek The Originote High Cover Serum Cushion dengan harga Rp92.000. Dapatkan di Shopee sekarang! https://t.co/0O3ZGIL28H https://t.co/Z1SuWJICOB,cek the originote high cover serum cushion dengan harga rp92 000 dapat di shopee sekarang https t co 0o3zgil28h https t co z1suwjicob
647,SUNSCREEN SPRAY THE ORIGINOTE siapa yg nyari ss spray murah?? pake aja dari the originote gais karena ukurannya cuma 50ml jadi dia gampang dibawa kemana mana skrng reapply sunscreen praktis banget tinggal semprot semprot doangg proteksinya OK https://t.co/Sfagc7BSPM https://t.co/NNiboXqqEm,sunscreen spray the originote siapa yg nyari ss spray murah pake aja dari the originote gais karena ukur cuma 50ml jadi dia gampang bawa mana mana skrng reapply sunscreen praktis banget tinggal semprot semprot doangg proteksi ok https t co sfagc7bspm https t co nniboxqqem
648,WTB serum Elfolmura exfoliasi or serum exfoliasi the originote yg biruu and tonernya,wtb serum elfolmura exfoliasi or serum exfoliasi the originote yg biruu and tonernya
649,cushion the originote sebagus itu kah? bagus mana sama somethinc??,cushion the originote bagus itu kah bagus mana sama somethinc
650,aku udah cobain cek semua shadenya karena cushion originote ini minim oksidasi jadi aku pilih shade yang paling nyatu dengan kulit aku hasilnya shade light neutral. cuss cobain deh cek di filternya ini link filternya ya ️ https://t.co/lF98pLW9Fi https://t.co/pTCVWlzwgu,aku udah cobain cek semua shadenya karena cushion originote ini minim oksidasi jadi aku pilih shade yang paling nyatu dengan kulit aku hasil shade light neutral cuss cobain deh cek di filter ini link filter ya https t co lf98plw9fi https t co ptcvwlzwgu
651,1) The Originote jujur ini cushion termurah yang aku punya! aku pake shade paling terang (fair) &lt;3. dengan harga under 100k menurutku ini udah bagus banget hasil akhirnya velvet to matte tapi aku ttp set pake loose powder ya https://t.co/W2oxy3uIxT,1 the originote jujur ini cushion murah yang aku punya aku pake shade paling terang fair lt 3 dengan harga under 100k turut ini udah bagus banget hasil akhir velvet to matte tapi aku ttp set pake loose powder ya https t co w2oxy3uixt
652,@panglimajuned mau yg the originote,panglimajuned mau yg the originote
653,Kalo dari filter yang ku coba tadi aku lebih cocok pake shade Light Neutral. Jujur ini akurat banget sihh~ Karena emang biasanya aku pake Cushion The Originote yang shade Light Neutral Shade Light Neutral ini kawin banget di kulitku! Hasilnya cakep banget beneran full https://t.co/sI7r0ydVYj,kalo dari filter yang ku coba tadi aku lebih cocok pake shade light neutral jujur ini akurat banget sihh karena emang biasa aku pake cushion the originote yang shade light neutral shade light neutral ini kawin banget di kulit hasil cakep banget beneran full https t co si7r0ydvyj
654,[bb] mc : the originote fw : hadalabo serum : avoskin azeclair moiz : hadalabo toner : hadalabo ss : skin aqua udah aman belum yaaa?,bb mc the originote fw hadalabo serum avoskin azeclair moiz hadalabo toner hadalabo ss skin aqua udah aman belum yaaa
655,@theconstance_ @JUALAN_AUTOBASE cushion originote nya brpaan ka,theconstance jual autobase cushion originote nya brpaan ka
656,gua ga akan pake ss originote lg najis bgt muka jdi kyk ga mandi,gua ga akan pake ss originote lg najis bgt muka jdi kyk ga mandi
657,@panglimajuned originote masih ga kakk?,panglimajuned originote masih ga kakk
658,itera! preloved wardah powder foundation light feel pemakaian baru 3x ga cocok harga belinya 37k aku jual 20k ama sunscreen the originote masih baru harga beli nya 38k aku jual 30k aja yang mw komen ajaa ntr aku ketuk DM nya jangan lupaa DM nya aktifin!!! ayo dibeli (cont..) https://t.co/9zkBOwqKfD,itera preloved wardah powder foundation light feel pakai baru 3x ga cocok harga beli 37k aku jual 20k ama sunscreen the originote masih baru harga beli nya 38k aku jual 30k aja yang mw komen ajaa ntr aku ketuk dm nya jangan lupaa dm nya aktifin ayo beli cont https t co 9zkbowqkfd
659,@daengskiz aku pake vaselin yg jeli itu lhoo trus pake lip serum originote,daengskiz aku pake vaselin yg jeli itu lhoo trus pake lip serum originote
660,@Lusieinthesky wah sekarang ada shade findernya the originote??? aaaa mau cobainn filternya,lusieinthesky wah sekarang ada shade findernya the originote aaaa mau cobainn filter
661,Cek The Originote Niaceramide Sunscreen Mist SPF 50 PA++++ - Sunscreen Spray Melindungi Wajah dari Sinar Matahari dan Mencerahkan with Niacinamide Ceramide dengan harga Rp42.000. Dapatkan di Shopee sekarang! https://t.co/UCzNofT4bv https://t.co/FOo7qhylYX,cek the originote niaceramide sunscreen mist spf 50 pa - sunscreen spray lindung wajah dari sinar matahari dan cerah with niacinamide ceramide dengan harga rp42 000 dapat di shopee sekarang https t co ucznoft4bv https t co foo7qhylyx
662, cushion untuk cushion aku pake dari the originote aku pake shade yang light warm karena lebih masuk di kulitku. untuk harganya under 100k tapi coveragenya bagus pol &amp; finishnya cakep dikulitku gausah disetting pake bedak juga udah cakep. https://t.co/AOHPIcN5w4 https://t.co/3GxbUCtaoH,cushion untuk cushion aku pake dari the originote aku pake shade yang light warm karena lebih masuk di kulit untuk harga under 100k tapi coveragenya bagus pol amp finishnya cakep kulit gausah disetting pake bedak juga udah cakep https t co aohpicn5w4 https t co 3gxbuctaoh
663,wts toner serum dan moisturizer the originote baru beberapa kali pemakaian &amp; ternyata ga cocok di kulit kuu price: 75k take all (nego) kalau mau satuan boleh bgt yaa tag. wts wts wts wts #zonauang https://t.co/JNWKa48sJE,wts toner serum dan moisturizer the originote baru beberapa kali pakai amp nyata ga cocok di kulit kuu price 75k take all nego kalau mau satu boleh bgt yaa tag wts wts wts wts zonauang https t co jnwka48sje
664,jujur aku suka banget sama complexionnya! cushion the originote finishnya velvet matte &amp; minim crack kalo di aku. yang punya oily skin type pasti bakal suka sekian ajaa tutorialnya‍️ https://t.co/mdfOgxw63c,jujur aku suka banget sama complexionnya cushion the originote finishnya velvet matte amp minim crack kalo di aku yang punya oily skin type pasti bakal suka sekian ajaa tutorial https t co mdfogxw63c
665,[bb] sekarang udah ada FILTER SHADE CUSHION ORIGINOTE di instagram coba cek biar gak salah shade https://t.co/2A0ivSzTS5,bb sekarang udah ada filter shade cushion originote di instagram coba cek biar gak salah shade https t co 2a0ivszts5
666,akhirnya cushion the originote yang keputihan itu bisa kepake juga. so far oke sih 9 jam masih bagus walaupun aku minyakan parah. cuma bagian kacamata doang yang ilang. amat sangat wajar https://t.co/DWMNcUwJe5,akhir cushion the originote yang putih itu bisa kepake juga so far oke sih 9 jam masih bagus walaupun aku minyak parah cuma bagi kacamata doang yang ilang amat sangat wajar https t co dwmncuwje5
667,WTS WTB the originote facetology mascara rose all day ️Harga setelah potongan shopee video 15k ada gratong extra dom jatim #zonauang #zonajajan https://t.co/LVpzOyRsg5,wts wtb the originote facetology mascara rose all day harga telah potong shopee video 15k ada gratong extra dom jatim zonauang zonajajan https t co lvpzoyrsg5
668,Mulai dari yang paling murah: 1. the originote - Light neutral Gila sih mnrt aku ini tuh definisi cushion penghapus dosa full coverage tapi masih berasa ringan dan juga finishnya lbh ke soft matte jadi gak bakal bikin keliatan dempul gitu. https://t.co/JS0wfjt3Mi,mulai dari yang paling murah 1 the originote - light neutral gila sih mnrt aku ini tuh definisi cushion hapus dosa full coverage tapi masih asa ringan dan juga finishnya lbh ke soft matte jadi gak bakal bikin liat dempul gitu https t co js0wfjt3mi
669,yang pertama wajib bangett double cleansing!! walaupun di rumah aja tapi aku tetep ngelakuin double cleansing karna udah seharian pake sunscreen pasti debu minyak kumpul jadi 1 ini aku pake micellar water dari the originote yang udah terbukti aman buat kulit sensitif https://t.co/8YXXZ8BJae,yang pertama wajib bangett double cleansing walaupun di rumah aja tapi aku tetep ngelakuin double cleansing karna udah hari pake sunscreen pasti debu minyak kumpul jadi 1 ini aku pake micellar water dari the originote yang udah bukti aman buat kulit sensitif https t co 8yxxz8bjae
670,The Originote ini ada 12 shades dan aku pakenya yang shades light beige dengan undertone cool tone. Cushion ini tuh cocok untuk semua jenis kulit dan waterproof juga lohh jadi tahan banget dipake seharian diluar rumahh https://t.co/SjVKtaJ2Ys,the originote ini ada 12 shades dan aku pakenya yang shades light beige dengan undertone cool tone cushion ini tuh cocok untuk semua jenis kulit dan waterproof juga lohh jadi tahan banget dipake hari luar rumahh https t co sjvktaj2ys
671,mending moisturizer the originote yang cica warna ijo atau azarine ijo yaaa??? kulit ku oily dan keringetan parah (sebelumnya pake skintific biru) + tolong berikan aku review jujur .. #zonauang pinjam ht lgi bingung mau beli yg mana,mending moisturizer the originote yang cica warna ijo atau azarine ijo yaaa kulit ku oily dan keringetan parah belum pake skintific biru tolong ikan aku review jujur zonauang pinjam ht lgi bingung mau beli yg mana
672,@sunfloliz the originote emang bagus bgt ini,sunfloliz the originote emang bagus bgt ini
673,sbenernya bgus mn sih originote sm eiem,sbenernya bgus mn sih originote sm eiem
674,@abyansaa itu apa? originote ya?,abyansaa itu apa originote ya
675,@JUALAN_AUTOBASE @losehopes Originote brpp??,jual autobase losehopes originote brpp
676,Ada yg mau beli pelembab originote gue gak sie,ada yg mau beli pelembab originote gue gak sie
677,@thursdaiboy Originote nya yang mana coba?,thursdaiboy originote nya yang mana coba
678,wts the originote ceratinol moist only 24k dom jatim udah gratis ongkir extra yaa (harga setelah voucher) #zonauang #zonajajan https://t.co/C9QlqNtPRZ,wts the originote ceratinol moist only 24k dom jatim udah gratis ongkir extra yaa harga telah voucher zonauang zonajajan https t co c9qlqntprz
679,siapa yang pake micellar waternya the originote??!!! minta reviewnyaaaa,siapa yang pake micellar waternya the originote minta reviewnyaaaa
680,Aku bahas dari yang affordable dulu kali yaaa 1. The Originote The Originote ini harganya paling murah 90k an &amp; ada 12 shades jadi ga pusing takut salah shades buat coveragenya dia medium dan finishnya velvet to matte. https://t.co/8CVOBlbIpR,aku bahas dari yang affordable dulu kali yaaa 1 the originote the originote ini harga paling murah 90k an amp ada 12 shades jadi ga pusing takut salah shades buat coveragenya dia medium dan finishnya velvet to matte https t co 8cvoblbipr
681,2 hari kemarin panas banget bjirr saranin ss yg bagus dong dan gabau kayak originote‍️,2 hari kemarin panas banget bjirr saranin ss yg bagus dong dan gabau kayak originote
682,The Originote ceraluronic essence toner ️ https://t.co/rUCSfJUTHq Fungsi: ️ Melembabkan wajah ️ Menjaga skin barrier ️ Menenangkan kulit yang teriritasi *like and rt are very appreciated #racunshopee #racunskincare #brandlokal #zonauang #zonajajan https://t.co/KHYzyZYRkx,the originote ceraluronic essence toner https t co rucsfjuthq fungsi melembabkan wajah jaga skin barrier tenang kulit yang iritasi like and rt are very appreciated racunshopee racunskincare brandlokal zonauang zonajajan https t co khyzyzyrkx
683,WTS WTB the originote facetology mascara rose all day ️Harga setelah potongan shopee video 15k ada gratong extra dom jatim ️HARI INI TERAKHIR YAA POTONGANNYA️ #zonauang #zonajajan https://t.co/lxzenAmZBs,wts wtb the originote facetology mascara rose all day harga telah potong shopee video 15k ada gratong extra dom jatim hari ini akhir yaa potong zonauang zonajajan https t co lxzenamzbs
684,!imissu wts moisturizer the originote yg hyalu 35K/pcs. Dijual krn ganti skincare tapi masih ada stock yg segel.,imissu wts moisturizer the originote yg hyalu 35k pcs jual krn ganti skincare tapi masih ada stock yg segel
685,Wts cushion the originote shade light beige baru sekali tap. 77k aja Alasan jual karna salah shade. #zonaba #zonajajan #zonauang #prelove #cushion,wts cushion the originote shade light beige baru sekali tap 77k aja alas jual karna salah shade zonaba zonajajan zonauang prelove cushion
686,@JUALAN_AUTOBASE Aku ada ss facetology skin aqua ss true to skin ss originote sm setting spray sea makeup kak bisa pakai voc live atau voc video,jual autobase aku ada ss facetology skin aqua ss true to skin ss originote sm setting spray sea makeup kak bisa pakai voc live atau voc video
687,@rachaj8sng aku pake originote ajaaa wkwkwk,rachaj8sng aku pake originote ajaaa wkwkwk
688,The Originote Brightening Moisturizer - Pelembab Wajah untuk Mencerahkan dan Meratakan Warna Kulit Wajah with Niacinamide Rp48.000. https://t.co/nMUNOpMVic https://t.co/dAvqfnlcgi,the originote brightening moisturizer - pelembab wajah untuk cerah dan rata warna kulit wajah with niacinamide rp48 000 https t co nmunopmvic https t co davqfnlcgi
689,skrg lagi make originote sih,skrg lagi make originote sih
690,@vuazry ini ya kak kalo produknya the originote https://t.co/vGF3hPZj7e,vuazry ini ya kak kalo produk the originote https t co vgf3hpzj7e
691,@cinuamonroll @tubbirfess perih gkkk kak? aku ada mw originote,cinuamonroll tubbirfess perih gkkk kak aku ada mw originote
692,@mawardirenda @ohmybeautybank TO tuh apa kak? the originote atau torriden?,mawardirenda ohmybeautybank to tuh apa kak the originote atau torriden
693,@susupisangpeju Mau tanya kak sehabis pake eksfo toner avoskin itu boleh langsung pake mois originote yg hijau itu kah?,susupisangpeju mau tanya kak habis pake eksfo toner avoskin itu boleh langsung pake mois originote yg hijau itu kah
694,haruskah aku mencoba retinolnya the originote,harus aku coba retinolnya the originote
695,mau cobain cushion the originote tapi ga pergi kemana2 ,mau cobain cushion the originote tapi ga pergi kemana2
696,Seneng ya kalau punya kakak ngoleksi skincare jd bisa icip2. For the first time aku nyobain brand Facetology. Langsung cobain si paling viral sunscreennya Suka deh ada efek tone up &amp; blurring porinya Yg udh coba lemme know dong pendapat kalian tentang SS ini #Deluxuryskin https://t.co/oy9x8d9Mz7,neng ya kalau punya kakak ngoleksi skincare jd bisa icip2 for the first time aku nyobain brand facetology langsung cobain si paling viral sunscreennya suka deh ada efek tone up amp blurring pori yg udh coba lemme know dong dapat kalian tentang ss ini deluxuryskin https t co oy9x8d9mz7
697,Dia kenapa gak bikin brand yg high end luxury gitu ya? Padahal kan dia brandingnya sultan skincare aja pakenya lamer &amp; la praire ,dia kenapa gak bikin brand yg high end luxury gitu ya padahal kan dia brandingnya sultan skincare aja pakenya lamer amp la praire
698,Yang punya anak pasti familiar dengan brand-brand ini Parents coba deh ikutan tim Ibupedia buat tebak-tebak nama brand produk anak ini. Ada brand skincare makanan sampai mainan anak nih Berapa merek nih yang bisa ketebak? https://t.co/Ho4iYKOSg4,yang punya anak pasti familiar dengan brand-brand ini parents coba deh ikut tim ibupedia buat tebak nama brand produk anak ini ada brand skincare makan sampai main anak nih berapa merek nih yang bisa tebak https t co ho4iykosg4
699,Wah gue baru tau brand skincare belio https://t.co/Ntg34KDdgx,wah gue baru tau brand skincare belio https t co ntg34kddgx
700,[bb] kadang suka bingung berapa lama masa pao skincare/makeup krn ga semua brand nyantumin logo pao surat terbuka untuk brand skincare/makeup untuk mencantumi logo pao ini tuh penting banget pdahal https://t.co/AVCrwBDUyX,bb kadang suka bingung berapa lama masa pao skincare makeup krn ga semua brand nyantumin logo pao surat buka untuk brand skincare makeup untuk cantum logo pao ini tuh penting banget pdahal https t co avcrwbduyx
701,*。Lagi nyobain face wash terbaru dari @Nayeon_Skincare Skinkare dari brand lokal dengan kandungan 10X HA Complex pertama di Indonesia lho!! #reviewsal #READYTOGLOW #LEVELUPYOURGLOW #NAYEONSKINCARE #READYTOBE https://t.co/SDef73nd89,lagi nyobain face wash baru dari nayeon skincare skinkare dari brand lokal dengan kandung 10x ha complex pertama di indonesia lho reviewsal readytoglow levelupyourglow nayeonskincare readytobe https t co sdef73nd89
702,Jujur pas awal aku kira ini brand korea packagingnya mirip sama brand korea yang dulu aku pernah pake + isinya juga banyak mirip skincare korea eh ternyata ini lokal brand salut deh sekarang lokal brand mulai improve packaging jadi lebih cakep kaya gini #racuninskincare https://t.co/IL6dSqUhPD,jujur pas awal aku kira ini brand korea packagingnya mirip sama brand korea yang dulu aku pernah pake isi juga banyak mirip skincare korea eh nyata ini lokal brand salut deh sekarang lokal brand mulai improve packaging jadi lebih cakep kaya gin racuninskincare https t co il6dsquhpd
703,Skincare local dengan kandungan 10x HA complex udah gitu kandungannya langsung dari Korea? Okee aku mau review Acne Fight Cica dulu️ ini local brand Nayeon punya #Racuninskincare https://t.co/YrWSmRiIRf,skincare local dengan kandung 10x ha complex udah gitu kandung langsung dari korea okee aku mau review acne fight cica dulu ini local brand nayeon punya racuninskincare https t co yrwsmriirf
704,Soalan untuk semua especially girls. Since dah masuk new year kan what is your top 3 fav local skincare brand? Yang korang pakai sepanjang 2023. Yang truly works sooo much on your skin &lt;3,soal untuk semua especially girls since dah masuk new year kan what is your top 3 fav local skincare brand yang korang pakai panjang 2023 yang truly works sooo much on your skin lt 3
705,Skincare sat set buat traveling but powerful Yang belum tau Oasea tuh brand lokal loh! Packaging nya sangat simple. Sekalian aku review deh #RacuninSkincare https://t.co/bSAER7FiiK,skincare sat set buat traveling but powerful yang belum tau oasea tuh brand lokal loh packaging nya sangat simple sekali aku review deh racuninskincare https t co bsaer7fiik
706,Barangkali di antara temen temen ada yg lagi cari kerja (domisi Bandung atau bersedia bekerja di Bandung) punya pengalaman marketing untuk brand skincare. Boleh dm aku yaa atau boleh bantu retweet juga. Terimakasih ,barangkali di antara temen temen ada yg lagi cari kerja domisi bandung atau sedia kerja di bandung punya alam marketing untuk brand skincare boleh dm aku yaa atau boleh bantu retweet juga terimakasih
707,WEH KORANG!!!!! GUARDIAN 40% OFF ALL SKINCARE BRAND gila murah terukkkkk. Hada Labo my favoritaaaaaaa pun tgh sale ya allah teringin nak try The Raw and Skintific jugakkkk. Cosmetic pun ade sale jugak https://t.co/56jn10XeJx,weh korang guardian 40 off all skincare brand gila murah terukkkkk hada labo my favoritaaaaaaa pun tgh sale ya allah ingin nak try the raw and skintific jugakkkk cosmetic pun ade sale jugak https t co 56jn10xejx
708,Dua produk skincare dari brand yang aku bucinin banget! Nggak tau udah habis berapa banyak terutama sunsticknya. Anyway brand yang satu ini juga dipakai banyak artis Korea kayak Jung Yumi sama Enhypen #racuninskincare https://t.co/xItPbdCPAg,dua produk skincare dari brand yang aku bucinin banget nggak tau udah habis berapa banyak utama sunsticknya anyway brand yang satu ini juga pakai banyak artis korea kayak jung yumi sama enhypen racuninskincare https t co xitpbdcpag
709,Sadis banget brand skincare asia timur ngaku-ngaku lokal mecat karyawan cuma karena salah translate 1 kata utk ads yg belom launch. Pecat langsung pula. Ga dikasih ruang buat pembelaan.,sadis banget brand skincare asia timur ngaku-ngaku lokal mecat karyawan cuma karena salah translate 1 kata utk ads yg bom launch pecat langsung pula ga kasih ruang buat bela
710,hoki aku tahun ini tuh pas di kasih 10 produk skincare seharga 150k ngadi ngadi banget emang brand yang ini @raeccaid #racuninskincare https://t.co/i9Bwa6Etpn https://t.co/lGPJahwIiC,hoki aku tahun ini tuh pas di kasih 10 produk skincare harga 150k ngadi ngadi banget emang brand yang ini raeccaid racuninskincare https t co i9bwa6etpn https t co lgpjahwiic
711,[ yume reona ] #yumelokalgallery #hughugmlyt24 ー Seusai sesi pemotretan brand skincare wartawan dari berbagai media langsung mengepung tuan muda dan tunangannya yang baru diungkap ke publik dalam acara bincang-bincang pemain timnas di Bi El TV minggu lalu ️️ https://t.co/7pCpBLknUc,yume reona yumelokalgallery hughugmlyt24 usai sesi potret brand skincare wartawan dari bagai media langsung kepung tuan muda dan tunang yang baru ungkap ke publik dalam acara bincang main timnas di bi el tv minggu lalu https t co 7pcpblknuc
712,Ubel ada ide urebranding imej @pepengbison Gimana kalo personal brandingnya pepeng jadi Pengusaha Skincare yang kaya banget dengan penghasilan 2M per hari Pasti banyak yang suka Nama brand skincarenya 'PEPENG GLOW' Gimana timses? @rubymeong @mikoceng @pupawkwk @ikikemul https://t.co/wP34QwiFw7,ubel ada ide urebranding imej bison gimana kalo personal brandingnya pepeng jadi usaha skincare yang kaya banget dengan hasil 2m per hari pasti banyak yang suka nama brand skincarenya pepeng glow gimana timses rubymeong mikoceng pupawkwk ikikemul https t co wp34qwifw7
713,Belakangan lagi seneng nerapin skincare minimalis semenjak nemuin emulsionnya Hyalupure ini Bener2 praktis karena aku bisa dapetin 2 manfaat skincare sekaligus yaitu serum dan moisturizer cuma dalam satu produk. Dan surprisingly ini brand local loh. Keren bgt gasiiii?! https://t.co/Brq3sIrsCg,belakang lagi neng nerapin skincare minimal semenjak nemuin emulsionnya hyalupure ini bener2 praktis karena aku bisa dapetin 2 manfaat skincare sekaligus yaitu serum dan moisturizer cuma dalam satu produk dan surprisingly ini brand local loh keren bgt gasiiii https t co brq3sirscg
714,Aku rasa pakai sheet mask ni skincare routine paling mudah boleh buat. Sebelum tido cuci muka tepek mask then terus . Bangun esok muka rasa hydrated &amp; glowing Nah aku jumpa sheet mask brand Korea paling harga B40. 1 box cukup pakai sebulan terus https://t.co/1gyJNpwFHW,aku rasa pakai sheet mask ni skincare routine paling mudah boleh buat belum tido cuci muka tepek mask then terus bangun esok muka rasa hydrated amp glowing nah aku jumpa sheet mask brand korea paling harga b40 1 box cukup pakai bulan terus https t co 1gyjnpwfhw
715,acara ini aku di undang sama brand skincare local namanya trueve. mungkin kalian juga udah pernah dengar namanya bener bener bersyukur sama apa yang aku lalui hari ini. thank youu juga trueve udah ajakin aku https://t.co/fjU4rjOVIE,acara ini aku di undang sama brand skincare local nama trueve mungkin kalian juga udah pernah dengar nama bener bener syukur sama apa yang aku lalu hari ini thank youu juga trueve udah ajakin aku https t co fju4rjovie
716,Pernah jumpa MinMin dedepan? Kulit dia sumpah takda cacat cela ya. Nak tahu kenapa? Sebab dia ni owner brand skincare. Go la support.,pernah jumpa minmin dedepan kulit dia sumpah takda cacat cela ya nak tahu kenapa sebab dia ni owner brand skincare go la support
717,Yap ini produk dari brand skincare favoritku The Originote Hyalurose Micellar Water Punya main ingredients triple hyaluronic acid allantoin dan rosa damascena flower water. Fungsinya sebagai deep cleansing melembabkan dan menenangkan kulit menyegarkan wajah juga. https://t.co/x4wrrAinWC,yap ini produk dari brand skincare favorit the originote hyalurose micellar water punya main ingredients triple hyaluronic acid allantoin dan rosa damascena flower water fungsi bagai deep cleansing melembabkan dan tenang kulit segar wajah juga https t co x4wrrainwc
718,diajakin kerja sama bareng brand besar skincare dan ada hasil dari freelance yang bisa bikin aku biayain kuliahku sendiri sampe lulus! https://t.co/QRsJfzQfBp,diajakin kerja sama bareng brand besar skincare dan ada hasil dari freelance yang bisa bikin aku biayain kuliah sendiri sampe lulus https t co qrsjfzqfbp
