,Teks,stemming
864,Kalau pakek skincare eksfoliator AHA BHA dan nunjukin kapasnya coklat itu berarti proses cleansing kalean yang kurang bersih. Nih pakai glycolic acid 35% kapasnya gak coklat https://t.co/NjQFdQLEAc,kalau pakek skincare eksfoliator aha bha dan nunjukin kapas coklat itu arti proses cleansing kalean yang kurang bersih nih pakai glycolic acid 35 kapas gak coklat https t co njqfdqleac
865,Travel ni selalu sekejap je. kalau kejap ni seboleh boleh nak bawa barang sikit and jimat ruang. kalau pergi travel selalunya i akan bawa skincare travel Perfume travel. semua yang kecik and travel friendly kalau cari perfume decant perfume maksudnya original perfume yg di https://t.co/53pgwYv9ka,travel ni selalu kejap je kalau kejap ni boleh boleh nak bawa barang sikit and jimat ruang kalau pergi travel selalu i akan bawa skincare travel perfume travel semua yang kecik and travel friendly kalau cari perfume decant perfume maksud original perfume yg di https t co 53pgwyv9ka
866,Buat yang mau ngurangin isi lemari tapi nggak tau harus dikemanain kalian bisa nih donasiin baju bekas kalian. Ada juga akun buat donasi barang bekas kirim sampah bekas skincare botol dan juga sampah organik! Source https://t.co/DZeSKX3HuK https://t.co/0fkTFbYjG3,buat yang mau ngurangin isi lemari tapi nggak tau harus dikemanain kalian bisa nih donasiin baju bekas kalian ada juga akun buat donasi barang bekas kirim sampah bekas skincare botol dan juga sampah organik source https t co dzeskx3huk https t co 0fktfbyjg3
867, tetap skincare an walau tidur jam satu malam,tetap skincare an walau tidur jam satu malam
868,combo paling i suka dan paling wajib pakai every night !! i hope this combo akan ngam dengan my skin forever skin i kadang suka tiba tiba tolak skincare product dekat muka!! so far this combo still okay!!! please eh ngammm je sampai keluar moisturiser! boleh jadi trio https://t.co/VRZuB2fL3w,combo paling i suka dan paling wajib pakai every night i hope this combo akan ngam dengan my skin forever skin i kadang suka tiba tiba tolak skincare product dekat muka so far this combo still okay please eh ngammm je sampai keluar moisturiser boleh jadi trio https t co vrzub2fl3w
869,Peti Sejuk mini tak sampai seratus!!!! Ngam teruk untuk student and orang bujang yang menyewa.. Boleh letak dalam bilik. Ringan sesuai untuk simpan makanan atau skincare. Thread https://t.co/jUUGb6SAGH,peti sejuk mini tak sampai ratus ngam teruk untuk student and orang bujang yang sewa boleh letak dalam bilik ringan sesuai untuk simpan makan atau skincare thread https t co juugb6sagh
870,Investasi jangka panjang buat para cewe-cewe jangan di skip yaa!! Bukan cuma muka yang butuh skincare tapi boobs care juga ternyata penting banget lohh!! Akhir-akhir ini aku lagi suka banget pake Prisa Bust Fit Secret Serum ️ #boobscare #racuninbodycare #racunskincare https://t.co/xeZOJgQDSJ,investasi jangka panjang buat para cewe-cewe jangan di skip yaa bukan cuma muka yang butuh skincare tapi boobs care juga nyata penting banget lohh akhir ini aku lagi suka banget pake prisa bust fit secret serum boobscare racuninbodycare racunskincare https t co xezojgqdsj
871,Curhat sejak kenal base diskon jadi selalu ngestock skincare dan beli pas dapet voucher atau diskon doang wkwk Semua ini bahkan ga sampe 210k Ada yg samaan? https://t.co/2AndGqSvnG,curhat sejak kenal base diskon jadi selalu ngestock skincare dan beli pas dapet voucher atau diskon doang wkwk semua ini bahkan ga sampe 210k ada yg sama https t co 2andgqsvng
872,Teksturnya bening cair lightweight gituu pas dipakai. Jadi gampang nyerap ga bikin lengket atau over hydrate yang bikin gak nyaman dikulit. Nyaman banget dipakai untuk night skincare routine https://t.co/ObgLneHJxy,tekstur bening cair lightweight gituu pas pakai jadi gampang nyerap ga bikin lengket atau over hydrate yang bikin gak nyaman kulit nyaman banget pakai untuk night skincare routine https t co obglnehjxy
873,️ TW JERAWAT PUNGGUNG! kamu ada permasalahan kulit dibadan jangan khawatir aku ada solusinya. Rintik Skincare No Bump Lation ⟡ a review thread #racuninbodycare cr: pinterest https://t.co/qX1soEOUW5,tw jerawat punggung kamu ada masalah kulit bad jangan khawatir aku ada solusi rintik skincare no bump lation a review thread racuninbodycare cr pinterest https t co qx1soeouw5
874,spill skincare nya bang @shxx131bi131 https://t.co/mUu0BSN6uV,spill skincare nya bang shxx131bi131 https t co muu0bsn6uv
875,@discountfess Samaan nderr tp ini baru sabun sm dapur aja kaya kebutuhan anak skincare make up belum kefoto dan masih ada yg belum sampe juga minyak gorengnya masih ada 5pcs yg 2 liter https://t.co/CpiQcZ5Uso,discountfess sama nderr tp ini baru sabun sm dapur aja kaya butuh anak skincare make up belum foto dan masih ada yg belum sampe juga minyak goreng masih ada 5pcs yg 2 liter https t co cpiqcz5uso
876,Selamat Pagi PECINTA SKINCARE!! Untuk kebutuhan medsos banyak tipsnya lho! https://t.co/0KQ4GRwJkc,selamat pagi cinta skincare untuk butuh medsos banyak tipsnya lho https t co 0kq4grwjkc
877,[bb] TW// JERAWAT ada yang pernah kondisi kulitnya begini? boleh bantuin sender saranin produk apa buat kondisi yang begini ga? ini jerawatnya merah mateng gatel dan sakit. sender udah fokus ke hydrating aja pake skincare nya 0rig1note yang cica skin type nya combi to (cont..) https://t.co/ukBerYimR2,bb tw jerawat ada yang pernah kondisi kulit begini boleh bantuin sender saranin produk apa buat kondisi yang begini ga ini jerawat merah mateng gatel dan sakit sender udah fokus ke hydrating aja pake skincare nya 0rig1note yang cica skin type nya combi to cont https t co ukberyimr2
878,Spill kegiatan minggu kalian dong selain me time dan pake skincare ya https://t.co/P4XCNzW8in,spill giat minggu kalian dong selain me time dan pake skincare ya https t co p4xcnzw8in
879,Big order for @tatagaltier dekat tiktokshop kitaa btw korang voucher RM3 still ada tauu cepat grab before habiss grocey bag dah tinggal sikit tauuu bb https://t.co/JRxiAOlRK9 https://t.co/rSkwd7B8Cp,big order for tatagaltier dekat tiktokshop kitaa btw korang voucher rm3 still ada tauu cepat grab before habiss grocey bag dah tinggal sikit tauuu bb https t co jrxiaolrk9 https t co rskwd7b8cp
880,[bb] kalian kalo ngabisin skincare brp bulan? ini akumulasi dr beberapa bulan yg lalu sih kalo aku kdg bisa sampe setahun baru abis soalnya pake banyak produk https://t.co/0CDABFmv0W,bb kalian kalo ngabisin skincare brp bulan ini akumulasi dr beberapa bulan yg lalu sih kalo aku kdg bisa sampe tahun baru abis soal pake banyak produk https t co 0cdabfmv0w
881,Spill skincare nya dong sayang https://t.co/fl7bYQNCMl,spill skincare nya dong sayang https t co fl7byqncml
882,[BB] kasih tau aku saran pouch buat tempat skincare dong,bb kasih tau aku saran pouch buat tempat skincare dong
883,️: sayang mau di buang dimana? me: diwajah aja yang buat skincare aku,sayang mau di buang mana me wajah aja yang buat skincare aku
884,Ciwi-ciwi mana nih suaranya‍️ Buruan serbu Makeup dan Skincare mumpung lagi DISKON HINGGA 90% Tap tap tap &gt;&gt; https://t.co/8Rv52mE4ng #PromoBBF #PromoMakeup #DiskonSkincare #GilaDiskon #AkulakuIndonesia https://t.co/oJ8ok0ooo6,ciwi-ciwi mana nih suara buru serbu makeup dan skincare mumpung lagi diskon hingga 90 tap tap tap gt gt https t co 8rv52me4ng promobbf promomakeup diskonskincare giladiskon akulakuindonesia https t co oj8ok0ooo6
885,1. HAUFF The Hauffsome Package 3 produk skincare cowo yg efektif mengontrol minyak pd wajah mencerahkan wajah kusam &amp; mengatasi bekas jerawat hanya dalam 3-6 minggu krn dilengkapi bahan2 spt Activated Charcoal Alpha Arbutin Niacinamide &amp; Vit C https://t.co/hSYGx6QH9n https://t.co/my5Y8VLRQA,1 hauff the hauffsome package 3 produk skincare cowo yg efektif kontrol minyak pd wajah cerah wajah kusam amp atas bekas jerawat hanya dalam 3-6 minggu krn lengkap bahan2 spt activated charcoal alpha arbutin niacinamide amp vit c https t co hsygx6qh9n https t co my5y8vlrqa
886, Double Combo Skincare untuk skin barrier kamu!! . . Alo guisseee akutuh punya permasalahan kulit wajah yaitu wajah aku sensitif banget.. karna cuaca juga akhir2 ini ga nentu bgt yh Jadi lumayan berdampak untuk wajah aku,double combo skincare untuk skin barrier kamu alo guisseee akutuh punya masalah kulit wajah yaitu wajah aku sensitif banget karna cuaca juga akhir2 ini ga nentu bgt yh jadi lumayan dampak untuk wajah aku
887,/beauty/ sebutin basic skincare kalian apa aja dong + skintype nya juga yaaa,beauty sebutin basic skincare kalian apa aja dong skintype nya juga yaaa
888,KIEHL'S X GENSHIN IMPACT UNBOXING YEY Sblmnya makasih buat kak @nenemonrie karena udah bantu aku jajan fyi Kiehl's itu skincare yg menurut aku bagus bgt (udah pake sejak sblm main genshin) jd collab uwu ini terlalu sayang utk diskip Link yutup: https://t.co/MYW5LdaRcY https://t.co/ZaktBVFEXp,kiehl s x genshin impact unboxing yey sblmnya makasih buat kak nenemonrie karena udah bantu aku jajan fyi kiehl s itu skincare yg turut aku bagus bgt udah pake sejak sblm main genshin jd collab uwu ini terlalu sayang utk skip link yutup https t co myw5ldarcy https t co zaktbvfexp
889,Bila ada orang tanya cane nak buat pores nampak kecik LELAJU AKU SURUH PAKAI BLUMARINE AMPOULE NOK. I mean.. HELLO???? EVEN WITH MAKEUP??? MY PORES KAYAKKNYA UDAH GAK ADA YA??? Kanan ni gambar i bebetul lepas cuci muka no skincare??? Pun porinya udah gone?? https://t.co/b9Z3C2aqmI,bila ada orang tanya cane nak buat pores nampak kecik laju aku suruh pakai blumarine ampoule nok i mean hello even with makeup my pores kayakknya udah gak ada ya kanan ni gambar i bebetul lepas cuci muka no skincare pun pori udah gone https t co b9z3c2aqmi
890,Info penting nih guys ️ Kalian yang lagi cari skincare dan makeup lagi ada s4le di jxb brandnya banyak bgtt coba kalian cek di pict ada brand yg kalian lagi incer gaaa? Buat katal0g full nya kalian bisa join grup pake link dibawah yaa https://t.co/srljTk5kGi https://t.co/tc9gsG9pXf,info penting nih guys kalian yang lagi cari skincare dan makeup lagi ada s4le di jxb brandnya banyak bgtt coba kalian cek di pict ada brand yg kalian lagi incer gaaa buat katal0g full nya kalian bisa join grup pake link bawah yaa https t co srljtk5kgi https t co tc9gsg9pxf
891,Kenapa ya skincare kalo abis barengan semua dari serum facial wash dll... Beruntung banget Lazada ada buat aku yang mau CO skincare bulan ini hihi soalnya ada #GratisOngkirDiLazada https://t.co/sg76A1yzUS,kenapa ya skincare kalo abis bareng semua dari serum facial wash dll untung banget lazada ada buat aku yang mau co skincare bulan ini hihi soal ada gratisongkirdilazada https t co sg76a1yzus
892,MU Skin Care https://t.co/fF0329Hmic,mu skin care https t co ff0329hmic
893,Masih agak ga rela ngabisin duit buat skincare pdhl emang butuh ,masih agak ga rela ngabisin duit buat skincare pdhl emang butuh
894,Toko Skincare dan kosmetik Comboin sama voc live diskon 50% https://t.co/K0xxaOBNx7 https://t.co/tsWcAJ70tE,toko skincare dan kosmetik comboin sama voc live diskon 50 https t co k0xxaobnx7 https t co tswcaj70te
895,Bht ziada serums aur skin care products le liye hai sab dua kray k main unko use bhi krlo ,bht ziada serums aur skin care products le liye hai sab dua kray k main unko use bhi krlo
896,Kalau udah tau kamu bisa pilih skincare yang udah MinVo rekomendasiin di sini sesuai bekas jerawat kamu ya #CumadiTwitterAvoskin https://t.co/mafIcIgU2K,kalau udah tau kamu bisa pilih skincare yang udah minvo rekomendasiin di sini sesuai bekas jerawat kamu ya cumaditwitteravoskin https t co maficigu2k
897,The Hauffsome Package Paket skincare cowo simple dgn 3 produk yg ampuh mengatasi bekas jerawat mencegah jerawat menghilangkan kerutan &amp; mencerahkan wajah seketika hanya 3-4 minggu https://t.co/WadNAfCo74 https://t.co/kvvEc3SIKt,the hauffsome package paket skincare cowo simple dgn 3 produk yg ampuh atas bekas jerawat cegah jerawat hilang kerut amp cerah wajah ketika hanya 3-4 minggu https t co wadnafco74 https t co kvvec3sikt
898,tekstur tonernya cair agak kental tapi cepet meresap. cara pakenya aku kompresin pake kapas ke bekas jerawat atau bruntusan. trs aku diemin selama 10 menitan baru deh aku lanjut ke step skincare selanjutnya https://t.co/NtTn1D6Gfs https://t.co/7PLOfZMytK,tekstur tonernya cair agak kental tapi cepet resap cara pakenya aku kompresin pake kapas ke bekas jerawat atau bruntusan trs aku diemin lama 10 menit baru deh aku lanjut ke step skincare lanjut https t co nttn1d6gfs https t co 7plofzmytk
899,Lika liku pengen glowing tapi males skincare-an,lika liku ken glowing tapi males skincare-an
900,makin ramai customer i nak try cleanser teh bunga ni + ada yang dah start repeat..i selalu berharap skincare yg i jual sesuai dgn skin dorang,makin ramai customer i nak try cleanser teh bunga ni ada yang dah start repeat i selalu harap skincare yg i jual sesuai dgn skin dorang
901,skincare experts boleh tolong suggest any type of skincare utk nak kecutkan jerawat blind acne ni mcmne ya? after dah surut 1 satu lgi timbul. yg mesra poket plis i pakaii dom sulfur drying lotion tu skrg tp ad lgi yg lgi better? ,skincare experts boleh tolong suggest any type of skincare utk nak kecut jerawat blind acne ni mcmne ya after dah surut 1 satu lgi timbul yg mesra poket plis i pakai dom sulfur drying lotion tu skrg tp ad lgi yg lgi better
902,[BB] balik ke per-skincare-an Korea karena kulit lagi ngamuk &amp; bikin hemat di kantong. ST dry acne prone sensitif. 2 bln pake rangkaian ini atopic ku membaik Btw cuma cleansernya aja yg dari aussie QV ini gentle mirip cetaphil. https://t.co/DzOz9ylSXW,bb balik ke per-skincare-an korea karena kulit lagi ngamuk amp bikin hemat di kantong st dry acne prone sensitif 2 bln pake rangkai ini atopic ku baik btw cuma cleansernya aja yg dari aussie qv ini gentle mirip cetaphil https t co dzoz9ylsxw
903,[BB] saran skincare buat mengatasi wajah yg kusam dong,bb saran skincare buat atas wajah yg kusam dong
904,Sebelum tidurr uda pada skincare night routine belumm?? Jangan sampe ke skipp yaa... Meemin kasi rekomendasi skincare favoritee.. 8 manfaat dalam 1 serumm https://t.co/XCYYxwzlaJ,belum tidurr uda pada skincare night routine belumm jangan sampe ke skipp yaa meemin kasi rekomendasi skincare favoritee 8 manfaat dalam 1 serumm https t co xcyyxwzlaj
905,#LazBeautyJakartaxBeauty udah di depan mata. Siap beli yang mana nih Lazadians? Makeup atau skincare nih? https://t.co/fd86KdWwv5,lazbeautyjakartaxbeauty udah di depan mata siap beli yang mana nih lazadians makeup atau skincare nih https t co fd86kdwwv5
906,oke aku up skrng GA brunya ini skincare yaa,oke aku up skrng ga brunya ini skincare yaa
907,JB adakah seller skincare yang ada grup order bisa request produk? mau join hihi sebut dom yah,jb ada seller skincare yang ada grup order bisa request produk mau join hihi sebut dom yah
908,Penyelamat dari masalah jerawat muuuu!!! Masih bingung mau beli skincare yang cocok buat kamu yang bermasalah dengan jerawat yuk coba intip produk ️A-Care Kit️ Udah banyakk yg cocokk https://t.co/FT77DhRG4I,selamat dari masalah jerawat muuuu masih bingung mau beli skincare yang cocok buat kamu yang masalah dengan jerawat yuk coba intip produk a-care kit udah banyakk yg cocokk https t co ft77dhrg4i
909,[bb] aku berencana buat lepas dari krim d0kter kira2 harus puasa skincare berapa lama ya?,bb aku rencana buat lepas dari krim d0kter kira2 harus puasa skincare berapa lama ya
910,[bb] Hi! Kira-kira pakai skincare apa yaa untuk hilangin whiteheads di hidung sama bagian bawah bibir? TIA!,bb hi kira pakai skincare apa yaa untuk hilangin whiteheads di hidung sama bagi bawah bibir tia
911,kode voucher 8.8 #zonauang #zonaBU #zonajajan input disini https://t.co/SlHws0uaD0 diskon 100% 10rb 88pedia (Haircare Bodycare) 88verra (Aksesoris) 88asusu (Susu) 88dishop (Pakaian Anak) 88nik80 (Skincare Makeup) 88cahaya (Apotik) 88oolid (Aksesoris) 88shell 88candra ,kode voucher 8 8 zonauang zonabu zonajajan input sini https t co slhws0uad0 diskon 100 10rb 88pedia haircare bodycare 88verra aksesoris 88asusu susu 88dishop pakai anak 88nik80 skincare makeup 88cahaya apotik 88oolid aksesoris 88shell 88candra
912, guys aku baru aja abisin duit sebesar 483k buat skincare Aku beli fw mw serum ss moist toner dll aku mau perawatan soalnya muka aku ada bekas jerawat+ pori2 besar + komedo+tekstur kulit ga meratamenurut kalian itu mahal bgt ga si?,guys aku baru aja abisin duit besar 483k buat skincare aku beli fw mw serum ss moist toner dll aku mau awat soal muka aku ada bekas jerawat pori2 besar komedo tekstur kulit ga meratamenurut kalian itu mahal bgt ga si
913, : buk aku sesuk meh tumbas skincare sak paket hehe ‍️ : halah ngopo skincare an i wong gak duwe pacar kok kalah karo bocil Ibukku nek ngomong langsung mak jleb tenan menusuk ke hatiku yang mungil ,buk aku sesuk meh tumbas skincare sak paket hehe halah ngopo skincare an i wong gak duwe pacar kok kalah karo bocil ibukku nek ngomong langsung mak jleb tenan tusuk ke hati yang mungil
914,why i suka skin tint sebab dia ada Vitamin C so dia macam skincare and makeup at the same time ️ : https://t.co/5eFphzCbax And yang best lagi sebab dia ada SPF50/PA+++ as your sunscreen so kalau korang tak pakai sunscreen pun takpa https://t.co/cnaMCQeT4D,why i suka skin tint sebab dia ada vitamin c so dia macam skincare and makeup at the same time https t co 5efphzcbax and yang best lagi sebab dia ada spf50 pa as your sunscreen so kalau korang tak pakai sunscreen pun takpa https t co cnamcqet4d
915,Mantap banget beli skincare hits cuma 40 ribuan Kalian bisa dapet PROMO CUAN DISKON 50% di sesi SHOPEE LIVE bareng RUBEN ONSU besok jam 20.00 WIB lhoo~ Set reminder di sini: https://t.co/9XlfWMPZaU,mantap banget beli skincare hits cuma 40 ribu kalian bisa dapet promo cuan diskon 50 di sesi shopee live bareng ruben onsu besok jam 20 00 wib lhoo set reminder di sini https t co 9xlfwmpzau
916,Abb mummy papa ko kon samjhaye ki night skin care krna makeup krna nhi hota h ‍,abb mummy papa ko kon samjhaye ki night skin care krna makeup krna nhi hota h
917,[bb] capek banget muka aku makin kusam wajah sama leher kayak jadi lebih gelap dari pada sebelumnya apa itu tanda-tanda skincarenya gak cocok ya? Recommend brand skincare basic (fw-moist-ss) yg ampuh buat mencerahkan dongg ,bb capek banget muka aku makin kusam wajah sama leher kayak jadi lebih gelap dari pada belum apa itu tanda skincarenya gak cocok ya recommend brand skincare basic fw-moist-ss yg ampuh buat cerah dongg
918,orang kalo ngurusin lgbt paling semangat mending semangatnya dipake buat mikir dulu lemari es yang isinya masih kopong gimana bayar utang genteng rumah bocor tagihan kredit cari promo skincare biar glow-up dll..,orang kalo ngurusin lgbt paling semangat mending semangat dipake buat mikir dulu lemari es yang isi masih kopong gimana bayar utang genteng rumah bocor tagih kredit cari promo skincare biar glow-up dll
919,Skin care products se kuch nhi hota banda khush ho dil se glow khud hi ajaaata hai,skin care products se kuch nhi hota banda khush ho dil se glow khud hi ajaaata hai
920,@ohmybeautybank Ya Allah ada2 aja sekarang makanya aku klo beli mekap ama skincare kalo ga di offline store ya di shopee Mall sekalian,ohmybeautybank ya allah ada2 aja sekarang makanya aku klo beli mekap ama skincare kalo ga di offline store ya di shopee mall sekali
921, Cari cowo sana Me *otak yg males mikirin cowo. Pengennya borong skincare glow up dahsyat di karir fisik pemikiran dan atittude,cari cowo sana me otak yg males mikirin cowo ken borong skincare glow up dahsyat di karir fisik pikir dan atittude
922,@worksfess ayahku kerja sana nder enak sering dikasih skincare/make up nya pernah juga diberangkatin umroh kalo dulu sering ada wisata bareng keluarga tapi semenjak corona udah g ada,worksfess ayah kerja sana nder enak sering kasih skincare make up nya pernah juga diberangkatin umroh kalo dulu sering ada wisata bareng keluarga tapi semenjak corona udah g ada
923,Minggu sore bukan waktunya santai-santai! Kamu harus prepare buat checkout skincare Clarins di #LazMallIDxClarins #BigBrandDay 31 Juli ada Diskon Hingga 50% Beli 1 Dapat 15 Hadiah 100% Original dan Gratis Ongkir Buruan beli di sini: https://t.co/C7nHZ0gW2z #TambahKeHidupmu https://t.co/Ksi5Gqz6sx,minggu sore bukan waktu santai kamu harus prepare buat checkout skincare clarins di lazmallidxclarins bigbrandday 31 juli ada diskon hingga 50 beli 1 dapat 15 hadiah 100 original dan gratis ongkir buru beli di sini https t co c7nhz0gw2z tambahkehidupmu https t co ksi5gqz6sx
924,sebenernya mereka insecure ngeliat orang cakep dikit langsung dibilang laki ngapain make up laki ngapain pake skincare apalagi sampe ngatain plastik. ya ampun mending u guys berbenah wajah aja deh soalnya laki yang udah cakep gak bakal bilang begitu,sebenernya mereka insecure ngeliat orang cakep dikit langsung bilang laki ngapain make up laki ngapain pake skincare apalagi sampe ngatain plastik ya ampun mending u guys benah wajah aja deh soal laki yang udah cakep gak bakal bilang begitu
925,Tetap pake skincare sebelum tidur walau ujungnya luntur dengan air mata wkkw ,tetap pake skincare belum tidur walau ujung luntur dengan air mata wkkw
926,Sini mimin bisikin skincare yang bikin kulit sempurna! Pasti cuma dari The Face Temulawak dan bisa kamu beli di LazMall dengan Diskon s.d. 65% Hadiah Menarik dan Voucher Diskon~ Serbu di sini: https://t.co/emA7Hu0RyO #TambahKeHidupmu https://t.co/s1fCawMIAJ,sini mimin bisikin skincare yang bikin kulit sempurna pasti cuma dari the face temulawak dan bisa kamu beli di lazmall dengan diskon s d 65 hadiah tarik dan voucher diskon serbu di sini https t co ema7hu0ryo tambahkehidupmu https t co s1fcawmiaj
927,i dulu beli skincare banyak gila macamni. percayalah less is more ,i dulu beli skincare banyak gila macamni percaya less is more
928,Apa itu hyaluronic acid? Hyaluronic acid adalah senyawa yang biasanya terdapat di skincare dan berfungsi untuk menahan air agar kulit tetap terhidrasi &amp; lembap. Kandungan ini sering ditemui dalam produk perawatan kulit seperti pelembap serum dan krim anti-penuaan ‍,apa itu hyaluronic acid hyaluronic acid adalah senyawa yang biasa dapat di skincare dan fungsi untuk tahan air agar kulit tetap hidrasi amp lembap kandung ini sering temu dalam produk awat kulit seperti lembap serum dan krim anti-penuaan
929,Lahh dah kenapa nak perli2 i dulu jual skincare tetiba jual kek? I kalau boleh jual air liur pun i jual. Anything for money i buat. Nak perli2 cakap i sengkek ke apa cakap lah. Satu pun tak lut dkt i.,lahh dah kenapa nak perli2 i dulu jual skincare tetiba jual kek i kalau boleh jual air liur pun i jual anything for money i buat nak perli2 cakap i sengkek ke apa cakap lah satu pun tak lut dkt i
930,@tanyarlfes Jurusan Pendidikan Kimia sekarang jadi Beauty Consultant di salah satu Brand Skincare hehe ‍,tanyarlfes jurus didik kimia sekarang jadi beauty consultant di salah satu brand skincare hehe
931,-rek ready skincare ori underprice bisa cod &amp; freeong lewat shopi order dgn voc disk0n shopi live juga bisa by req. https://t.co/7LhtJYxY8z https://t.co/INie0FwiVd,-rek ready skincare ori underprice bisa cod amp freeong lewat shopi order dgn voc disk0n shopi live juga bisa by req https t co 7lhtjyxy8z https t co inie0fwivd
932,@floisme_ @4tunerrr @tanyarlfes Tapi yang beginian beneran ada salah satu penyebabnya bisa karena pemakaian skincare abal2 yg bikin kulit tipis sampe rambut tumbuh lebat/urat nya bener2 keliatan,floisme 4tunerrr tanyarlfes tapi yang begini beneran ada salah satu sebab bisa karena pakai skincare abal2 yg bikin kulit tipis sampe rambut tumbuh lebat urat nya bener2 liat
933,@starfess Unit sugar daddy ini bukan kaleng² Segala skin care make up smpe tas make up pun dimodalin ,starfess unit sugar daddy ini bukan kaleng segala skin care make up smpe tas make up pun dimodalin
934,@ohmybeautybank itulah kenapa kita sebagai penikmat konten juga harus bisa memaknai informasi. kalo aku nangkepnya lebih ke back to basic ya ada benernya tenangin kulit dulu baru take action (kalo di kasus kulitku) soalnya aku ke spkk jg ujungnya fokus basic skincare kondisi kulit udh oke ,ohmybeautybank itu kenapa kita bagai nikmat konten juga harus bisa makna informasi kalo aku nangkepnya lebih ke back to basic ya ada benernya tenangin kulit dulu baru take action kalo di kasus kulit soal aku ke spkk jg ujung fokus basic skincare kondisi kulit udh oke
935,@the29thofapril Tauu itu lucu bgt. Kocak echi ga pernah masak sampe bakar dapurnya ty. Dah gitu tabungan mereka diabisin echi buat beli skincare tapi skrg dah ilang bukunya,the29thofapril tauu itu lucu bgt kocak echi ga pernah masak sampe bakar dapur ty dah gitu tabung mereka diabisin echi buat beli skincare tapi skrg dah ilang buku
936,Ini namanya realistis nder calon kamu ngajak join income bener bgt ini. Mungkin gaji lu bisa buat nabung buat asset dan biaya operational rumah tangga. Klo kebutuhan wanita spt skincare baju dll mkn calon kamu bisa penuhin sendiri.,ini nama realistis nder calon kamu ngajak join income bener bgt ini mungkin gaji lu bisa buat nabung buat asset dan biaya operational rumah tangga klo butuh wanita spt skincare baju dll mkn calon kamu bisa penuhin sendiri
937,@MatilahHukumnya Tutty Fruity (sekarang mcm muncul balik) Motorola (henfon) Rorine (kasut n beg) Avon (mekap n skincare) okay next .,matilahhukumnya tutty fruity sekarang mcm muncul balik motorola henfon rorine kasut n beg avon mekap n skincare okay next
938,@bitiesfess Mending nanya lipbalm nya merk apa sunscreen atau skincare routine nya ges ... leebih bermanfaat,bitiesfess mending nanya lipbalm nya merk apa sunscreen atau skincare routine nya ges leebih manfaat
939,Terakhiir Mumpung baru gajian saatnya restock skincare‼️,terakhiir mumpung baru gaji saat restock skincare
