,stop_word,stemming
544,originote niaceramide sunscreen mist baunya enak banget diluar dugaan enak skintfc murah sekalee ceramide cepat banget abisnya beneran,originote niaceramide sunscreen mist bau enak banget luar duga enak skintfc murah sekalee ceramide cepat banget abis beneran
545,membeli masker originote cuman seribu pliss,beli masker originote cuman ribu pliss
546,jualaness titipan serum avoskin kondisinya edisi nov serum npure edisi jan serum originote retinol edisi feb,jualaness titip serum avoskin kondisi edisi nov serum npure edisi jan serum originote retinol edisi feb
547,even postingan ga buzzer ala ala honest review jawabannya plek ketiplek janjian skintific originote overrated,even postingan ga buzzer ala ala honest review jawab plek ketiplek janji skintific originote overrated
548,samaa originote berpengaruh banget manjangin bulu mata nebelin alis,samaa originote pengaruh banget manjangin bulu mata nebelin alis
549,now watching originote nder,now watching originote nder
550,cek special bundle in originote paket skincare face wash toner serum moisturizer sunscreen acne kit glowing kit barrier kit anti aging kit exfoliating kit brightening kit harga rp dapatkan shopee,cek special bundle in originote paket skincare face wash toner serum moisturizer sunscreen acne kit glowing kit barrier kit anti aging kit exfoliating kit brightening kit harga rp dapat shopee
551,cek originote bundle skin soothing soothing toner soothing moisturizer harga rp dapatkan shopee,cek originote bundle skin soothing soothing toner soothing moisturizer harga rp dapat shopee
552,cek special bundle in originote kit facial wash toner serum moisturizer sunscreen masker wajah acne kit glowing kit barrier kit anti aging kit exfoliating kit brightening kit harga rp dapatkan shopee,cek special bundle in originote kit facial wash toner serum moisturizer sunscreen masker wajah acne kit glowing kit barrier kit anti aging kit exfoliating kit brightening kit harga rp dapat shopee
553,cm terima kasih moistnya originote cica,cm terima kasih moistnya originote cica
554,originote ceraluronic essence toner toner melembabkan wajah menjaga skin barrier with ceramide hyaluronic acid rp,originote ceraluronic essence toner toner melembabkan wajah jaga skin barrier with ceramide hyaluronic acid rp
555,cek originote series facial cleanser serum moisturizer gel gede acne spot cream eye serumbpom harga rp dapatkan shopee,cek originote series facial cleanser serum moisturizer gel gede acne spot cream eye serumbpom harga rp dapat shopee
556,selldips abisin stok yu guyss micellar water originote facetology sisa pcs kpcs ajaa yu balas,selldips abisin stok yu guyss micellar water originote facetology sisa pcs kpcs ajaa yu balas
557,nomer cushionnya originote murahh under satin to matte finish oily skin friendlylt no oksidasi lambat cakep tahan kulit ku oily gampang geser longsor x tap cover muka skincare infused shade,nomer cushionnya originote murahh under satin to matte finish oily skin friendlylt no oksidasi lambat cakep tahan kulit ku oily gampang geser longsor x tap cover muka skincare infused shade
558,tes tess hadiah cushion originote ikutann komen dl pakai shade apaa,tes tess hadiah cushion originote ikutann komen dl pakai shade apaa
559,cek originote bha charcoal clay mask masker wajah mud mask eksfoliasi mengangkat sel kulit mati menghilangkan minyak berlebih with charcoal bha harga rp dapatkan shopee,cek originote bha charcoal clay mask masker wajah mud mask eksfoliasi angkat sel kulit mati hilang minyak lebih with charcoal bha harga rp dapat shopee
560,habis exfo ga lupa pakai moisturizer kulit lembap lagii pakai originote gatau moist membeli disinii,habis exfo ga lupa pakai moisturizer kulit lembap lagi pakai originote gatau moist beli sini
561,bcs moist originote hbs coba ganti moist mireya viral lihat bagus soon review mireya mochi mochi glow expert gel cream moisturizer gede rekomendasi moisturizer viral mencerahkan,bcs moist originote hbs coba ganti moist mireya viral lihat bagus soon review mireya mochi mochi glow expert gel cream moisturizer gede rekomendasi moisturizer viral cerah
562,emang tidur checkout cushionnya originote semoga iya,emang tidur checkout cushionnya originote moga iya
563,kulitnya sawo matang memakai cushion originote memakai shade ganti cushion terima kasih,kulit sawo matang pakai cushion originote pakai shade ganti cushion terima kasih
564,cek originote micellar foam cleanser sabun cuci muka busa face wash facial cleanser membersihkan wajah with ceramide harga rp dapatkan shopee,cek originote micellar foam cleanser sabun cuci muka busa face wash facial cleanser bersih wajah with ceramide harga rp dapat shopee
565,originote finishnya velvet to matte oksidasi nderr,originote finishnya velvet to matte oksidasi nderr
566,wooyy org cushion originote loose powder dazzle bagus,wooyy org cushion originote loose powder dazzle bagus
567,dimarahin habis membeli sunscreen membeli sunscreen free sesuai originote mari beralih,dimarahin habis beli sunscreen beli sunscreen free sesuai originote mari alih
568,originote gang experienceku pakai adem dimuka,originote gang experienceku pakai adem muka
569,bodoh checkout micellar water originote hitam pdahal sebotol tauu abisnya bulanan asuuw,bodoh checkout micellar water originote hitam pdahal botol tauu abis bulan asuuw
570,dips dibeli yuk preloved nego tipistipis iya skin teacica preloved sisa skin hyalucica preloved terpakai x moist originote preloved senka,dips beli yuk preloved nego tipistipis iya skin teacica preloved sisa skin hyalucica preloved pakai x moist originote preloved senka
571,buka puasa tunjukan sunscreen ku bagus ah madame gie originote skintific racunshopee,buka puasa tunjuk sunscreen ku bagus ah madame gie originote skintific racunshopee
572,cek special bundle in originote paket skincare face wash toner serum moisturizer sunscreen acne kit glowing kit barrier kit anti aging kit exfoliating kit brightening kit harga rp dapatkan shopee,cek special bundle in originote paket skincare face wash toner serum moisturizer sunscreen acne kit glowing kit barrier kit anti aging kit exfoliating kit brightening kit harga rp dapat shopee
573,suka coveragenya manteb sesuai acara full seharian mencoba skintificsomethinc originote wajib set pakai bedak cari sesuai daily ringan ga oksidasi originote jawabanya murah,suka coveragenya manteb sesuai acara full hari coba skintificsomethinc originote wajib set pakai bedak cari sesuai daily ringan ga oksidasi originote jawabanya murah
574,cek special bundle in originote paket skincare face wash toner serum moisturizer sunscreen acne kit glowing kit barrier kit anti aging kit exfoliating kit brightening kit harga rp dapatkan shopee,cek special bundle in originote paket skincare face wash toner serum moisturizer sunscreen acne kit glowing kit barrier kit anti aging kit exfoliating kit brightening kit harga rp dapat shopee
575,cek originote high cover serum cushion harga rp dapatkan shopee,cek originote high cover serum cushion harga rp dapat shopee
576,help to sale preloved skincare lngsung checkout lipsvelvet brasov serum originote moisturizer preloved serum moizturizer lipstick velvet skincareroutine skincareproducts prelovedskincare,help to sale preloved skincare lngsung checkout lipsvelvet brasov serum originote moisturizer preloved serum moizturizer lipstick velvet skincareroutine skincareproducts prelovedskincare
577,cuan originote charcoal mask sunscreen spray take all kondisi msi segel,cuan originote charcoal mask sunscreen spray take all kondisi msi segel
578,murah alias under pilihan shadenya buanyak originote coverage medium to full banget dibuildable finishnya velvet to matte,murah alias under pilih shadenya buanyak originote coverage medium to full banget dibuildable finishnya velvet to matte
579,hai teman-teman jual cushion originote alasan dijual shadenya kegelapann bandung yaa harganya knegotiable terima kasih youu,hai teman jual cushion originote alas jual shadenya kegelapann bandung yaa harga knegotiable terima kasih youu
580,cushion finishnya velvet matte enak banget lambat warnanya menyatu crack kulit keringku bingung pilih shade cushion originote bisaa cek thread iya,cushion finishnya velvet matte enak banget lambat warna satu crack kulit kering bingung pilih shade cushion originote bisaa cek thread iya
581,originote finishnya velvet to matte oksidasi nderr,originote finishnya velvet to matte oksidasi nderr
582,umsfess preloved moisturizer brightening originote like,umsfess preloved moisturizer brightening originote like
583,pengen cushion originote try on langsung dimana gaberani blind buying dr ecomm takut shadesnya gamasuk,ken cushion originote try on langsung mana gaberani blind buying dr ecomm takut shadesnya gamasuk
584,reply thread produk originote penasaran pengen mencoba pilih coin,reply thread produk originote penasaran ken coba pilih coin
585,yayaya pakai originote pakai shade terang warm yaa beneran sesuka cushion pdhl pakai pergi kendaraan kena panas oke,yayaya pakai originote pakai shade terang warm yaa beneran suka cushion pdhl pakai pergi kendara kena panas oke
586,ready stok originote cicab soothing moisturizer toner wajah mencerahkan berjerawat linknya iya,ready stok originote cicab soothing moisturizer toner wajah cerah jerawat linknya iya
587,temukan dapatkan originote dayc nighta bundle pcs hyaluc serum retinol serum rp shopee shopeeid,temu dapat originote dayc nighta bundle pcs hyaluc serum retinol serum rp shopee shopeeid
588,temukan dapatkan originote bundle extra brightening gluta b serum jelly booster brightening moisturizer rp shopee shopeeid,temu dapat originote bundle extra brightening gluta b serum jelly booster brightening moisturizer rp shopee shopeeid
589,fix ga sesuai memakai originote memakai whitelab aman langsung cerahan kusem,fix ga sesuai pakai originote pakai whitelab aman langsung cerah kusem
590,tunjukan teman-teman facial wash senkasafi micelar water tergantung serum implorathe originote moisturizer skin derma sunscreen implora loose powder lip product body wash zee body serumlotion marinaazarine ajasih,tunjuk teman facial wash senkasafi micelar water gantung serum implorathe originote moisturizer skin derma sunscreen implora loose powder lip product body wash zee body serumlotion marinaazarine ajasih
591,hai ning order skincare selagi voucher shopi video cashbck sd ayo diorder nominalnya turun wtb originote moisturizer brightening cica ceratinol niaceramide sunscreen cont,hai ning order skincare selagi voucher shopi video cashbck sd ayo order nominal turun wtb originote moisturizer brightening cica ceratinol niaceramide sunscreen cont
592,coba originote,coba originote
593,anyoba originote nunggu habis mencoba sea makeup abisnya segede galon banget buset,anyoba originote nunggu habis coba sea makeup abis gede galon banget buset
594,preloved cushion originote shade medium warm swatch tipis pakai tangan puff dipakai nego dom jogja shopee free ongkos kirim wtt shade medium neutral wtb wtt,preloved cushion originote shade medium warm swatch tipis pakai tangan puff pakai nego dom jogja shopee free ongkos kirim wtt shade medium neutral wtb wtt
595,selldips abisin stok yu guyss micellar water originote facetology sisa pcs kpcs ajaa yu balas,selldips abisin stok yu guyss micellar water originote facetology sisa pcs kpcs ajaa yu balas
596,kataku cari complexion oksidasi mencoba cushion originote,kata cari complexion oksidasi coba cushion originote
597,originote hyalurose micellar water pembersih wajah memakai up remover cleansing water melembabkan wajah with hyaluronic acid harga rp dapatkan shopee,originote hyalurose micellar water bersih wajah pakai up remover cleansing water melembabkan wajah with hyaluronic acid harga rp dapat shopee
598,now watching originote facetology yaa nder minat cuss,now watching originote facetology yaa nder minat cuss
599,ga originote membeli true to skin shade muffin,ga originote beli true to skin shade muffin
600,mas membeli tab yaallah moga nular rezekinya aamiin,mas beli tab yaallah moga nular rezeki aamiin
601,coba originote mantap,coba originote mantap
602,pake retinolmoist originote dipakainya malam iya,pake retinolmoist originote pakai malam iya
603,cek originote bundle charcoal clay mask mugwort b clay stick harga rp dapatkan shopee,cek originote bundle charcoal clay mask mugwort b clay stick harga rp dapat shopee
604,originote bha charcoal clay mask masker wajah mud mask eksfoliasi mengangkat sel kulit mati menghilangkan minyak berlebih with charcoal bha harga rp dapatkan shopee,originote bha charcoal clay mask masker wajah mud mask eksfoliasi angkat sel kulit mati hilang minyak lebih with charcoal bha harga rp dapat shopee
605,now watching originote after voc svideo barangkali berminat nder,now watching originote after voc svideo barangkali minat nder
606,vuguvugu dpworld linaendelea as wananchi wakionekana kutoridhia bandari yao kupewa waarab na hata uhamisho wa kabila wamasai kutolewa originate yao iya mkoa wa arusha na kupelekwa mkoani tanga kwa ndugu zetu wasambaa nikakumbuka hata uwanja wa kia walipewa waarab nika,vuguvugu dpworld linaendelea as wananchi wakionekana kutoridhia bandar yao kupewa waarab na hata uhamisho wa kabila wamasai kutolewa originate yao iya mkoa wa arusha na kupelekwa mkoani tanga kwa ndugu zetu wasambaa nikakumbuka hata uwanja wa kia walipewa waarab nika
607,originote finishnya velvet matte lambat glowing skin like sblm checkout mencoba filternya cek shade,originote finishnya velvet matte lambat glowing skin like sblm checkout coba filter cek shade
608,cushion originote under pakai jam pksidasi,cushion originote under pakai jam pksidasi
609,high coverage skintific originote skin like somethinc true to skin instaperfectt coba sihh coba cari riviewnyaa cus patokan gimanaa,high coverage skintific originote skin like somethinc true to skin instaperfectt coba sihh coba cari riviewnyaa cus patok gimanaa
610,pengen banget jajanin cushion originote lihat review orang orang bgus shadenya banget wish luck terimakasih kak ngadain hadiah semoga rezeki kakak lancarkan kebahagian kesehatan aminnm,ken banget jajanin cushion originote lihat review orang orang bgus shadenya banget wish luck terimakasih kak ngadain hadiah moga rezeki kakak lancar kebahagian sehat aminnm
611,kalap banget diskon marketplace sebelah,kalap banget diskon marketplace belah
612,originote hyalurose micellar water pembersih wajah memakai up remover cleansing water melembabkan wajah with hyaluronic acid rp,originote hyalurose micellar water bersih wajah pakai up remover cleansing water melembabkan wajah with hyaluronic acid rp
613,moist originote request barang langsung komen,moist originote request barang langsung komen
614,cek originote bundle skin soothing soothing toner soothing moisturizer harga rp dapatkan shopee,cek originote bundle skin soothing soothing toner soothing moisturizer harga rp dapat shopee
615,skintific originote glad to glow sea memakai up bare blis yaa pokoknya produk china ramai pasarnya toktok overrated berasa monopoli udah act like produk lokal pdhl gk lokal mengambil pasarnya indo,skintific originote glad to glow sea pakai up bare blis yaa pokok produk china ramai pasar toktok overrated asa monopoli udah act like produk lokal pdhl gk lokal ambil pasar indo
616,originote bha charcoal clay mask masker wajah mud mask eksfoliasi mengangkat sel kulit mati menghilangkan minyak b dapatkan shopee,originote bha charcoal clay mask masker wajah mud mask eksfoliasi angkat sel kulit mati hilang minyak b dapat shopee
617,preloved skincare originote ceraluronic essence toner hadalabo gokujyun toner hijau azarine moisturizer intense luminous dom blitar jatim gratong link skincare,preloved skincare originote ceraluronic essence toner hadalabo gokujyun toner hijau azarine moisturizer intense luminous dom blitar jatim gratong link skincare
618,gils menang feyrely unke naru skintific azarine avoskin originote,gils menang feyrely unke naru skintific azarine avoskin originote
619,pakai cosrx oil free originote cica b shooting,pakai cosrx oil free originote cica b shooting
620,yuk diborongg originote kpcs pcs yaa codanter kos free ongkos kirim yak khusus jualaness,yuk diborongg originote kpcs pcs yaa codanter kos free ongkos kirim yak khusus jualaness
621,habis mencoba mugwort sticknya originote skintific better skintific ngebersihin banget banget endingnya kulitnya ga keset originote keset banget dibilas ga ngebersihin somehow muka super cerah dibilas,habis coba mugwort sticknya originote skintific better skintific ngebersihin banget banget endingnya kulit ga keset originote keset banget bilas ga ngebersihin somehow muka super cerah bilas
622,dips preloved produk originote ga iya mencoba sesuai engga makasiww,dips preloved produk originote ga iya coba sesuai engga makasiww
623,pakai originote ijo,pakai originote ijo
624,cushion originote shade terang warm banget ga buka alasan dijual berubah pikiran checkout shade shopee freeong tokped freeong iya dom bogor,cushion originote shade terang warm banget ga buka alas jual ubah pikir checkout shade shopee freeong tokped freeong iya dom bogor
625,mois originote serum azarine plis ambil gratis ga sesuai,mois originote serum azarine plis ambil gratis ga sesuai
626,bingung toner originote bareng prettywell egk hllow clarifying toner hydrating exfo bingung difolbek omb nitip,bingung toner originote bareng prettywell egk hllow clarifying toner hydrating exfo bingung difolbek omb nitip
627,complexion suka banget cushionnya originote coveragenya medium to full gabikin dempul tementemen lihat tap redness darkspot lumayan tercover,complexion suka banget cushionnya originote coveragenya medium to full gabikin dempul tementemen lihat tap redness darkspot lumayan tercover
628,pake udah coba cushion originote review rekomen cushion bagus aman dompet,pake udah coba cushion originote review rekomen cushion bagus aman dompet
629,sunscreen originote ga enak banget berasa minyakan banget kayaknya sesuai memakai bedak,sunscreen originote ga enak banget asa minyak banget kayak sesuai pakai bedak
630,jualaness moist skintific moist originote segel ori yaa minat komen iya langsung chat wa tertera codanter kos area unnes,jualaness moist skintific moist originote segel ori yaa minat komen iya langsung chat wa tera codanter kos area unnes
631,originote eyelash serum murce banget gilakk ga perih mata cepat menyerap berpengaruh nebelin bulu mata lumayan manjangin,originote eyelash serum murce banget gilakk ga perih mata cepat serap pengaruh nebelin bulu mata lumayan manjangin
632,sunscreen serum originote ssnya cmn pakai ga pakai mukaku kusem serumnya tinggal checkout dishopee set pack,sunscreen serum originote ssnya cmn pakai ga pakai muka kusem serum tinggal checkout dishopee set pack
633,tweet review beauty enthu smakin membeli cushionnya originotekali plis banget semoga sesuai ye wak,tweet review beauty enthu smakin beli cushionnya originotekali plis banget moga sesuai ye wak
634,serum hyalu c originote shampo safi hair expert shampo natur gingseng azrina charcoal mud mask barang exp aman oren video yaa,serum hyalu c originote shampo safi hair expert shampo natur gingseng azrina charcoal mud mask barang exp aman oren video yaa
635,tahap langsung timpa pakai current suka complexion originote cushion super suka pol menurutku skinlike velvet finish pakai shade terang warm yaa,tahap langsung timpa pakai current suka complexion originote cushion super suka pol turut skinlike velvet finish pakai shade terang warm yaa
636,originote cushion harganya murah kualitasnya ga semurah harganya coveragenya bagus menutupi bekas jerawatku samar suka finishnya kulit glowing berminyak ringan oksidasinya,originote cushion harga murah kualitas ga murah harga coveragenya bagus tutup bekas jerawat samar suka finishnya kulit glowing minyak ringan oksidasi
637,originote preloved moisturizer serum essence toner sunblock isi dipakai x take all nego dom depok jawabarat yaa oren alasan jual udah pakai merk lai exp membeli,originote preloved moisturizer serum essence toner sunblock isi pakai x take all nego dom depok jawabarat yaa oren alas jual udah pakai merk lai exp beli
638,cushion andalan beauty vlogger cushion skintific originote somethinc hanasui,cushion andal beauty vlogger cushion skintific originote somethinc hanasui
639,cushion originote pakai shade terang neutral suka banget pakai cushion coveragenya medium membangun full coverage suka ringan ga oksidasi,cushion originote pakai shade terang neutral suka banget pakai cushion coveragenya medium bangun full coverage suka ringan ga oksidasi
640,membeli twc sea makeup cushion originote,beli twc sea makeup cushion originote
641,kecipratan minyak panas gara-gara goreng otak kerasa panas cekit merah tangan ngide kuolesin moisturizernya originote boomm panasnya berangsur hilang kerasa panas,ciprat minyak panas gara-gara goreng otak rasa panas cekit merah tangan ngide kuolesin moisturizernya originote boomm panas angsur hilang rasa panas
642,jualaness originote hyalu cica eiem azarine skinaqua putih biru nalpamara micellar water garnier nivea dahlia kakak perempuan keraton tisu kapas underprice store pengantaran senin yaa stok terbatas minat reply,jualaness originote hyalu cica eiem azarine skinaqua putih biru nalpamara micellar water garnier nivea dahlia kakak perempuan keraton tisu kapas underprice store antar senin yaa stok batas minat reply
643,ciwiciwi sayang wajib pake moist pake serum punyaku retinol b originote oily skali bela pake moist,ciwiciwi sayang wajib pake moist pake serum punya retinol b originote oily skali bela pake moist
644,done kak eye serum mosturizer originate wishlistku ngurangin mata panda moist originate sesuai banget kulitku berminyak wish luck,done kak eye serum mosturizer originate wishlistku ngurangin mata panda moist originate sesuai banget kulit minyak wish luck
645,dapetnya deep neutral warnanya sesuai kulit keterangan kegelapan filter lumayan membantu membeli cushion originote bingung pilih shades storenya langsung,dapetnya deep neutral warna sesuai kulit terang gelap filter lumayan bantu beli cushion originote bingung pilih shades storenya langsung
646,cek originote high cover serum cushion harga rp dapatkan shopee,cek originote high cover serum cushion harga rp dapat shopee
647,sunscreen spray originote mencari spray murah pakai originote gais ukurannya gampang dibawa kemana reapply sunscreen praktis banget tinggal semprot semprot doangg proteksinya ok,sunscreen spray originote cari spray murah pakai originote gais ukur gampang bawa mana reapply sunscreen praktis banget tinggal semprot semprot doangg proteksi ok
648,wtb serum elfolmura exfoliasi or serum exfoliasi originote biruu tonernya,wtb serum elfolmura exfoliasi or serum exfoliasi originote biruu tonernya
649,cushion originote sebagus kah bagus somethinc,cushion originote bagus kah bagus somethinc
650,mencoba cek shadenya cushion originote oksidasi pilih shade menyatu kulit hasilnya shade terang neutral cuss mencoba cek filternya link filternya iya,coba cek shadenya cushion originote oksidasi pilih shade satu kulit hasil shade terang neutral cuss coba cek filter link filter iya
651,originote jujur cushion termurah pakai shade terang fair lt harga under menurutku bagus banget hasil velvet to matte ttp set pakai loose powder iya,originote jujur cushion murah pakai shade terang fair lt harga under turut bagus banget hasil velvet to matte ttp set pakai loose powder iya
652,originote,originote
653,filter ku coba sesuai pakai shade terang neutral jujur akurat banget sihh emang pakai cushion originote shade terang neutral shade terang neutral kawin banget kulitku hasilnya cakep banget beneran full,filter ku coba sesuai pakai shade terang neutral jujur akurat banget sihh emang pakai cushion originote shade terang neutral shade terang neutral kawin banget kulit hasil cakep banget beneran full
654,mc originote hadalabo serum avoskin azeclair moiz hadalabo toner hadalabo skin aqua aman yaa,mc originote hadalabo serum avoskin azeclair moiz hadalabo toner hadalabo skin aqua aman yaa
655,cushion originote brpaan kakak,cushion originote brpaan kakak
656,ga pakai originote najis banget muka ga mandi,ga pakai originote najis banget muka ga mandi
657,originote ga kakk,originote ga kakk
658,itera preloved wardah powder foundation terang feel pemakaian x ga sesuai harga belinya jual sunscreen originote harga membeli jual now watching komen ajaa ntr ketuk lupaa aktifin ayo dibeli cont,itera preloved wardah powder foundation terang feel pakai x ga sesuai harga beli jual sunscreen originote harga beli jual now watching komen ajaa ntr ketuk lupaa aktifin ayo beli cont
659,pakai vaselin jeli lhoo pakai lip serum originote,pakai vaselin jeli lhoo pakai lip serum originote
660,shade findernya originote aa cobainn filternya,shade findernya originote aa cobainn filter
661,cek originote niaceramide sunscreen mist spf pa sunscreen spray melindungi wajah sinar matahari mencerahkan with niacinamide ceramide harga rp dapatkan shopee,cek originote niaceramide sunscreen mist spf pa sunscreen spray lindung wajah sinar matahari cerah with niacinamide ceramide harga rp dapat shopee
662,cushion cushion pakai originote pakai shade terang warm masuk kulitku harganya under coveragenya bagus pol finishnya cakep dikulitku gausah disetting pakai bedak cakep,cushion cushion pakai originote pakai shade terang warm masuk kulit harga under coveragenya bagus pol finishnya cakep kulit gausah disetting pakai bedak cakep
663,toner serum moisturizer originote kali pemakaian ga sesuai kulit kuu price take all nego satuan banget yaa tag,toner serum moisturizer originote kali pakai ga sesuai kulit kuu price take all nego satu banget yaa tag
