,stop_word,stemming
908,penyelamat jerawat muu bingung membeli skincare sesuai bermasalah jerawat yuk coba intip produk acare kit banyakk cocokk,selamat jerawat muu bingung beli skincare sesuai masalah jerawat yuk coba intip produk acare kit banyakk cocokk
909,berencana lepas krim dkter puasa skincare lambat iya,rencana lepas krim dkter puasa skincare lambat iya
910,hai kirakira memakai skincare yaa hilangin whiteheads hidung bibir tia,hai kirakira pakai skincare yaa hilangin whiteheads hidung bibir tia
911,kode voucher input diskon pedia haircare bodycare verra aksesoris asusu susu dishop pakaian anak nik skincare makeup cahaya apotik oolid aksesoris shell candra,kode voucher input diskon dia haircare bodycare verra aksesoris asusu susu dishop pakai anak nik skincare makeup cahaya apotik oolid aksesoris shell candra
912,teman-teman abisin duit skincare membeli now watching serum moist toner lain-lain perawatan muka bekas jerawat pori komedotekstur kulit ga meratamenurut mahal banget ga,teman abisin duit skincare beli now watching serum moist toner lain awat muka bekas jerawat pori komedotekstur kulit ga meratamenurut mahal banget ga
913,buk sesuk meh tumbas skincare sak paket halah ngopo skincare duwe pacar kalah karo bocil ibukku nek bicara langsung jleb tenan menusuk hatiku mungil,buk sesuk meh tumbas skincare sak paket halah ngopo skincare duwe pacar kalah karo bocil ibukku nek bicara langsung jleb tenan tusuk hati mungil
914,why suka skin tint vitamin c so skincare makeup at same time best spfpa as your sunscreen so korang memakai sunscreen takpa,why suka skin tint vitamin c so skincare makeup at same time best spfpa as your sunscreen so korang pakai sunscreen takpa
915,mantap banget membeli skincare hits ribuan promo cuan diskon sesi shopee live bareng ruben onsu besok jam wib lhoo set reminder,mantap banget beli skincare hits ribu promo cuan diskon sesi shopee live bareng ruben onsu besok jam wib lhoo set reminder
916,abb mummy papa ko kon samjhaye ki night skin care krna makeup krna nhi hota h,abb mummy papa ko kon samjhaye ki night skin care krna makeup krna nhi hota h
917,capek banget muka kusam wajah leher kayak gelap tandatanda skincarenya sesuai iya recommend brand skincare basic fwmoistss ampuh mencerahkan dongg,capek banget muka kusam wajah leher kayak gelap tandatanda skincarenya sesuai iya recommend brand skincare basic fwmoistss ampuh cerah dongg
918,orang ngurusin lgbt semangat semangatnya berfikir lemari es isinya kopong bayar utang genteng rumah bocor tagihan kredit cari promo skincare glowup lain-lain,orang ngurusin lgbt semangat semangat berfikir lemari es isi kopong bayar utang genteng rumah bocor tagih kredit cari promo skincare glowup lain
919,skin care products kuch nhi hota banda khush ho dil glow khud hai ajaata hai,skin care products kuch nhi hota banda khush ho dil glow khud hai ajaata hai
920,iya membeli mekap skincare ga offline store iya shopee mall,iya beli mekap skincare ga offline store iya shopee mall
921,cari cowo otak males mikirin cowo pengennya borong skincare glow up dahsyat karir fisik pemikiran atittude,cari cowo otak males mikirin cowo ken borong skincare glow up dahsyat karir fisik pikir atittude
922,ayahku kerja nder enak dikasih skincaremake up diberangkatin umroh wisata bareng keluarga semenjak corona g,ayah kerja nder enak kasih skincaremake up diberangkatin umroh wisata bareng keluarga semenjak corona g
923,minggu sore santaisantai prepare checkout skincare clarins lazmallidxclarins bigbrandday juli diskon membeli hadiah original gratis ongkos kirim buruan membeli tambahkehidupmu,minggu sore santaisantai prepare checkout skincare clarins lazmallidxclarins bigbrandday juli diskon beli hadiah original gratis ongkos kirim buru beli tambahkehidupmu
924,sebenernya insecure orang cakep langsung dibilang laki memakai up laki pakai skincare ngatain plastik iya ampun teman-teman berbenah wajah laki cakep,sebenernya insecure orang cakep langsung bilang laki pakai up laki pakai skincare ngatain plastik iya ampun teman benah wajah laki cakep
925,pakai skincare tidur ujungnya luntur air mata wkkw,pakai skincare tidur ujung luntur air mata wkkw
926,mimin bisikin skincare kulit sempurna face temulawak membeli lazmall diskon sd hadiah menarik voucher diskon serbu tambahkehidupmu,mimin bisikin skincare kulit sempurna face temulawak beli lazmall diskon sd hadiah tarik voucher diskon serbu tambahkehidupmu
927,membeli skincare gila macamni percayalah is more,beli skincare gila macamni percaya is more
928,hyaluronic acid hyaluronic acid senyawa skincare berfungsi menahan air kulit terhidrasi lembap kandungan ditemui produk perawatan kulit pelembap serum krim antipenuaan,hyaluronic acid hyaluronic acid senyawa skincare fungsi tahan air kulit hidrasi lembap kandung temu produk awat kulit lembap serum krim antipenuaan
929,lahh perli jual skincare jual jual air liur jual anything money perli cakap sengkek cakap lut dkt,lahh perli jual skincare jual jual air liur jual anything money perli cakap sengkek cakap lut dkt
930,jurusan pendidikan kimia beauty consultant salah brand skincare,jurus didik kimia beauty consultant salah brand skincare
931,rek ready skincare ori underprice freeong shopi order voc diskn shopi live by req,rek ready skincare ori underprice freeong shopi order voc diskn shopi live by req
932,beneran salah penyebabnya pemakaian skincare abal kulit tipis rambut tumbuh lebaturat,beneran salah sebab pakai skincare abal kulit tipis rambut tumbuh lebaturat
933,unit sugar daddy kaleng² skin care memakai up smpe tas memakai up dimodalin,unit sugar daddy kaleng skin care pakai up smpe tas pakai up dimodalin
934,penikmat konten memaknai informasi nangkepnya back to basic iya benernya tenangin kulit take action kulitku spkk ujungnya fokus basic skincare kondisi kulit udah oke,nikmat konten makna informasi nangkepnya back to basic iya benernya tenangin kulit take action kulit spkk ujung fokus basic skincare kondisi kulit udah oke
935,tauu lucu banget kocak echi ga masak bakar dapurnya ty gitu tabungan diabisin echi membeli skincare hilang bukunya,tauu lucu banget kocak echi ga masak bakar dapur ty gitu tabung diabisin echi beli skincare hilang buku
936,namanya realistis nder calon ngajak join income banget gaji nabung asset biaya operational rumah tangga kebutuhan wanita skincare baju lain-lain mkn calon penuhin,nama realistis nder calon ngajak join income banget gaji nabung asset biaya operational rumah tangga butuh wanita skincare baju lain mkn calon penuhin
937,tutty fruity mcm muncul motorola henfon rorine kasut beg avon mekap skincare okay,tutty fruity mcm muncul motorola henfon rorine kasut beg avon mekap skincare okay
938,lipbalm merk sunscreen skincare routine ges leebih bermanfaat,lipbalm merk sunscreen skincare routine ges leebih manfaat
939,terakhiir selagi gajian restock skincare,terakhiir selagi gaji restock skincare
940,berani pakai kosmetik skincare muka terduga susah ngatasinnya,berani pakai kosmetik skincare muka duga susah ngatasinnya
941,ortunya mengedukasikah anak anak dilarang menyentuh milik orang standar ganda nampar lakilaki bapaknya dimarahin warganet coba dibalik skincare mahal,ortunya edukasi anak anak larang sentuh milik orang standar ganda nampar lakilaki bapak dimarahin warganet coba balik skincare mahal
942,wkawka sadar kayaknya lemari es khusus skincare gasii,wkawka sadar kayak lemari es khusus skincare gasii
943,kejadian perhitungan membeli skincare memakai up jarang membeli offline kecamatan diskon diitung online ga event itungannya murah anak kost nyetok event gitu,jadi hitung beli skincare pakai up jarang beli offline camat diskon diitung online ga event itungannya murah anak kost nyetok event gitu
944,lek ngunu iya langsung panasi tambahan iya urep urep ku dewe duwek duwek ku dewe ga melok makani nukokno skincare ro ngopeni ae nyacat e ga kuiro kiro cangkeman koyok yok yok o ae mbe korea iya jek ngganteng korea,lek ngunu iya langsung panas tambah iya urep urep ku dewe duwek duwek ku dewe ga lok makan nukokno skincare ro ngopeni ae nyacat e ga kuiro kiro cangkeman koyok yok yok o ae mbe korea iya jek ngganteng korea
945,sebentar inituh harga paket treatment skincare paket treatment okelah segitu iya iya cari klinik quality udah cuy,sebentar inituh harga paket treatment skincare paket treatment oke segitu iya iya cari klinik quality udah cuy
946,nikah kuliah bicara mamah mu nder promo sopi membeli engga checkout pakai uang mamahmu gamungkin sebulan full checkout skincare sayang promonya ga,nikah kuliah bicara mamah mu nder promo sopi beli engga checkout pakai uang mamah gamungkin bulan full checkout skincare sayang promonya ga
947,jujur iyaa ngerasain alhamdulillah look better hrsnya protes orang cantik rajin skincare tingkatin value kekurangan nyalahin org value,jujur iyaa ngerasain alhamdulillah look better hrsnya protes orang cantik rajin skincare tingkatin value kurang nyalahin org value
948,clay masker pakai originote iya mencoba persatu produknya affordable sesuai membeli real ribuan,clay masker pakai originote iya coba satu produk affordable sesuai beli real ribu
949,serum bulumata berpengaruh lashboss originote gess perih,serum bulumata pengaruh lashboss originote gess perih
950,pakai peeling serum originote hasil berasa bersih muka komedoan iritasi udahan muka berasa lembut lumayan mencerahkan,pakai peeling serum originote hasil asa bersih muka komedoan iritasi udahan muka asa lembut lumayan cerah
951,permasalahan jerawat gampang kemerahan mencoba originote suka series sesuai kulit berjerawat,masalah jerawat gampang merah coba originote suka series sesuai kulit jerawat
952,sunscreen originote reformulasi ga perih mata teksturnya gel lotion ringan banget real spf pa melindungi kulit sinar uva uvb teruji invivo,sunscreen originote reformulasi ga perih mata tekstur gel lotion ringan banget real spf pa lindung kulit sinar uva uvb uji invivo
953,originote murah banget,originote murah banget
954,suka memakai bha charcoal clay masker originote murmer isinya sayy murah kualitasnya cakep x memakai kulit langsung bersih hasilnya ga langsung iya pakai clay mask gasi,suka pakai bha charcoal clay masker originote murmer isi sayy murah kualitas cakep x pakai kulit langsung bersih hasil ga langsung iya pakai clay mask gas
955,produk originate bagus kah,produk originate bagus kah
956,orang termakan produk skintific viral langsung mencoba emang bagus bangeett harganya lumayan mahal stop masuk originote harga murah surprisingly to baguuss hasilnya muka,orang makan produk skintific viral langsung coba emang bagus bangeett harga lumayan mahal stop masuk originote harga murah surprisingly to baguuss hasil muka
957,dapatkan harga spesial originote hyalucera moisturizer gel lazada,dapat harga spesial originote hyalucera moisturizer gel lazada
958,checkout originote,checkout originote
959,waah nonton video beware serangan umkm produk indo tiktok shop peta market barang diminati habis masukkan dupenya lbh murah salah satunya skintific kanada originote,waah nonton video beware serang umkm produk indo tiktok shop peta market barang mati habis masuk dupenya lbh murah salah satu skintific kanada originote
960,udah niat pakai originote skintific gbsa diem,udah niat pakai originote skintific gbsa diem
961,acne serumnya originote bau cincau mah da,acne serum originote bau cincau mah da
962,nder titip iya mencari moisturizer originote live checkout besok,nder titip iya cari moisturizer originote live checkout besok
963,hentinya mengeluarkan gebrakan iya originote,henti keluar gebrak iya originote
964,mjb toko live perhari kali cekout kakak checkout barang checkout originote ko motong yaa,mjb toko live hari kali cekout kakak checkout barang checkout originote ko motong yaa
965,mencoba originote,coba originote
966,cari serum niacin murce bolehh coba omg pakai barengan toner moist originote mantulita,cari serum niacin murce bolehh coba omg pakai bareng toner moist originote mantulita
967,blom mencoba membeli originote mesti kahabisan coba somethinc iya pengen cari teksturnya originote sebenernya membutuhkan serum nguatin bulu mata lumayan,blom coba beli originote mesti kahabisan coba somethinc iya ken cari tekstur originote sebenernya butuh serum nguatin bulu mata lumayan
968,terluv banget peeling serum originote pumpnya simple mudah dibuka ditutup sesuai banget bulanan mencerahkan,terluv banget peeling serum originote pumpnya simple mudah buka tutup sesuai banget bulan cerah
969,kurleb pake moist hyalucera originote jujur kulit lembab dibagian pipi lumayan kering tzone berminyak bruntusan jrng muncul gk nyesel nemuin moist,kurleb pake moist hyalucera originote jujur kulit lembab bagi pipi lumayan kering tzone minyak bruntusan jrng muncul gk nyesel nemuin moist
970,hadiah yuk produk org pemenang originote pl cleanser glutanex sheet mask rules follow like tweet like thread dibawah reply hadiah,hadiah yuk produk org menang originote pl cleanser glutanex sheet mask rules follow like tweet like thread bawah reply hadiah
971,lupa siapkan produk shopee mall sesuai gambar voucher coba sd min transaksi voucher muncul jam siapkan produknya halaman toko wings originote,lupa siap produk shopee mall sesuai gambar voucher coba sd min transaksi voucher muncul jam siap produk halaman toko wings originote
972,special bundle in originote pilih kit sesuai kebutuhan kulit wajah buruan check promo zonabelanja,special bundle in originote pilih kit sesuai butuh kulit wajah buru check promo zonabelanja
973,rekomendasiin moisturizer oily skin redness piepih jerawat on off pemakaian pribadi all eiem originote yaa terima kasih,rekomendasiin moisturizer oily skin redness piepih jerawat on off pakai pribadi all eiem originote yaa terima kasih
974,tolong banget rekomendasiin pemakaian pribadi harganya terjangkauu skintific eiem originote yaa terima kasih,tolong banget rekomendasiin pakai pribadi harga terjangkauu skintific eiem originote yaa terima kasih
975,sentuhan tambahin lips serum originote pakainya tap tap lips serum multifungsi banget memakai lip preptopper oke banget,sentuh tambahin lips serum originote pakai tap tap lips serum multifungsi banget pakai lip preptopper oke banget
976,lip prep koentji sblm pakai lip cream pakai originote lip oil diamin kurleb menit lip oil teksturnya wateryoil alias ringan ga berat lengket,lip prep koentji sblm pakai lip cream pakai originote lip oil amin kurleb menit lip oil tekstur wateryoil alias ringan ga berat lengket
977,iya originote bha charcoal clay mask lokal brand emang gada abisabisnya ciptain produk mantap ramah dikantong heran thing packagingnya tube plastik doff ukuran gede tutup bulat gemecc abiezz gtlt,iya originote bha charcoal clay mask lokal brand emang gada abisabisnya ciptain produk mantap ramah kantong heran thing packagingnya tube plastik doff ukur gede tutup bulat gemecc abiezz gtlt
978,skincare makeup preloved originote moisturizer kondisi originote toner kondisi originote serum kondisi cleora exfoliating gel kondisi dijamin ori milik pribadi bersih terawat safe packing jateng preloved,skincare makeup preloved originote moisturizer kondisi originote toner kondisi originote serum kondisi cleora exfoliating gel kondisi jamin ori milik pribadi bersih awat safe packing jateng preloved
979,lupa pantengin live originote flash sale rp,lupa pantengin live originote flash sale rp
980,nemuin sunscreen sesuai kusam habis diapply mahal nemu sunscreen affordable lembab muka ga whitecast ga kusam alhamdulillah mntep sunscreen originote,nemuin sunscreen sesuai kusam habis diapply mahal nemu sunscreen affordable lembab muka ga whitecast ga kusam alhamdulillah mntep sunscreen originote
981,originote lokal brand masuk drugstore lokal product price milik je,originote lokal brand masuk drugstore lokal product price milik je
982,berumur extra menjaga kulit wajah menunda penuaan memakai retinol membantu menghilangkan kerutan mata jujurly udah memakai retinol dr produk sebelah ga berpengaruh apaapa beralih originote,umur extra jaga kulit wajah tunda tua pakai retinol bantu hilang kerut mata jujurly udah pakai retinol dr produk belah ga pengaruh apaapa alih originote
983,originote diskon up to urutkan harga terendah,originote diskon up to urut harga rendah
984,pengen mencoba originote dear salicylic acid cr pict google,ken coba originote dear salicylic acid cr pict google
985,pakai lash brow serumnya originote pagi malam rajin bangett memakai in lash brow serum numbuhin bulu mata banget rontok penjepit bulu mata,pakai lash brow serum originote pagi malam rajin bangett pakai in lash brow serum numbuhin bulu mata banget rontok jepit bulu mata
986,originote harga special live diskon yuhuuww harganya tinggal ribuan ajaa cicamide facial cleanser face wash astachiol serum moisturizer hyalucera,originote harga special live diskon yuhuuww harga tinggal ribu ajaa cicamide facial cleanser face wash astachiol serum moisturizer hyalucera
987,retinol fungsinya umurku kerutan tipis dibawah mata hidung iya saranin bagus terpikirkan originote,retinol fungsi umur kerut tipis bawah mata hidung iya saranin bagus pikir originote
988,iya originote sunscreen spray sunscreen spray termurah dibawa bepergian oke banget travel friendly makan habis botol,iya originote sunscreen spray sunscreen spray murah bawa pergi oke banget travel friendly makan habis botol
989,rekomendasi eye serum eye serum originote eye serum something harga promo eye serum formula eye serum npure,rekomendasi eye serum eye serum originote eye serum something harga promo eye serum formula eye serum npure
990,doyan memakai up memakai mascara takut bulu rontok gundul rawat memakai in brow lash serumnya originote memakai pagi malam rutin tidur sehabis skincarean oo,doyan pakai up pakai mascara takut bulu rontok gundul rawat pakai in brow lash serum originote pakai pagi malam rutin tidur habis skincarean oo
991,syapaa pakai skincare originote hitam gratis ngetweet review produknya,syapaa pakai skincare originote hitam gratis ngetweet review produk
992,eh originote produknya oke mois retinol vitamin c mantap banget harganya affordable banget mahasiswa kaya akuu mencoba moisturizer originote ga beralih produk suka banget,eh originote produk oke mois retinol vitamin c mantap banget harga affordable banget mahasiswa kaya akuu coba moisturizer originote ga alih produk suka banget
993,start to romantizing your skin right noow finally mencoba serum inceranku originote txa dark spot serum hihii supeer bahagia __,start to romantizing your skin right noow finally coba serum inceranku originote txa dark spot serum hihii supeer bahagia
994,rutin pakai serum hyalu c retinol originote pelan kulit better teksturnya cpt nyerap sllu cepat cepat,rutin pakai serum hyalu c retinol originote pelan kulit better tekstur cpt nyerap sllu cepat cepat
995,no debat eyelash serum originote bulu mata lentik ga gampang rontok huhuu kerenn produk,no debat eyelash serum originote bulu mata lentik ga gampang rontok huhuu kerenn produk
996,pamer kayaknya lambat ga originote harga murah kukka share alhamdulillah harga segini nombok ongkos kirim worth iya,pamer kayak lambat ga originote harga murah kukka share alhamdulillah harga gin nombok ongkos kirim worth iya
997,lazflash extra spesial bundle originote produk cm brightening kit acne kit barier kit kit kit paket glade matic udah refil pcs,lazflash extra spesial bundle originote produk cm brightening kit acne kit barier kit kit kit paket glade matic udah refil pcs
998,kenalin masker suka originote suka masker muka mulus tipe masker gk narik muka kering tekstur lohh lembut banget pict,kenalin masker suka originote suka masker muka mulus tipe masker gk narik muka kering tekstur lohh lembut banget pict
999,sadar skincare routine mostly produknya originote produknya bagusbagus harganya kantong kering banget promo pokoknya luv banget originote,sadar skincare routine mostly produk originote produk bagusbagus harga kantong kering banget promo pokok luv banget originote
1000,clay mask ngangkat komedo kecilin poripori iya pakai originote charcoal bagus ga,clay mask ngangkat komedo kecilin poripori iya pakai originote charcoal bagus ga
1001,manfaat moisturizer originote ceratinol jely booster cica b hylucera harga promo,manfaat moisturizer originote ceratinol jely booster cica b hylucera harga promo
1002,buset dh keren wir salah tingkah g berpengaruh pengen mencoba brightening moisturizer originote iyain melulu pakai ngeliatin anw emang bagus moistnya kulit cowoku peduli skincare ckep btul,buset dh keren wir salah tingkah g pengaruh ken coba brightening moisturizer originote iyain melulu pakai ngeliatin anw emang bagus moistnya kulit cowoku peduli skincare ckep btul
1003,pakai produk originote facial cleanser toner serum mosturizer suncreennya beneran kulit sehat glowing nyangka harga affordable hasilnya keren gini theoriginote,pakai produk originote facial cleanser toner serum mosturizer suncreennya beneran kulit sehat glowing nyangka harga affordable hasil keren gin theoriginote
1004,paket hemat ukuran full size in originote kit pakai voucher,paket hemat ukur full size in originote kit pakai voucher
1005,ga mengerti brand produknya jatuh cinta yups originote ʚ in brow lash serum ɞ serum eyelash rban jatuh cinta banget kualitasnya oke harga super affordable,ga erti brand produk jatuh cinta yups originote in brow lash serum serum eyelash rban jatuh cinta banget kualitas oke harga super affordable
1006,pcs produk originote diskon pakai voucher,pcs produk originote diskon pakai voucher
1007,wajib lip prep memakai lippies hasilnya bagus memakai lip serum originote harganya murah kualitasnya oke,wajib lip prep pakai lippies hasil bagus pakai lip serum originote harga murah kualitas oke
1008,promo produk originote cek etalase live tokonya urutkan harga terendah halaman produknya,promo produk originote cek etalase live toko urut harga rendah halaman produk
1009,kulitku sensitif suka kemerahan pakai moist originote kulit sehat seneng banget nemuin produk sesuai kulitku sensitif,kulit sensitif suka merah pakai moist originote kulit sehat neng banget nemuin produk sesuai kulit sensitif
1010,jb skintific somethinc wardah senka azarine originote scarlett garnier garnier pcs iya harga voc live jatim gratong xtra,jb skintific somethinc wardah senka azarine originote scarlett garnier garnier pcs iya harga voc live jatim gratong xtra
1011,attention geess lip serum originote gk lembap cerah mari buktikan,attention geess lip serum originote gk lembap cerah mari bukti
1012,mencoba lip oilnya originote dry lips friendly banget bibir plumpyy lt,coba lip oilnya originote dry lips friendly banget bibir plumpyy lt
1013,beneran dehh habis pakai retinol originote kulit paginya mesti bersih cerahan mantap tu ga efek cekitcekit wajah w pakai retinol,beneran dehh habis pakai retinol originote kulit pagi mesti bersih cerah mantap tu ga efek cekitcekit wajah w pakai retinol
1014,finally wishlist check originote niaceramide sunscreen mist spf pa reapply enak banget matahari,finally wishlist check originote niaceramide sunscreen mist spf pa reapply enak banget matahari
1015,panas panasnya lupa pake sunscreen teman-teman andalan hri pake originote bcs bagus isinya,panas panas lupa pake sunscreen teman andal hri pake originote bcs bagus isi
1016,pembelian vit c originote sesuai vit c bekas jerawat bener² berkurang banget,beli vit c originote sesuai vit c bekas jerawat bener kurang banget
1017,originote udah sekian lambat mencari moist sesuai nemuin moist originote enak banget pakai kulit gradakan lembut lumayan lembab sesuai base memakai up memakai up nempel,originote udah sekian lambat cari moist sesuai nemuin moist originote enak banget pakai kulit gradakan lembut lumayan lembab sesuai base pakai up pakai up nempel
1018,pakai mugwort b clay stick mask originote produk layak emang bagus coba kulit oh iya skincarenya pakai toner serum moist originote,pakai mugwort b clay stick mask originote produk layak emang bagus coba kulit oh iya skincarenya pakai toner serum moist originote
1019,moisturizer originote segel sharing bundle orangnya gajadi take vitamin c price nett iya original membeli lazmall lazada pengiriman depok,moisturizer originote segel sharing bundle orang gajadi take vitamin c price nett iya original beli lazmall lazada kirim depok
1020,originote murah banget w heran produknya bagus bagus banget moistnya busett,originote murah banget w heran produk bagus bagus banget moistnya busett
1021,selldips start from originote skincare original dianter kos barang segel preloved monggo,selldips start from originote skincare original anter kos barang segel preloved monggo
1022,bala originote micellar water garnier sabun pyary sheetmask harganya ribu,bala originote micellar water garnier sabun pyary sheetmask harga ribu
1023,braw preloved originote segel exp rep iya pastiin kebuka makaci,braw preloved originote segel exp rep iya pastiin buka makaci
1024,sekian purnama cari moist sesuai finally nemu moist gk thick dry skin sumuk sumpah adem banget moistnya originote enaknya base makeup tahan lambat gitu,sekian purnama cari moist sesuai finally nemu moist gk thick dry skin sumuk sumpah adem banget moistnya originote enak base makeup tahan lambat gitu
1025,bli serum retinol originote pakek malam ndes,bli serum retinol originote pakek malam ndes
1026,nder skintype berminyak berjerawat skincare hasil kena racun base kulit mendingan banget facial wash wardah hydra rose toner hadalabo serum revox aa malam bio beauty lab pagi moist cosrx oil free sunscreen originote,nder skintype minyak jerawat skincare hasil kena racun base kulit mending banget facial wash wardah hydra rose toner hadalabo serum revox aa malam bio beauty lab pagi moist cosrx oil free sunscreen originote
1027,dipakai kecuali originote retinol byt colla iya ongkos kirim full ditanggung pemenang,pakai kecuali originote retinol byt colla iya ongkos kirim full tanggung menang
